,artist,listeners,playcount,bio_content
37,mau y ricky,164789,2213714,"For the past few years, Mauricio and Ricky Montaner had been busy writing songs for other artists like Thalía, Miguel Bosé, Diego Boneta, Yuridia, Leslie Grace, to name a few, until recently when they decided the songs they were composing would be for their EP titled Arte under the label of Sony Music.

The young duo, Mau y Ricky, sons of music icon Ricardo Montaner, have released the album's first single, ""Voy Que Quemo,"" a song they decided best represents the music that is coming out in the LP, expected to release in July. ""After writing so many songs, it just seemed natural to start recording an album,"" Ricky, 25, tells Billboard, speaking on behalf of the duo since Mau was on vocal rest. ""We have 10 songs and an 11th that is an instrumental track. 'Voy Que Quemo' seemed like the best song to release first, and we're feeling super excited and nervous.""

Mau y Ricky partnered with Latin Grammy winner Julio Reyes Copello to produce their album and credit him for allowing them to grow artistically and teach them about following their intuition. ""We've grown as producers and songwriters, thanks to him. We also learned that the intuition of an artist is so important and it's something that needs to be respected because your intuition will differentiate you from others. We learned to write for ourselves and put out songs that will represent who we are.""

And that's exactly what Mau y Ricky did. They followed their intuition after listening to their song ""Arte"" which was almost going to be pitched to Wisin, but Ricky says, ""It didn't feel right for another artist to sing this song."" Another man they have to thank for guiding them since they started composing at a very young age is their father, who has written hit singles like ""La Cima del Cielo,"" ""Déjame Llorar"" and ""Me Va a Extrañar.""

""We've written songs together, so working with him helps you grow a lot because he's a very hard critic. Every song I've written since I was 8 years old, I'd run it by him and he'd give me feedback. He actually just heard the final product of our album and he loved it, thank God. But the best thing is that he's a fan of ours and we're huge fans of him. Yeah, he's my dad, but I'm a huge Ricardo Montaner fan.""

Besides a new album, Mau y Ricky fans can expect to see them onstage soon as they go out on tour. ""We haven't toured in such a long time because we were busy writing for others then started working on this album, but the stage is our natural habitat and where we feel most comfortable."" <a href=""https://www.last.fm/music/Mau+y+Ricky"">Read more on Last.fm</a>. User-contributed text is available under the Creative Commons By-SA License; additional terms may apply."
38,casper magico,51552,504556,"Julio Alberto Cruz García (San Juan; Puerto Rico, 21 de junio de 1989) más conocido por su nombre artístico como Casper Mágico, es un rapero, cantante y compositor puertorriqueño de Reguetón y Trap Latino. Se hizo conocido en el 2017 al estrenar el sencillo «Te boté» en compañía de Nio García y Darell, que fue certificado de oro por la RIAA y también llegó a ubicarse en los primeros lugares de las principales listas de Spotify y de la revista de Billboard. Su sencillo «No te Veo» ha sido certificado platino por la RIAA al obtener numerosas ventas y descargar así como reproducciones en plataformas digitales. <a href=""https://www.last.fm/music/Casper+Magico"">Read more on Last.fm</a>. User-contributed text is available under the Creative Commons By-SA License; additional terms may apply."
39,los g4,13771,95661,
40,zion & lennox,0,0,
41,andy rivera,69196,624688,"Andrés Felipe Rivera Galeano nació en Pereira, hijo del cantante y compositor de música popular Jhonny Rivera y de Luz Galeano. Con su padre fue siguiendo el mismo paso de la música tempranamente a los 12 años, en los tiempos libres se dedicaba a la vocalización y al piano.

Su padre lo inclinó por la música aunque el escogió el género urbano. Su primer sencillo contó con el apoyo de su amigo Pipe Calderon y su productor Dj Cano quienes realizaron ""En Busca De Ella"".

Se dio a conocer tanto a nivel nacional como internacional con el éxito ""Te Pintaron Pajaritos"" junto a Yandar & Yostin, ​ superando las 100 millones de visitas en YouTube. ​ Teniendo éxito en países como Argentina, Chile, España contando con el apoyo de Juan Magan, Ecuador, Venezuela, Perú y por supuesto Colombia.

Luego de tanto éxito con ""Te Pintaron Pajaritos"" siguió su carrera con ""Por Todo Me Peleas"" ​ una canción muy bien acogida pero sin dudar no tuvo tanto éxito como la anterior, grabó una versión 'remix' con Riko ""El Monumental"", siguió creciendo su carrera lanzando ""Si Me Necesitas"" una canción que no sonó mucho, pero luego cuando grabó el remix con Baby Rasta & Gringo fue todo un éxito. ​

Hizo un salto cuando estrenó dos canciones junto a dos buenos exponentes del género urbano, los puertorriqueños Nicky Jam y Dálmata, primero Los Perros Se Enamoran fue escuchada en una buena parte de país ​ y Espina de Rosa la cual fue mucho más exitosa en todo el país teniendo cerca de 40 millones de reproducciones en YouTube y ocupando los primeros puestos del género urbano en Paraguay, Chile, Ecuador y Colombia. De la mano de Universal Music Spain entró con fuerza a España. ​

Para el 2014 no tuvo éxito en canciones suyas, pero sí ocupó los primeros puesto con canciones como ""Salgamos"" junto a Kevin Roldán y Maluma, a pesar de estrenar ""Hollywood"". Para finales del 2014 estrenó El Que la Hace la Paga junto a su padre Jhonny Rivera ​ y tiene en los primeros lugares ""Mañana"" al lado de la mayor exponente urbana de Colombia Karol G.

En 2015 el tema ""Será lo mejor"" en Colombia ya forma parte del Top Latin Songs de Monitor Latino donde ha escalado de posición durante las dos semanas que lleva presente. ​ El 11 de agosto lanzaría el remix de No Hay Razón Para Odiarte en colaboración a Yelsid y ""El rey del despecho"" Dario Gómez.

En el 2019 lanza su primera canción popular titulada Alguien Me Gusta junto a su padre Jhonny Rivera y Jessi Uribe siendo una de las canciones más sonadas en toda Colombia y a nivel internacional siendo el lanzamiento que él llevaba esperando para posicionarse nuevamente en los primeros lugares <a href=""https://www.last.fm/music/Andy+Rivera"">Read more on Last.fm</a>. User-contributed text is available under the Creative Commons By-SA License; additional terms may apply."
42,almighty,51772,981691,"Almighty is a hiphop supergroup of Babygrande Records. Their debut album Original S.I.N. (Strength in Numbers) was released on July 22nd 2008 with  Babygrande Records. 

Almighty, the Wu-Tang affiliated supergroup consists of Killah Priest, Bronze Nazareth, C-Rayz Walz, Son One, M-Eighty, 5-Star and more, offer their debut collaborative effort: ""Original S.I.N. (Strength in Numbers)."" 

Boasting a supergroup collective rivaling any crew of independent MCs and beatmakers,  Almighty is prepared to change the face of the independent hip-hop landscape. Also featuring artists such as Canibus, Keith Murray, Planet Asia, Holocaust, Hussein Fatal (Tupac's The Outlawz), Almighty's ""Original S.I.N.""   is an attempt to rival such supergroup retail smashes as Army of the Pharaohs, Wu-Tang Meets The Indie Culture.

–

2) Almighty is a Cuban rapper and singer of the Latin urban genre and since 2019 of the Christian genre. <a href=""https://www.last.fm/music/Almighty"">Read more on Last.fm</a>. User-contributed text is available under the Creative Commons By-SA License; additional terms may apply."
43,pusho,17219,110457,
44,icon,51186,593949,"There are at least 7 bands of this name:

1) An American Hard Rock band from Phoenix, Arizona. Originally known as Schoolboys in 1979. Icon was formed in 1981 by high school friends Dan Wexler (guitar), Stephen Clifford (lead vocals) and Tracy Wallach (bass). They were joined by Dave Henzerling (guitar) and John Covington (drums).  In 1984, Icon was signed to Capitol Records. By this point, Henzerling and Covington had left the band and were replaced by John Aquilino (guitar) and Pat Dixon (drums) (former drummer for Loosely Tight)

2) A German Death Metal band that formed in 2002. In 2005 they released their first album ""Blindzone"". Their second album ""Pain Trust Lies Disharmony"" was released in 2009, limited to 521 copies.

3) A Sludge Metal band from Spain. Formed in 1999 releasing their ""Icon Demo"". The band changed their name and is now Ekkaia. 

4) A 90's German Trance project of Gerard Beraya

5) A Korean Hip Hop duo. Their first album ""ICONtact"", track song featuring Eun Ji won (G-ONE)

6) A Korean artist and actor, whose real name is No Min Woo and was formerly in a Korean band called TRAX.

7) Icon was a musical collaboration between John Wetton and keyboardist Geoff Downes. Wetton/Downes were the song-writing duo behind the Asia catalog including the mega hit 'Heat Of The Moment'. <a href=""https://www.last.fm/music/Icon"">Read more on Last.fm</a>. User-contributed text is available under the Creative Commons By-SA License; additional terms may apply."
45,corina smith,24106,517805,"María Corina Smith Pocaterra better known as Corina Smith, is a Venezuelan singer, actress and model.
Born: September 8, 1991 (age 28 years), Caracas, Venezuela <a href=""https://www.last.fm/music/Corina+Smith"">Read more on Last.fm</a>. User-contributed text is available under the Creative Commons By-SA License; additional terms may apply."
46,boza,136680,1495078,
47,natti natasha,306648,4361358,"Natalia Alexandra Gutiérrez, known by her stage name Natti Natasha, is a Dominican reggaeton singer, songwriter, and actress. Hailing from Santiago de los Caballeros, Dominican Republic, Natasha grew up surrounded by endless musical influences and enrolled in Santiago’s School of Fine Arts at the age of seven where she developed her singing abilities, describing her time at the school as “one of the best of her life.” Her studio experience would begin as a teenager when she would record songs as a hobby and later alongside friends.

This all led up to her decision to make the biggest and riskiest move of her life, and that was to move to the United States. She settled in the Bronx, New York, or “the City of the Dreams and Dreamers” for young, aspiring musicians like her at the time. In a 2019 interview with Billboard, Natti called the move “one of the craziest moves anyone ever did in her family,” and that she often looks back at the decision and wonders what she was doing. Natti would hop from studio to studio, working without pay, but to her, this was a way to get her name out there. A producer friend from Santiago would soon step in and lend her his New York studio.

Natti’s first-ever break came when icon Don Omar signed her to his record label, the Orfanato Music Group, and the pair would go on to make history for years to come. Their collaborations “Dutty Love,” “Tus Movimientos,” “Perdido en tus Ojos,” and a “Hold Ya” remix with Gyptian made waves across Latin America and introduced the world to future reggaeton royalty. Her debut project, an EP titled “All About Me” was released on March 28, 2012.

Natti would continue to make big career moves throughout the years including her departure from Don Omar’s record label and signing onto Pina Records in 2016, but it wasn’t until 2017 when her big breakout would come once and for all. Not only did she record and release a collaboration titled “Otra Cosa” alongside the legendary Daddy Yankee, but she also released what was arguably the biggest song of 2017. “Criminal” featuring Ozuna became an instant hit upon its release, the music video amassing over 1 billion views in just five months and becoming the most watched music video by a female singer released that year.

2019 saw the release of her much-anticipated debut album, “ilumiNATTI,” on February 15. 15 tracks made up the project with two collaborations in total, “Te Lo Dije'' with Anitta and “Soy Mía” with Kany García. Standout track “La Mejor Version de Mi” would transform into a bachata hit with its remix featuring bachata king Romeo Santos.

Natti’s sophomore album titled “NATTIVIDAD” would be released two years later on September 24, 2021 with 17 tracks featuring several chart-topping collaborators such as Becky G, Maluma, and Prince Royce. The release was followed up by the six-episode docuseries titled “Everybody Loves Natti” which documented her pregnancy and relationship with fiancé Raphy Pina. The series premiered on November 19, 2021 on Amazon Prime Video and was generally well received. <a href=""https://www.last.fm/music/Natti+Natasha"">Read more on Last.fm</a>. User-contributed text is available under the Creative Commons By-SA License; additional terms may apply."
48,amenazzy,87875,1011298,"José Daniel Betances, or as he is better known, El Nene La Amenazzy, is a popular Spanish-language R&B artist known for hit singles like ""Me Hace Falta"" and ""Mugeriego."" <a href=""https://www.last.fm/music/Amenazzy"">Read more on Last.fm</a>. User-contributed text is available under the Creative Commons By-SA License; additional terms may apply."
49,yampi,20172,233170,
50,lyanno,77610,943286,"Edgardo Cuevas Feliciano (22 de abril de 1996) Nació en Puerto Rico. Cantante puertorriqueño, conocido por su nombre artístico Lyanno, nombre derivado de su segundo apellido (Feliciano). <a href=""https://www.last.fm/music/Lyanno"">Read more on Last.fm</a>. User-contributed text is available under the Creative Commons By-SA License; additional terms may apply."
51,j balvin,1405626,47612739,"José Álvaro Osorio Balvin (born May 7, 1985), known professionally as J Balvin, is a Colombian reggaeton singer. Balvin was born in Medellín, Colombia, where he became interested in music at a young age. At age 17, he moved to the United States and learned English, which influenced the music he would make later. He then returned to Medellín and gained local popularity by performing at various clubs around the city.

Though his music is primarily reggaeton, J Balvin has experimented with a variety of musical genres in his work, including electronica, house music, trap, and R&B. He has collaborated with artists such as Pharrell Williams, Major Lazer, and Sean Paul. Despite working with many English-speaking artists, J Balvin continues to sing almost exclusively in Spanish, and hopes to introduce Spanish-language music to a global audience. He is also noted for his eclectic and colorful fashion sense. 

Balvin's breakthrough came in 2014 with the single ""6 AM"" featuring Puerto Rican singer Farruko which peaked at. The song, along with the single ""Ay Vamos"", bolstered sales of his debut album La Familia. In 2016, he released Energia, which included the hit singles ""Ginza"", ""Bobo"", ""Safari"", and ""Sigo Extranandote"". In June 2017, J Balvin released the single ""Mi Gente"" with Willy William, which achieved international success and later reached one billion views on YouTube. This preceded the release of his fifth full-length album, titled Vibras, the concept for which was developed from the moment ""Mi Gente"" started ""connecting with audiences around the world,"" presented as a fusion of reggaeton with different worldwide styles and rhythms. It received favorable reviews from critics and audiences alike, with Juana Giaimo of The Guardian praising the sound of the reggaeton music on the album by calling it ""smooth"" and ""sensual"", and dubbing it the ""perfect party playlist, [which] confirms that the noisy style of early reggaeton hits such as Daddy Yankee's 'Gasolina' is slowly being left behind.""

He has also collaborated with Cardi B and Bad Bunny on the US Billboard Hot 100 number-one single ""I Like It"".  <a href=""https://www.last.fm/music/J+Balvin"">Read more on Last.fm</a>. User-contributed text is available under the Creative Commons By-SA License; additional terms may apply."
52,nicky jam,824489,11215604,"
Nick Rivera Caminero better known as Nicky Jam was born to a Puerto Rican father and a Dominican mother in 1980 in Boston Massachussets which he live in until he was six and moved to 
Barrio Obrero, P.R. He is a reggaeton artist known for hits like:
""Me Voy Pa'l Party"" ""Chambonea"" 
""No Soy Tu Marido"" ""I'm Not Your Husband"" which is a remix in spanglish of ""No Soy Tu Marido""
 <a href=""https://www.last.fm/music/Nicky+Jam"">Read more on Last.fm</a>. User-contributed text is available under the Creative Commons By-SA License; additional terms may apply."
53,sech,326846,6544893,"Carlos Isaías Morales Williams (born December 3, 1993), better known as Sech, is a Panamanian singer. In April 2019 he released his album Sueños, reaching number three on the Billboard Top Latin Albums chart. In an interview with Billboard, Sech mentioned El General being an influence for his music. He first reached popularity with his song ""Miss Lonely"", in 2017. <a href=""https://www.last.fm/music/Sech"">Read more on Last.fm</a>. User-contributed text is available under the Creative Commons By-SA License; additional terms may apply."
54,tainy,580322,23574234,"Marcos Efraín Masís Fernández (San Juan, 9 de agosto de 1989), conocido artísticamente como Tainy, es un productor musical, compositor y DJ puertorriqueño.1

Sobresalió en el género cooperando en la producción Mas Flow 2, a la edad de quince años, y posteriormente junto a Luny Tunes en el álbum Mas Flow: Los Benjamins a la edad de diecisiete.​ En una lista realizada por Billboard en 2021, fue incluido dentro de los mejores diez productores del siglo XXI.

En una entrevista, Tainy afirmó que su carrera se puede definir en tres momentos cruciales, partiendo por el éxito del álbum Barrio Fino de Daddy Yankee, que lo motivó a producir canciones y le permitió conocer al dúo Wisin & Yandel; mientras que los otros casos ocurrieron durante sus trabajos con J Balvin (Vibras) y Bad Bunny (X100pre), donde pudo experimentar y participar más en la composición, usando guitarras y pistas de synth-pop.​ En otras entrevistas afirmó que las oportunidades dadas en álbumes como Más Flow 2 y Pa'l Mundo le ayudaron a ""poner su nombre en el mapa"". <a href=""https://www.last.fm/music/Tainy"">Read more on Last.fm</a>. User-contributed text is available under the Creative Commons By-SA License; additional terms may apply."
55,alex sensation,86851,561981,
56,javiielo,43654,515996,
57,mike bahía,65592,797831,
58,cnco,414883,7788641,"CNCO is a Latin American pop boy band formed in December, 2015, after becoming the winning members of the first season of the La Banda singing competition series created by Simon Cowell and produced by Ricky Martin. The band has toured with Martin and their singles, ""Tan fácil"" and ""Quisiera"", charted well soon after their debut. They released their first album, Primera Cita on August 26, 2016.

On May 9, 2021, Joel Pimentel announced his exit from the group, citing desires to ""grow and explore new artistic venues"". The band announced they would continue as a quartet. Two months later, on June 22, the band released ""Toa La Noche"", their first song as a foursome. They collaborated with Alex Rose for the song ""Pa Que Guaye"", released on September 16. <a href=""https://www.last.fm/music/CNCO"">Read more on Last.fm</a>. User-contributed text is available under the Creative Commons By-SA License; additional terms may apply."
59,alex zurdo,15452,375645,
60,cazzu,151553,3552791,"Julieta Cazzucheli nació en 1994 en Jujuy (Argentina), rodeada siempre de un ambiente bastante folklórico. Fue en ese ambiente dónde comenzó a tener sus primeros contactos con la música. Estuvo en varios grupos de cumbia y lleva haciendo música desde hace catorce años.

Cazzu es una artista de música urbana que se caracteriza por haber sido siempre muy voluble. Ha trabajado muchos estilos durante toda su carrera, pero encontró en el trap y el reguetón su verdadero lenguaje. El trap es por definición un compendio de géneros aglutinados, y Cazzu conoce perfectamente todos y cada uno de ellos.


La trapera estudió cine, y su conocimiento de la estética visual le ha ayudado mucho a la hora de conformar la suya propia. Su estilo es desinhibición en estado puro. Cargada de energía, para dar caña con cada tema.

Cazzu, con temas suaves que invitan a bailar y a moverse, es conocedora de todos esos géneros tan interesantes que conforman el trap argentino. Por ello, la trapera es sin duda una de las reinas del trap latino e internacional.

Se presentó en el panorama con su primer tema Killa. Una canción que sienta unas bases muy claras, una carta de presentación como mujer empoderada, llena de espíritu underground. La artista se ha ganado el respeto de todos los artistas de trap del panorama latino, llegando a colaborar con muchos de ellos.

Sus colaboracion con Bad Bunny, Duki y Khea en LOCA y LOCA REMIX es un himno del trap mundial.

Sin duda, Cazzu, es una artista de pies a cabeza. Su presencia es poderosa y llena de arte propia. <a href=""https://www.last.fm/music/Cazzu"">Read more on Last.fm</a>. User-contributed text is available under the Creative Commons By-SA License; additional terms may apply."
61,dímelo flow,88934,829982,"Jorge Valdés Vázquez, más conocido como DJ Flow o Dímelo Flow, es un DJ y productor panameño afincado en Estados Unidos.​ <a href=""https://www.last.fm/music/D%C3%ADmelo+Flow"">Read more on Last.fm</a>. User-contributed text is available under the Creative Commons By-SA License; additional terms may apply."
62,darell,161230,1546605,"One of the most sought-after artists from the latest wave of the Urban Latin movement, Puerto Rico native Darell emerged as both a sought-after composer in 2018, playing a definitive role in numerous hits and attracting a rapid fan base back home. Among many smashes, Nío García, Casper Mágico y Bad Bunny’s “Te Boté REMIX” [feat. Ozuna, Nicky Jam y Darell] stood out as one of the year’s most heard and streamed songs, spending 41 weeks on the Latin Airplay chart and peaking at #2. Not to mention, it held #1 on the Billboard Hot Latin Songs Chart for 11 weeks during a 41-week stay on the chart. Additionally, it generated a staggering 1.6 billion views and 658 million streams. He garnered his very first major nomination at a Latin award show for the song, being nominated for “Remix of the Year” at Premio Lo Nuestro.

To date, his collaboration with Brytiago, “Asesina,” has received over 347 million views and 186 million streams, while “Tu peor error” ignited 84 million views and 20 million audio streams. A key element in a string of hits, he has also written songs for the likes of Daddy Yankee, Nicky Jam, Anuel AA, Ozuna, Bad Bunny, and more. He regularly tours the U.S., Peru, Chile, Argentina, Colombia and beyond. <a href=""https://www.last.fm/music/Darell"">Read more on Last.fm</a>. User-contributed text is available under the Creative Commons By-SA License; additional terms may apply."
63,alex campos,27171,592026,"Born in Bogotá, Colombia, Alex Campos is a Christian musician who is reaching all of the Americas with the great news of Jesus and the unconditional love people can find in him.

He has recorded five albums, including the his most recent, the Grammy-nominated ""Cuidaré de ti"". His records have included other artistes such as Marcos Witt, Coalo Zamorano, Lilly Goodman and Jesús Adrián Romero.

He lives with his wife in his native Colombia. As part of Canzion group he is considered one of the newest promises in Latin American Christian music.

Listen to his musica at http://www.sempiternomusic.com
 <a href=""https://www.last.fm/music/Alex+Campos"">Read more on Last.fm</a>. User-contributed text is available under the Creative Commons By-SA License; additional terms may apply."
64,henry mendez,36015,233551,"Henry Méndez (full name Henry Antonio Méndez Reynoso) is a Dominican singer of reggaeton, rap, Latin house and dance, now based in Spain. He is best known for hits ""Chekete, chekete"" and found international success through his collaborations with Dr. Bellito and Mr R Rommel in ""El Masaje"" and ""Pukutu"", with Robbie Moroder in ""Subete la falda"" and most notably with DJ and producer Jose de Rico with the dance hits ""Te fuiste"" and ""Rayos de sol"". <a href=""https://www.last.fm/music/Henry+Mendez"">Read more on Last.fm</a>. User-contributed text is available under the Creative Commons By-SA License; additional terms may apply."
