,artist,listeners,playcount,bio_content
20,ñengo flow,197335,3570463,"Edwin Rosa, publicly popular as ""Ñengo Flow"" is a hip hop artist and composer of Puerto Rican music. Its fast and complex letters have referred to as the ""Real G"" urban type.

Flow Ñengo born on October 15, 1981 in the town of Rio Piedras. This great rapper grew and raised in the town of Bayamon, Puerto Rico. It is there since childhood he was interested the world of urban music. His beginnings as a rapper were developed with letters of the street, everyday living Edwin Rosa. His lyrics were born from the experiences of everyday life with their classmates and neighborhood. It is not until age 14 when Edwin Rosa was first presented on stage in the neighborhood where he lived in a community movement. There he discovered his mission and dream in life to be an advocate of life in the neighborhood and the street in your town vent to his experiences in his lyrics.

Years passed and flowed ""Ñengo Flow,"" baptizing in the name of a subject of their community. His beginnings as an artist releasing a ""Mixtape"" with colleagues and friends, came to be heard on Univision. In this way, Ñengo Flow draws its first album titled ""Flow Map"", thereby earning the respect of your most recent public craendo great fans that the sun today support it.

Ñengo Flow has been involved in a countless number of musical productions with large urban colleagues gender: Cambumbo (2005), DJ Joe - Abuse of Gender (2006), The Abnormal (2004) and sangrenueva (2005).

With ""Flow,"" Flow Nengo has worked with stars such as Don Omar, Julio Voltio, Arcangel, Yomo, Ivy Queen, Yaga y Mackie, De La Ghetto, among other pillars of the genre.

Success in career is just beginning Ñengo Flow. This great rapper with his team's work led MILLION RECORDS Ozuna businessman Lester (President) shall be sounded across the planet by 2010. His music has evolved and captivate the minds of many. New experiences and take ete sounds great artist of urban type, Ñengo Flow to conquer most recent land and leave your name throughout all the land captured. <a href=""https://www.last.fm/music/+noredirect/%C3%91engo+Flow"">Read more on Last.fm</a>. User-contributed text is available under the Creative Commons By-SA License; additional terms may apply."
21,jhayco,307196,10726690,"Jesús Manuel Nieves Cortez (born April 9, 1993), known professionally as Jhayco (formerly Jhay Cortez), is a Puerto Rican singer and rapper from Río Piedras, San Juan. After releasing multiple EPs, his debut studio album, Famouz, was released in 2019. The album contained features from J Balvin, Bad Bunny, Rafa Pabön, C. Tangana, Almighty, Tainy & Zion y Lennox. The album also contained his breakout songs No Me Conoce and No Me Conoce - Remix.

He released a deluxe version of the album titled Famouz Reloaded in 2020, with features from Haze, KAROL G, Myke Towers, Ozuna & Wisin y Yandel. This deluxe version also contained the song Como Se Siente which was remixed by Bad Bunny and included on his 2020 B-sides album LAS QUE NO IBAN A SALIR. Jhayco was also featured on Bad Bunny’s album El Ultimo Tour Del Mundo on the song DÁKITI.

In 2021, Jhayco released his album Timelezz which contained features from Kendo Kaponi, Arcangel, Myke Towers, Anuel AA, Skrillex and Buscabulla. This album gave Jhayco more hits such as Ley Seca, Dile (Homenaje) and Christian Dior. <a href=""https://www.last.fm/music/Jhayco"">Read more on Last.fm</a>. User-contributed text is available under the Creative Commons By-SA License; additional terms may apply."
22,camilo,309868,6098489,"Camilo Echeverri was the winner of XS Factor 2007 in Colombia. Camilo was born on the 16th March 1994 in Medellin, Colombia, but when he was 4 years old he moved to Monteria. <a href=""https://www.last.fm/music/Camilo"">Read more on Last.fm</a>. User-contributed text is available under the Creative Commons By-SA License; additional terms may apply."
23,brytiago,160178,2406754," <a href=""https://www.last.fm/music/Brytiago"">Read more on Last.fm</a>. User-contributed text is available under the Creative Commons By-SA License; additional terms may apply."
24,lunay,267333,4127094,"Lunay is a Puerto Rican reggaeton artist whose charting collaborations with artists such as Daddy Yankee, Anuel AA, Bad Bunny, and Zion & Lennox resulted in him scoring his own recording contract. 

Born in Puerto Rico in 2000, Lunay was far more interested in soccer than music as a young teen, but he caught the bug at 15. A year later, he was creating freestyle raps and uploading them to his Facebook and SoundCloud pages. Several of his audio clips went viral and caught the attention of producers Chris Jedi and Gaby Music, who signed him to a production deal on their Record Label - La Familia. 

Throughout 2018, he seldom left the studio except for the occasional live appearance. By the spring of 2019, he was all over the charts on his own and as a collaborator. His single, ""Soltera,"" landed at number 73 on the Hot 100, while its remix hit 28 on the Emerging Artists chart. He toured Europe during the early summer of 2019 and performed at the year's Premios Juventud Awards, winning one for Best New Artist. In late October, just 14 months into his career, he issued his debut lalbum, Epico. 

Lunay enlisted a slew of guests for various tracks including ""Mi Favorita"" with Wisin y Yandel, ""La Cama"" with Myke Towers, Aventura"" with Anuel AA and Ozuna, and the ""Soltera"" remix featuring Daddy Yankee and Bad Bunny.  <a href=""https://www.last.fm/music/Lunay"">Read more on Last.fm</a>. User-contributed text is available under the Creative Commons By-SA License; additional terms may apply."
25,rauw alejandro,740322,54237149,"Raúl Alejandro Ocasio Ruiz, known professionally as Rauw Alejandro, is a Puerto Rican singer and rapper. Referred to as the ""King of Modern Reggaeton"", he belongs to ""the new generation"" of Puerto Rican urban musicians. His debut studio album, Afrodisíaco, was released in November 2020. His second studio album, Vice Versa, released in June 2021, featured the lead single ""Todo de Ti"". He has won one Latin Grammy Award from four nominations.

Rauw Alejandro's music style includes Latin R&B, reggaetón, rhythmic pop and ballads. Billboard commented that it has helped ""set him apart from a growing class of pop-leaning reggaetoneros"". He was influenced early on by Presley and Jackson, and later by Ricky Martin, Daddy Yankee and Chris Brown. He also cites Ciara as a musical inspiration. <a href=""https://www.last.fm/music/Rauw+Alejandro"">Read more on Last.fm</a>. User-contributed text is available under the Creative Commons By-SA License; additional terms may apply."
26,beéle,92489,973833,"Brandon De Jesús López Orozco, mejor conocido como Beéle, es un cantante y autor enfocado en sonidos del caribe y el mundo urbano. Nacido en Barranquilla, Colombia, el cantante de 17 años empezó su carrera a los 13 años.

En el 2019, fue firmado por DJ Luian y Mambo Kingz: Hear This Music, con el tema “Loco” como su debut. Beéle ha colaborado con otros artistas, como Montano, Totoy, Farruko, Natti Natasha, Manuel Turizo, entre otros. <a href=""https://www.last.fm/music/Be%C3%A9le"">Read more on Last.fm</a>. User-contributed text is available under the Creative Commons By-SA License; additional terms may apply."
27,myke towers,508495,18185209,"Myke Towers, whose real name is Michael Torres, is a Puerto Rican rapper and composer born on January 15, 1994 in Río Piedras, Puerto Rico. Since his teenage years, Myke Towers has been involved in the underground rap scene in Puerto Rico under the name Mike Towers, and his first compositions and freestyles were published on his SoundCloud account. He gained recognition in 2014 with songs such as ""Día de cobro"", ""Por Mí"", ""Es Normal"" and ""En los Bloques"". He also gained attention in the urban music scene with his freestyle ""La Nueva Droga"" and his cover of the original song ""0 to 100"" by Drake.
In 2016, he released his first album project, the mixtape ""El final del principio"" , which gained recognition and reached the top of the iTunes chart. In 2018, he achieved success with the tracks ""No Pensarte"" with Juhn and ""Pa La Pared"" with Darell, in addition to collaborating on hits such as ""Darte"" and ""La forma en que me miras"".    In 2020, he released his second studio album, ""Easy Money Baby"", and continued to release hit singles and collaborate with various artists. In 2021, he released his album ""LYKE MIKE"", and continued to engage in successful collaborations. In 2023, he released ""LA VIDA ES UNA"". <a href=""https://www.last.fm/music/Myke+Towers"">Read more on Last.fm</a>. User-contributed text is available under the Creative Commons By-SA License; additional terms may apply."
28,piso 21,272067,4694532,"Juan David Castaño (el llanero), David Escobar (Dim), Juan David Huertas (El profe) y Pablo Mejía (Pablito), son los integrantes del grupo que ahora suena en las emisoras de la ciudad de medellin, Piso 21.

El mayor tiene solo 26 años y el menor 21. Son jóvenes, sí, pero ya son conscientes de su éxito y más que un grupo, ellos se consideran una familia, pues lo más importante, antes de cantar, es la unión y la lealtad a su amistad.

Todo comenzó en junio del año 2007 cuando se conocieron en un asado que organizó un amigo que tenían en común. Conversando se dieron cuenta de que los cuatro eran músicos y terminaron cantando hasta las 6 de la mañana.

Días después El Profe buscó a Dim y al Llanero y les propuso formar un grupo, pero Dim dijo que sí con la condición de que también incluyeran a Pablito, quien estaba de viaje en ese momento en Contadora, Panamá.

Fue tanta la emoción y la ansiedad por crear el grupo que inmediatamente llamaron a Pablito a Panamá y el aceptó sin dudarlo.

Paso a paso
Su segundo encuentro, o mejor dicho su primer ensayo, fue en el club house de un amigo del edificio San Mitchel, en el piso 21, desde donde se podía ver la ciudad d medellin completa. Este se convirtió durante varios meses en su ensayadero oficial y era allí donde pasaban noches enteras montando las canciones.

""Durante esas noches soñábamos con que algún día escucharían nuestras composiciones en todas esas casa que veíamos desde allá"", cuenta Dim.

""Y creo que lo estamos logrando, pero ahora la idea es que también nos escuchen en aquellas de las que solo veíamos la luz, arriba en las montañas"", continúa El Profe.

Su nombre
A la hora de pensar en cómo se llamarían, dieron muchas vueltas y hasta lo consultaron con sus familias y sus profesores.

Al principio le buscaron por el lado de sus iniciales o pensaron en jugar un poco con los nombres de David y Pablo, pero luego de intentarlo por muchos lados, se les ocurrió Piso 21, pues fue a esta altura donde realmente conformaron el grupo.

Pero a este nombre también le han encontrado una metáfora, pues según ellos, indica que para arriba es adonde quieren llegar, dando pasos lentos, pero seguros y muy largos.

Precisamente antes de empezar cada concierto, el grupo se reúne para gritar su frase favorita ""Piso 21, vamos pa'arriba papá"". <a href=""https://www.last.fm/music/Piso+21"">Read more on Last.fm</a>. User-contributed text is available under the Creative Commons By-SA License; additional terms may apply."
29,greeicy,102537,1595530,"Greeicy Yeliana Rendón Ceballos (born 30 October 1992) is a Colombian actress and singer.

She remained in Cali for the first five years of her childhood, until her parents, Luis Alberto Rendón and Lucy Ceballos, decided to move to Bogota. Since she was a child, she has an interest in interpretation and music, and took classes in acting, piano, flute, guitar and singing.

Her first participation in the screens, was in the 2007 edition of the reality show for talents children's Factor Xs, being sponsored by the singer and composer José Gaviria, and although she did not win,[2] the figuration in that program gave her opportunity to be she included in a casting, which meant entering the world of acting.[3] Her first role as an actress was in 2009 in the telenovela, Cuando salga el sol as Carolina Parra, the daughter of the main couple. The following year, she was chosen by Sergio Cabrera to play Sierva in the telenovela La Pola.

In January 2011, she plays Flor Porras in Correo de inocentes. Months later, she joined the cast of ¿Dónde está Elisa?, playing Marcela, adaptation of a homonymous Chilean telenovela of 2009.

In 2013, she played Johanna Barrera, in La prepago.[ Later, she was chosen by the producers of RCN Televisión and TeleVideo as the protagonist of Chica vampiro. The series premiered on May 14, 2013. Although it did not have a good audience in Colombia, instead it was a success in Italy and France.
In 2014, it was announced as the youth protagonist of the telenovela La ronca de oro, based on the life of the Colombian singer, Helenita Vargas. Also it was part of the Colombian version of The Wonderful Years, in Spanish titled Los años maravillosos. In 2015, she starred in Tiro de gracia.Then she was part of, Esmeraldas, where she played Paula Guáqueta Guerrero.

In 2016, she was in Las Vega's, Colombian adaptation of the Chilean series of the same name and was announced as one of the protagonists of the adaptation of the American series Revenge. RCN Televisión decided to postpone the premiere for 2017. The program finally debuted on March 2, 2017 in Argentina, on Channel El Trece and March 6 in Colombia, with the title of Venganza. <a href=""https://www.last.fm/music/Greeicy"">Read more on Last.fm</a>. User-contributed text is available under the Creative Commons By-SA License; additional terms may apply."
30,maluma,827775,23654646,"Juan Luis Londoño Arias (Born January 28, 1994, Medellín, Colombia), is a singer of Colombian nationality. He began his musical career at an early age in his hometown of Medellín, there has developed an established career in Latin America, becoming nominated for several awards from major musical relevance.

Prior to serving as a singer, Maluma started in football, a sport he practiced for eight years in a row, reaching the lower divisions of the equipment Atlético Nacional and La Equidad.In an interview with the newspaper El Universal, the artist spoke of what football left in his life: ""[...] the time came that things in football were getting difficult, some doors were closing in music instead many were opening"". Thus, at the age of 17 years, when he was a senior level of high school in your city native, the singer decided to start with the music. His debut single, ""Farandulera"" was released on radio stations Colombia.

After ""Farandulera"" It became a local radio hit, the label Sony Music and its subsidiary label in Latin Sony Music Colombia, decided to hire the singer to record their first studio album. So the seal launches next single ""Loco"" where was inspired by the quote rampant and uncontrolled love. The next single was ""Obsession"" which featured a music video to promote the theme, which was held at the Railway Station Antioquia Department and included the participation of Colombian model Lina Posada, who had previously participated in the music video for the song ""Taboo"" (2011) of Don Omar. So far the video has more than forty-two million views on YouTube.

He began his musical career in 2010, recording singles. In 2012 he signed an exclusive contract with Sony Music Colombia, that same year he released his first studio album, entitled ""Magia"". The album was promoted with the singles, ""Obsesión"", ""Miss Independent"", and ""Pasarla Bien"" which he reached the third place in the list of Colombian 'successes' National Report and became the first top Five performer on that list he was nominated for the SHOCK Awards 2012. as ""Best New Artist"" with all of them charting in Latin charts.

In 2013 the artist pitched the final two singles from his debut album; ""Primer Amor"" and ""Miss Independent,"" which had a promotional music video, recorded in Medellín and has more than fifteen million views on YouTube. Alternate visited this Peru, where he participated in the TV show Combate. In Colombia, the subject took second place in the list of successes National Report the number one issue was Como Le Gusta a Tu Cuerpo in Carlos Vives duet with Brazilian Michel Teló. The first single from the upcoming album artist is named ""La Temperature"", a duet with Puerto Rican singer Eli Palacios, which achieved the seventh position National Report.

The issue also became his first single to enter the US charts for the Latino audience of Billboard; theme debuted at thirty-eight position in the list Tropical Songs, and the thirty-six of 'position' Latin Pop Airplay, besides achieving fourth place in the ""Latin Rhythm Airplay"".

That same year the artist is nominated for several awards, including the Shock 2013 Awards in the category ""Best Song Radio"" with the theme ""temperature"", which eventually won, Shock 2013 as well as nominations in the 2013 MTV Europe Music Awards in the category Best Latin America Central Act and the Latin Grammy Awards of 2013 as Best New Artist, where the winner was the Guatemalan Gaby Moreno.

In 2014, He later launched his music videos ""La Curiosidad"", ""Addicted"" and ""Carnaval"" and collaborated with international artists like simple Elvis Crespo, on the theme ""Olé Brazil ', which he reached the top of the Tropical Songs list, which lasted a week in that position and ranked forty in Latin Airplay . Also collaborated on the theme ""I lived"" of Jorge Villamizar, which won the forty position Latin Airplay. At his young age, is already considered one of the greatest exponents of music reggaeton in Latin America. The artist under the label that oversees launch his second album Pretty Boy, Dirty Boy , with the manager Carlos Vives, Walter Kolm, in this album the artist explores rhythms like Merengue and Electronic.

On July 16, 2014, the singer appears in the show of the 2014 Premios Juventud., Where he first played at the ceremony ""La Temperatura"". That same month the singer is confirmed as a judge and coach of the musical program Caracol Television The Voice Kids, there will be next to Fanny Lu and Andrés Cepeda. In August debut as a presenter at the inaugural awards Nickelodeon Latin America, Kids' Choice Awards Colombia 2014.


 <a href=""https://www.last.fm/music/Maluma"">Read more on Last.fm</a>. User-contributed text is available under the Creative Commons By-SA License; additional terms may apply."
31,justin quiles,225181,3338998,"Justin Rafael Quiles Rivera mejor conocido en el ambito musical como J Quiles naciò en Marzo 29 del 1990 en la ciudad de Bridgeport Conneticut. J Quiles es un artista independiente el cual hasta el dia de hoy ha logrado ganarse el apoyo y amor de su fanaticada gracias a su talento natural. Ha logrado hacer canciones con artistas como Juno, Guelo Star, Divino el cual lo apadrino musicalmente hablando entre otros. Agradecido tambien con la ayuda de su equipo de trabajo que consiste de Los Hitmen que incluye a Kristian Ginorio mejor conocido con Lelo quien desde el principio le ha dado la mano y a creido en su talento, Emmanuel Infante mejor conocido por JazZ Hitmen es parte del binomio de productores de Lelo y JazZ productores de Live Music de Jowell y Randy los cuales actualmente estan trabajando el disco de Sobre Dosis de los mismo. Edwin Joel Lopez mejor conocido por Nenus quien es el ingeniero y el mas joven del grupo se encarga de todo lo que tiene que ve con las vocales de JQuiles. Fernando Lugo quien lleva una carga grande en lo que es todo lo visual desde las fotos hasta los videos de J Quiles. Christian A. Schmidt Guzman mejor conocido por Veterano propietario de NEF Studios es responsable de que J Quiles tenga la tranquilidad de trabajar su disco a disposicion de su tiempo sin interupciones y tambien esta a cargo de conseguirle un contrato con una casa disquera que lanse su carrera a nivel mundial e internacional. <a href=""https://www.last.fm/music/Justin+Quiles"">Read more on Last.fm</a>. User-contributed text is available under the Creative Commons By-SA License; additional terms may apply."
32,ryan castro,283169,5213126,"Ryan Castro es una de las nuevas caras del reggaetón y, aunque en sus videos juega con la clásica estética aspiracional de los carros de alta gama y las mansiones, su proyecto nació en el barrio Pedregal, al norte de Medellín. El colegio, las calles y los vecinos del sector pueden dar fe de cómo fue el comienzo de su historia.

Luego de salir del colegio, a los 16 años, se proyectó para hacer música a nivel profesional. Inspirado por las música y las películas que vio de 50 Cent, Eminem o Daddy Yankee, Ryan salió a buscar su primer público: los usuarios del transporte urbano.

“Empecé a cantar en los buses a los 17 años porque empecé a sentir la necesidad de hacer algo y ayudar a la familia. La experiencia fue muy bacana y enriquecedora porque me hizo ganar mucha confianza”, cuenta el paisa.

En los buses hacía covers de Kafu Banton, de Baroni One Time y una que otra composición original. Su segunda gran plataforma fueron las discotecas del Valle de Aburrá, donde también cantó sus propias canciones como Morena, que es un rap romántico, y Mi Styling, un dancehall.

Luego de tocar varias puertas y ver limitadas sus oportunidades tomó la decisión de irse del país para trabajar, ahorrar dinero e invertirlo en su proyecto. Llegó a Curazao y trabajó en hoteles y restaurantes. Cada peso que ganó lo usó para costear sus producciones y los videos musicales.

En Curazao grabó dos canciones y gracias al bendito internet logró que se sonaran en su natal Medallo. Muchos creyeron que Ryan era extranjero.

Esas canciones vincularon a Ryan con la compañía discográfica del caleño Kevin Roldán. Para 2021, su nombre estará dos veces en el nuevo álbum de Kevin Roldán y, además, lanzará su disco debut que lleva por nombre El Cantante Del Guetto, un homenaje a sus raíces y su barrio. <a href=""https://www.last.fm/music/Ryan+Castro"">Read more on Last.fm</a>. User-contributed text is available under the Creative Commons By-SA License; additional terms may apply."
33,wisin,379286,4313208,"Juan Luis Morera Luna, born 19 December 1978 (age 34), is from Cayey, Puerto Rico. Wisin is better known as a rapper and occasional singer of the Reggaetón genre, from Wisin & Yandel duo. <a href=""https://www.last.fm/music/Wisin"">Read more on Last.fm</a>. User-contributed text is available under the Creative Commons By-SA License; additional terms may apply."
34,cali y el dandee,118336,1597259,
35,bryant myers,135000,3415467,"Bryan Robert Rohena Pérez, known professionally as Bryant Myers, is a Puerto Rican Latin trap and reggaeton singer and songwriter. Rohena was born in Loma Alta, Puerto Rico. He began sampling and making his own songs in 2013 and launched them on social media via his SoundCloud, Instagram and YouTube accounts. <a href=""https://www.last.fm/music/Bryant+Myers"">Read more on Last.fm</a>. User-contributed text is available under the Creative Commons By-SA License; additional terms may apply."
36,de la ghetto,251777,2510973,"Rafael Castillo was born September 17 in New York. After residing in Seattle and Europe, his family decides to move to La Perla, Viejo San Juan, when he was a teenager. Son of a Puerto Rican mother and a Dominican father, who was killed when he was 6 months old, this young artist has gained the love of many fans due to the collaboration of many artists.  De La Ghetto gained his popularity when he first released his theme “Pégate” along with his former partner Arcangel in the album ""Sangre Nueva"" opening his doors to participate in other productions such as: “Sangre Nueva Special Edition”, Zion & Lennox “Motivando a la Yal: Special Edition”, “Las Gárgolas 5: The Next Generation”, “Los Rompediscotecas”, Luny Tunes “Los Benjamis”, DJ Nelson “Flow La Discoteka 2”, Zion “The Perfect Melody”, DJ Rafy Mercenario “The King of Remix”, Jowell & Randy “Casa de Leones”, Yaga & Mackie “La Reunión”, “Los Capo”, and “Los Sicarios”. Fans enjoyed more of De La Ghetto's talent after he recorded the video of the song “Sensación del Bloque” along with Randy and other videos such as; “Aparentemente”, “Siente El Boom” (a song with Tito ""El Bambino"" and Randy) and with promotional cuts such as ""Se"" and ""Your Body ft Zion"", and the remix of “5 Letras” with Alexis & Fido and his solo single “Pa’ Tras”. He also made ""Te Quiero"", a song for his baby girl, Angi. We can clearly see an evolution of such artist that can sing R&B and Hip-Hop in both languages. His future collaborational plans include featurings with artists like the likes of Timbaland, Beenie Man, Lil Wayne, Akon, Aventura, Toby Love and Robi ""Draco"" Rosa. At the moment, he's working on a tour that consists the following places: Panama, Europe, Ecuador, Colombia, Dominican Republic and all over the United States.
Currently he's working on his new album “Masacre Musical” (Musical Massacre) which he promises is a very varied album, bilingual and very “ghetto”. He also is working on his new movie “Ghettologia”, in whch would be recorded in La Perla and some other barrios of Puerto Rico. <a href=""https://www.last.fm/music/De+La+Ghetto"">Read more on Last.fm</a>. User-contributed text is available under the Creative Commons By-SA License; additional terms may apply."
