,artist,listeners,playcount,bio_content
155,b.i,280837,9429863,"Kim Han-bin (Korean: 김한빈; born October 22, 1996), known by his stage name B.I (Korean: 비아이) is a South Korean rapper, singer-songwriter, record producer, philanthropist, executive Director of IOK Company and CEO of 131 Label. He is the former leader, lead rapper and lead dancer of the kpop boy group iKon.

Hanbin was always interested in music and rapping. Starting a very young age, he was scouted at the age of 13 to be featured in MC Mong's song ""Indian Boy"". He was also featured in the music video ""Horror Show"" by the same artist. He joined YG Entertainment in early January 2011. He made appearances on Mnet ""WIN: Who Is Next"" in 2013 as well as ""Mix & Match"" and ""Show Me The Money"" in 2014, and debuted in iKon on September 15, 2015.

As the leader of iKon, B.I was credited with a role in the production and songwriting of all releases under the group. B.I also has songwriting credits for Epik High's ""Born Hater"", Winner's ""Empty"", Blackpink's ""Whistle"", and several songs on PSY's album ""4X2=8"".

On March 19, 2021, B.I released his first single album, ""Midnight Blue (LOVE STREAMING)"", under 131 Label, a subsidiary of IOK Company. All proceeds from the sound sources, recordings, and copyright of this album will be donated to support children in crisis across the globe through World Vision.

His single ""Got It Like That"", was released on May 14, 2021, featuring Destiny Rogers and Tyla Yaweh.

His first full album, ""WATERFALL"", was released on June 1, 2021, with the title track ""illa illa"".

His 1st solo mini album ""Love or Loved, Pt. 1"", released on November 18, 2022, includes the pre-single ""BTBT"" and the title track ""Keep me up"".

B.I's second studio album ""TO DIE FOR"", released on June 1st, 2023, shows all facets of emotions of dreams, love and life we experience during adulting.  On this album he collaborated with artists of different genres like  Jessi, Crying Nut, BIG Naughty, Kid Milli and Lil Cherry . <a href=""https://www.last.fm/music/B.I"">Read more on Last.fm</a>. User-contributed text is available under the Creative Commons By-SA License; additional terms may apply."
156,izzamuzzic,249648,3241143,"Izzamuzzic, real name Vadim Pavlyuchenko, is a Kazakh electronic musician, sound producer, composer from Kazakhstan, working in the genres electronic, deep house, future garage, downtempo, rock, hip hop, EDM. After graduating from music school, he began writing electronic music in late 2011, his second year at university.

At the early stage of creativity used two aliases izzamuzzic (for electronic music) and izzabeatzz (for hip-hop projects and arrangements), later he stopped selling beats and concentrated on his own tracks and all united in izzamuzzic (electronic music, production in different genres, remixes). izzamuzzic himself calls his style of music ""Azi"". <a href=""https://www.last.fm/music/IzzaMuzzic"">Read more on Last.fm</a>. User-contributed text is available under the Creative Commons By-SA License; additional terms may apply."
157,tory lanez,1552698,99214155,"Tory Lanez was born Daystar Peterson on July 27th, 1992 to his father, Sonstar Peterson and his mother, Luella Peterson in Toronto, Canada. At the age of 11, Tory discovered that his mother was ill with a rare disease that affects  four in every one million people. With the devastating loss of his mother and the absence of this father who is an ordained minister, Tory was forced to provide for himself at the early age of fourteen. Although his dad was not present in his everyday life, once when he was 16 years old he offered 10K if Drake listened and didn't like his music, that's how much he believed in himself. Tory Lanez is currently serving 23 years in jail for the July 2020 shooting of fellow rapper Megan Thee Stallion in the foot. Tory's most recent project, Lost Cause, released on October 4, 2024. <a href=""https://www.last.fm/music/Tory+Lanez"">Read more on Last.fm</a>. User-contributed text is available under the Creative Commons By-SA License; additional terms may apply."
158,tomorrow x together,973164,328402218,"TOMORROW X TOGETHER (pronounced ""tomorrow by together"", Hangul: 투모로우바이투게더), also known as TXT, are a South Korean boy group formed by BigHit Entertainment in 2019. The group is composed of 5 members (in order of reveal): Yeonjun, Soobin, Beomgyu, Taehyun, and Hueningkai. Their fandom name is [ b]MOA (Moments of Alwaysness)  which was announced on August 22, 2019.

The group debuted on March 4th, 2019, with the extended play The Dream Chapter: STAR (꿈의 장: STAR), with ""CROWN"" (""어느날 머리에서 뿔이 자랐다"") as the lead single.

After being delayed for two months, the group finally had their first comeback on October 21, 2019, with their first full album,  The Dream Chapter: MAGIC (꿈의 장: MAGIC), alongside the lead single ""9 and Three Quarters (Run Away)"" (""9와 4분의 3 승강장에서 너를 기다려"").

The Dream Chapter: ETERNITY (꿈의 장: ETERNITY) soon followed, and on May 18, 2020, the album was released alongside the lead single ""Can't You See Me?"" (""세계가 불타버린 밤, 우린..."").

On October 26, 2020, their extended play minisode1 : Blue Hour and the title track ""Blue Hour"" (""5시 53분의 하늘에서 발견한 너와 나"") was released.

On May 31, 2021, they released their second full-length album named  The Chaos Chapter: FREEZE , which consists of 8 songs, including the lead single ""0X1=LOVESONG."" On August 17, 2021, the group released their repackaged album, The Chaos Chapter: FIGHT OR ESCAPE, 3 months after the release of 0X1=LOVESONG. It included 3 new songs, with  LO$ER=LO♡ER  (pronounced ""loser lover"") as the third single overall from the album.

Nine months after the release of their repackaged album, The Chaos Chapter: FIGHT OR ESCAPE, the group returned with minisode 2: Thursday's Child, on May 9, 2022. ""Good Boy Gone Bad"" serves as the lead single. The extended play also features the first two unit tracks from the group, Lonely Boy (The tattoo on my ring finger) sung by Yeonjun and Hueningkai, and Thursday's Child Has Far To Go sung by Taehyun, Soobin, and Beomgyu, who produced the track. 

The group embarked on their first sold-out world tour, ACT: LOVESICK, on July 2, 2022. The ACT: LOVESICK tour featured several venues across the US, Japan, and Asia. The tour came to an end on October 28, 2022. 

To start 2023, on January 27, the group returned with their Billboard 200 chart-topping fifth EP, The Name Chapter: TEMPTATION (이름의 장: TEMPTATION) accompanied by lead single ""Sugar Rush Ride."" 

Shortly after the drop of The Name Chapter: TEMPTATION, the group announced their second world tour, ACT: SWEET MIRAGE. They are set to begin the tour on March 25, 2023.

On March 21, 2023, it was announced that the group would headline LOLLAPALOOZA 2023. In 2022, they became the first k-pop group in history to perform at the festival. TOMORROW X TOGETHER will be the first group to headline as well.

On June 7, 2023 they released  ""Do It Like That."" Which shocked many fans and non-fans due to the fact they collaborated with The Jonas Brothers. This single would embark on the teasing of their upcoming album.  

On September 12, 2023, they attended the VMAs marking this another milestone in K-pop. They unveiled a new song titled ""Back For More."" Featuring Anitta, this would mark their debut at the VMAs. They were nominated with four awards but only won the Push Performance of the year. 

Shortly after than on October 13, 2023, they released their third full album title   The Name Chapter: FREEFALL  the title track being ""Chasing That Feeling."" 

in March 2024 they announced their 3rd World Tour titled  Act: Promise  which lasted around 7 months. As of December 2, 2024 they have completed wrapping up in Osaka, Japan on December 1st.

Shortly after the announcement On April 1, 2024 they released their sixth Ep  minisode 3: Tomorrow  The title track was  ""Deja Vu."" Which would become their first comeback of the year.

On September 19, 2024 Yeonjun made his solo debut with the single titled  ""GGUM."" On October 3rd he would win first place on M Countdown making this the first ever award any of them have won solo. 

On November 4, 2024 they released their seventh Ep  The Star Chapter: Sanctuary which sets a new era for them. The feedback of this Ep was highly regarded as it debuted No.2 on the Billboard's Top 200 Album Chart making them the second K-pop Artist in history to land 6 different albums in the top five of the Billboard 200 and scoring 11 different entries overall. <a href=""https://www.last.fm/music/TOMORROW+X+TOGETHER"">Read more on Last.fm</a>. User-contributed text is available under the Creative Commons By-SA License; additional terms may apply."
159,asake,266975,5825670,"Ahmed Ololade (born 13 January 1995), known professionally as Asake, is a Nigerian Afrobeats singer and songwriter. He is signed to YBNL Nation and has an exclusive Distribution Deal with EMPIRE. His stage name ""Asake"" is his mother's name.

Asake often uses up-tempo AfroFusion and Amapiano styled in production. Some listeners have also described his style as close to AfroFuji / Afrobeats due to his singing in Yoruba and the use of slang in his songs.

He won the Best African Artist of the Year at the 2023 edition of the Vodafone Ghana Music Awards. <a href=""https://www.last.fm/music/Asake"">Read more on Last.fm</a>. User-contributed text is available under the Creative Commons By-SA License; additional terms may apply."
160,dylan conrique,127828,1422988,"Dylan Conrique is a multi-hyphenate entertainer, singer-songwriter, actress and dancer. Making her music debut in 2020, she has since established herself a source of inspiration and hope for her fans through her earnest approach to songwriting that showcases strength and vulnerability well beyond her 18 years. Dylan's breakout came in February 2022 with her viral hit ""Birthday Cake,"" which has amassedover 150 million streams since its release and earned Dylan the distinctions of People's Emerging Artist of 2022 and YouTube Music's Artist on the Rise. Written at the age of just 15, the poignant ballad tells the story of a loved one's passing and has been lauded as a cathartic reprieve from the grief of loss. Building off the success of the song, Dylan released her June 2022 follow up single ""i miss you (skin to skin),"" a yearning mid-tempo track that captures the universal experience of coming-of-age heartbreak.

Dylan first started her entertainment career on-screen. Currently, she stars as series regular Tamara Collins on the hit
ABC series The Rookie

Raised in Loomis, California, Dylan grew up among horses and spent Ome riding ATVs and motorbikes. She is of Mexican-American descent and currently resides in Los Angeles with her dog, Layla, and cat, Roper. <a href=""https://www.last.fm/music/Dylan+Conrique"">Read more on Last.fm</a>. User-contributed text is available under the Creative Commons By-SA License; additional terms may apply."
161,le sserafim,1104269,166470830,"LE SSERAFIM (르세라핌) are a South Korean girl group formed by Source Music and HYBE Corporation. The group consists of five members: Sakura (사쿠라 / 宮脇咲良), Kim Chaewon (김채원), Huh Yunjin (허윤진), Kazuha (카즈하),  and Hong Eunchae (홍은채). Originally a six-member group, Kim Garam (김가람) left the group on July 20, 2022, after the termination of her exclusive contract. 

The group's name, LE SSERAFIM, is an anagram of the phrase ""I'm Fearless"" as well as a reference to the heavenly beings with six wings, seraphim.

The group debuted on May 2, 2022, with the release of their first EP, FEARLESS, alongside the lead single of the same name. The EP broke the record for the highest-selling debut album by a K-pop girl group in first-day sales.

It was followed on October 17 with their second EP titled ANTIFRAGILE, which marked their first release as five members, following Kim Garam's departure. It became the group's first release to sell over a million copies and made them the fastest K-pop girl group to debut on the US Billboard 200. Both EPs' title tracks reached the top ten of South Korea's Circle Digital Chart and were certified platinum for streaming in South Korea and Japan. On November 24, Hybe released a webtoon, titled Crimson Heart, based on the group's message to ""advance without fear"" through the platform Webtoon.

On December 14, 2022, LE SSERAFIM released the Japanese version of their debut track ""FEARLESS"", making it the group's first Japanese release. The first Japanese single album was released on January 25, 2023. It contained Japanese versions of ""Fearless"" and ""Blue Flame"", along with an original Japanese song, ""Choices"". ""Choices"" served as the theme song for Japanese drama 3000 Yen: How to Enrich Life. 

Their first studio album titled UNFORGIVEN was released on May 1, 2023. It marked their first number-one album on the Circle Album Chart and their first top-ten album on the Billboard 200. The album's singles ""Unforgiven"" and ""Eve, Psyche & the Bluebeard's Wife"" peaked at number two in South Korea and were certified gold for streaming in Japan. The group's first English single ""Perfect Night"" (2023) became their first number-one song on the Circle Digital Chart, topping the chart for six weeks. In 2024, Le Sserafim earned their second number-one album in South Korea and top-ten album on the Billboard 200 with their third extended play Easy. The EP's title track was their first entry on the US Billboard Hot 100.

In June, it was announced that the group would embark on their first tour, Flame Rises, beginning in August. On July 25, the group released their second original Japanese song ""Jewelry"" from their second Japanese single, Unforgiven. The single, released on August 23, also featured Japanese versions of ""Unforgiven"" and ""Antifragile"".

On October 12, Source Music announced that the group would be releasing their first English-language digital single, ""Perfect Night"" on October 27 in collaboration with Blizzard Entertainment to promote Overwatch 2. An in-game event featuring cosmetics and game modes themed after the group ran from November 1 to November 20. The group performed at BlizzCon on November 4. On November 19, the group released ""Dresscode"", which serves as the theme song for the Japanese live-action television series adaptation of the manga series Sexy Tanaka-san.

On October 27, 2023, the group released an English single called ´Perfect Night´ which was a collaboration with the game Overwatch.

On January 22, 2024, it was confirmed that LE SSERAFIM would release the EP EASY on February 19. The English versions for the lead single of the same name and ""Smart"" were released on February 23 and March 22, respectively. In April 2024, the group performed at Coachella with Nile Rodgers, where they debuted a new song titled ""1-800-Hot-N-Fun"". The group confirmed in late June 2024 that a comeback was scheduled in August 2024. On July 10, the music-themed Grammy Museum in Los Angeles, California announced that a special K-pop exhibit will take place in August 2024, displaying the accessories and performance gear worn by artists under Hybe, including ILLIT, LE SSERAFIM, fromis_9, and BTS.

On August 5, it was announced that LE SSERAFIM would be releasing their fourth extended play titled CRAZY on August 30. The English version and various remixes for the lead single of the same name were released on September 2. The group's third Japanese single Crazy would be released on December 11. <a href=""https://www.last.fm/music/LE+SSERAFIM"">Read more on Last.fm</a>. User-contributed text is available under the Creative Commons By-SA License; additional terms may apply."
162,marco mengoni,119969,3970596,"Marco Mengoni is an Italian pop singer-songwriter who rose to fame in 2009, after winning the third season of the Italian talent show X Factor. Since that he has sold over 2.8 million records in Italy, topping the Italian albums chart seven consecutive times and entering the Top 10 Italian Singles Chart fifteen times.

He won the Sanremo Music Festival in 2013 (with ""L'Essenziale"") and again in 2023 (with ""Due Vite).

Mengoni has received several awards during his career, including two TRL Awards, nine Wind Music Awards, nine MTV Italian Music Awards, and a Nickelodeon Kid's Choice Award. In 2010 and 2015, he won the MTV Europe Music Award for Best European Act, becoming the first Italian artist to win that prize. In 2013, he also won the MTV European Music Award for Best Southern European Act.

He was also a participant in the Eurovision Song Contest 2023 representing Italy with his track 'Due Vite', placing 4th with 174 Points from the Public and 176 Points from the Jury. <a href=""https://www.last.fm/music/Marco+Mengoni"">Read more on Last.fm</a>. User-contributed text is available under the Creative Commons By-SA License; additional terms may apply."
163,salem ilese,440253,8342225,"salem ilese (also known as Salem / Salem Music / Salem Davern) is an American singer-songwriter creating music out of Los Angeles. She made her debut in 2018 with the single, ""Awake."" Ilese was originally born in San Francisco and attended Berklee College of Music in Boston for two years before dropping out to move to Los Angeles in order to pursue a career in music.  <a href=""https://www.last.fm/music/salem+ilese"">Read more on Last.fm</a>. User-contributed text is available under the Creative Commons By-SA License; additional terms may apply."
164,rym,3579,42559,
165,victony,204551,2796914,"Anthony Ebuka Victor (born 5 January 2001), known professionally as Victony is a Nigerian singer, rapper and songwriter.  He is from the Orsu local government area of Imo State. He was influenced while growing up by artist like davido, WizKid, M.I., Falz, etc, He is signed to a Nigerian record label called Mainland BlockParty and Jungle Records. He released a debut studio album Saturn, in August 2020. He released his first single titled Ina Benz, which was his first appearance in the music industry. <a href=""https://www.last.fm/music/Victony"">Read more on Last.fm</a>. User-contributed text is available under the Creative Commons By-SA License; additional terms may apply."
166,cornelia jakobs,74671,2099655,"Anna Cornelia Jakobsdotter Samuelsson (born 9 March 1992), known professionally as Cornelia Jakobs, is a Swedish singer and songwriter. The daughter of The Poodles' singer Jakob Samuel, she started her career as member of the girl group Love Generation, who participated in Melodifestivalen 2011 and 2012. Love Generation's 2011 entry ""Dance Alone"" peaked at place 26 on Sverigetopplistan.
She also auditioned for Idol 2008, and received some media attention after being mocked by the judges. In 2020, Jakobs composed and performed the song ""Weight of the World"" which became the soundtrack for the HBO Nordic series Björnstad. She participated in Melodifestivalen 2021 as a songwriter for the song ”Best of Me” performed by Efraim Leo.
In 2022, Jakobs went solo and participated in Melodifestivalen 2022, with the song ""Hold Me Closer"" which qualified for the final and later won with 146 points. She will represent Sweden in the Eurovision Song Contest 2022 in Turin. <a href=""https://www.last.fm/music/Cornelia+Jakobs"">Read more on Last.fm</a>. User-contributed text is available under the Creative Commons By-SA License; additional terms may apply."
167,ruger,78711,1575039,
168,gazo,105061,6517258,"Gazo is a rapper of Guinean origin based in France. Originally from Saint-Denis (93), he has been rapping since a young age and currently has his own label, BSB. According to some sources, he is part of a gang to which he often refers in his songs, the MaLaGangX. <a href=""https://www.last.fm/music/Gazo"">Read more on Last.fm</a>. User-contributed text is available under the Creative Commons By-SA License; additional terms may apply."
169,cheba warda,4670,60643,"In arabic شابة وردة (born in Algeria ,Oran, on January 9, 1970) is an algerian rai  (algerian pop ) singer who gained wide fame and a huge audience from the Maghreb and Arab world. 


Can be found under these artist names:
Cheba Warda 
Warda Charlomanté
Cheba Warda Charlomanté
Warda Charlomanti
Cheba Warda Charlomanti
شابة وردة
شابة وردة شارلومانتي
 وردة شارلومانتي <a href=""https://www.last.fm/music/Cheba+Warda"">Read more on Last.fm</a>. User-contributed text is available under the Creative Commons By-SA License; additional terms may apply."
