,artist,listeners,playcount,bio_content
54,beyoncé,5899482,549753861,"Beyoncé Giselle Knowles-Carter is an American singer, songwriter, businesswoman, and actress. Beyoncé performed in various singing and dancing competitions as a child and rose to fame in the late 1990s as the lead singer of Destiny's Child, one of the best-selling girl groups of all time. Beyoncé herself is the best-selling black female musician of all time and second best-selling female artist of all time, behind only Madonna. With 35 wins and 99 nominations from the Grammy Awards for her music (including her work in Destiny's Child and The Carters), she is the most-awarded and most-nominated artist in Grammy history. She has sold over 350M records worldwide. Beyoncé is often cited as an influence by many artists who came after her.

Born and raised in Houston, Texas, Beyoncé began performing in local competitions at age 7, eventually forming the group Girl's Tyme in 1990 with help from her parents. This group would later become Destiny's Child in 1997. 

During the hiatus of Destiny's Child in 2003, Beyoncé released her debut solo album, Dangerously in Love, which became one of the most successful albums of that year, and signaled her viability as a solo artist. The disbanding of Destiny's Child in 2005 facilitated her continued success: her sophomore solo album B'Day, released in 2006, debuted at number one on the Billboard charts. Her third solo album, I Am… Sasha Fierce, was released in November 2008, and in 2009 she received 10 Grammy Awards nominations. On January 31, 2010, she won 6 Grammy Awards, breaking the record for most Grammy awards won by a female artist in one night; she previously held the record of five awards with 5 other artists. Following a career hiatus, Beyoncé released her fourth studio album entitled ""4"" on June 24, 2011, which debuted at number one on the US Billboard 200. 

2013 - 5th Album - ""BEYONCÉ""
On December 12, 2013, Beyoncé unexpectedly released her self-titled fifth studio album in the iTunes Store. Beyoncé called it a ""visual album"" as it includes 14 songs and 18 videos; each track corresponding with its music video, as well as additional bonus videos. The album has a list of collaborators including Drake, Frank Ocean, her husband, Jay-Z, and daughter, Blue Ivy.

2015
In February 2015 at the 57th Grammy Awards, Beyoncé was nominated for six Grammy awards and won three: Best R&B Song and Best R&B Performance for ""Drunk in Love"", and Best Surround Sound Album for BEYONCÉ.

On April 4th, 2015, Beyoncé surprised her fans with the release of a new single and accompanying video, released exclusively on the streaming service ""Tidal"" which she co-owns with several other big-name stars including Arcade Fire, Daft Punk, Jack White, Kanye West, Madonna, Rihanna and Usher. The track, ""Die With You"" is a stripped-down ballad, with Beyoncé sitting at a piano with pigtail braids: the song celebrates the seventh anniversary of her marriage to Jay-Z.

Super Bowl - February 2016
Beyoncé appeared on stage to perform her, at-the-time, latest single ""Formation"", supporting the headline act Coldplay at the much coveted Super Bowl 50 half-time show on February 7, 2016. Also appearing on stage were Bruno Mars and Mark Ronson who performed their hit ""Uptown Funk"".

2016 - 6th Album - ""Lemonade""
""Lemonade"" is Beyoncé's sixth solo album and was released on April 23, 2016, exclusive to the music streaming service Tidal, after it premiered on the TV Network, HBO, as a conceptual short film. It was subsequently made available for purchase via digital platforms on April 24, 2016. The album has 12 tracks, with contributions from artists such as James Blake and Kendrick Lamar. According to a press release from Tidal accompanying the release, ""Lemonade"" is “based on every woman’s journey of self-knowledge and healing”.

2017 - Grammy Awards
At the 59th Grammy Awards on Sun, February 12, 2017, Beyoncé took awards for ""Best Urban Contemporary Album"" for ""Lemonade"" and ""Best Music Video"" for ""Formation""

2022 - 7th Album - ""RENAISSANCE"" (ACT i) 
After a 6 year hiatus from music, Beyoncé announced the lead single  ""BREAK MY SOUL""  on June 20, 2022, for her seventh studio album “RENAISSANCE"" which is the first installment of a three-part project. ""RENAISSANCE"" was released on July 29, 2022, and was recorded during the COVID-19 pandemic, seeking to inspire joy in listeners. The album debuted at #1 on the Billboard Hot 100. It became the best-rated album of 2022, named the best album of the year by publications such as the Los Angeles Times, The New York Times, NPR, Pitchfork, and Rolling Stone, which would later place the record at number 71 on their 500 Greatest Albums of All Time list. It then was nominated for Album of The Year at the 65 Annual Grammy Award Show and won Best Dance/Electronic Album.

2024 - 8th Album - ""COWBOY CARTER"" (ACT ii) 
2 years after her seventh studio album, ""RENAISSANCE"", Beyoncé released her eighth studio album ""COWBOY CARTER"" also known as “ACT ii” on March 29, 2024. This serves as the second installment of the three-part project, and as long rumoured, its genre is country. The album was teased through a Verizon ad aired during the Super Bowl LVIII and was preceded with two surprise singles both released on February 10, 2024, ""TEXAS HOLD 'EM""  which hit #1 on the Billboard Hot 100 and ""16 CARRIAGES"". The album broke several streaming records and debuted at number one in several countries globally.  ""TEXAS HOLD 'EM"" became the first country song by a black woman to top the Billboard Hot 100 and Hot Country Songs charts, respectively. COWBOY CARTER was met with universal acclaim upon release; critics felt that the album's genre experimentation, expansive scope and eclectic references aided an ambitious reimagining of Americana and country through the lens of its black roots. The album also ignited discussions on Black musicians' place within country music, boosted the listenership of Black country artists and country radio in general, and increased the popularity of Western wear and culture.

On February 2, 2024, at the 67th Annual Grammy Awards, COWBOY CARTER became Beyoncé's first release to win the Album of the Year award.

Miscellaneous
Beyoncé began her acting career in 2001, appearing in the musical film Carmen: A Hip Hopera. In 2006, she starred in the lead role in the film adaptation of the 1981 Broadway musical Dreamgirls, for which she earned two Golden Globe nominations. 

On April 4, 2008, Beyoncé and Jay-Z were married in a small, private ceremony in New York. On January 7, 2012, Beyoncé gave birth to a daughter, Blue Ivy Carter, at Lenox Hill Hospital in New York. Beyoncé is sometimes referred to as Jay-Z's wifey and/or,  Jay-Z's boo thang.

Beyoncé launched her family's fashion line, House of Deréon, in 2004, and has endorsed such brands as Pepsi, Tommy Hilfiger, Armani and L'Oréal. 

In 2009, Forbes listed Beyoncé fourth on its list of the 100 Most Powerful and Influential Celebrities in the World, third on its list of the top-grossing musicians, and number one on the list of top Best-Paid Celebs Under 30 with over 87 million dollars in earnings between 2008 and 2009.

Beyoncé has attained five Hot 100 number-one singles, becoming one of the two female artists—joint with Rihanna—with the most number ones attained within the 2000s, excluding her three Hot 100 number-one singles with Destiny's Child. <a href=""https://www.last.fm/music/+noredirect/Beyonc%C3%A9"">Read more on Last.fm</a>. User-contributed text is available under the Creative Commons By-SA License; additional terms may apply."
55,jax jones,823650,13103425,"
Timucin Fabian Kwong Wah Aluo (born 25 July 1987), known professionally as Jax Jones, is an English multi-instrumentalist, record producer, songwriter and DJ. He is best known for featuring on Duke Dumont's 2014 single ""I Got U"", peaking to number one on the UK Singles Chart, and his 2017 single ""You Don't Know Me"" featuring Raye. The son of two teachers, Jax grew up in a multi-ethnic household and was exposed to a wealth of influences. After his Nigerian stepfather introduced him to afrobeat via Fela Kuti and rap with a tape of the Biggie Smalls album, Jax listened to Hip Hop, R&B, Gospel and traditional African music. Producers like The Neptunes, Timbaland and Rodney Jerkins shaped his musical horizons and his fascination with the anatomy of a rhythm section. Having initially studied classical guitar from a young age, Jax took up beat-making at 15 after discovering Cubase on his friend’s Atari. <a href=""https://www.last.fm/music/Jax+Jones"">Read more on Last.fm</a>. User-contributed text is available under the Creative Commons By-SA License; additional terms may apply."
56,beabadoobee,1978103,200962617,"Beatrice ""Bea"" Kristi Ilejay Laus (born June 3, 2000), known as beabadoobee, is a Filipino-British singer-songwriter. She has formed her own independent, unique bedroom-acoustic sound pulling heartstrings with every beat. Her sensational melodies are influenced by artists like Alex G, Karen O and Florist.

She has released a collection of EPs (""Lice"", ""Patched Up"", ""Loveworm"", ""Space Cadet""), her debut full-length album ""Fake It Flowers"" in 2020, her sophomore album ""Beatopia"" in 2022, and her hit singles ""Glue Song"" and ""the way things go"" in 2023. Along with her EPs, albums, and singles, she's released songs featuring popular artists like Laufey, Clairo, Cavetown, PinkPantheress, and Luna Li. Her sound has evolved over the years, drawing influence from 90s alternative rock and space rock.

Beabadoobee's third studio album ""This Is How Tomorrow Moves"" debuted at #1 on the UK Official Charts, preceded by the singles ""Take A Bite,"" ""Coming Home,"" ""Ever Seen,"" and ""Beaches."" The record was supported through a US and Canada tour, as well as a sold out UK and EU tour. In 2025, Beabadoobee will return to the Coachella stage. <a href=""https://www.last.fm/music/beabadoobee"">Read more on Last.fm</a>. User-contributed text is available under the Creative Commons By-SA License; additional terms may apply."
57,suki waterhouse,1290437,35155387,"Alice Suki Waterhouse (born 5 January 1992) is an English actress, singer-songwriter and model. Waterhouse is best known for her role as Karen Sirko in the musical drama miniseries Daisy Jones & the Six. She released her debut album I Can't Let Go and the EP Milk Teeth in 2022.
Check her releases here: https://sukiwaterhouse.bandcamp.com/

Waterhouse was born in Hammersmith, London, and was raised in Chiswick, London, the daughter of Elizabeth, a cancer care nurse, and Norman Waterhouse, a plastic surgeon. She has a brother named Charlie, and two younger sisters, Madeleine, a model, and Imogen, a model and actress.

Waterhouse began a career in modelling at the age of 16, and she went on to model for several major fashion labels such as Burberry, Tommy Hilfiger, Laura Mercier and Ferragamo. Her first feature film as an actress was a minor role in Pusher, and she has since appeared in films such as Love, Rosie, The Divergent Series: Insurgent, The Bad Batch, Assassination Nation, and Detective Pikachu.

In September 2016, Waterhouse announced the launch of Pop & Suki, an accessories brand that she co-founded with her best friend Poppy Jamie and CEO Leo Seigal. Pop & Suki has since been featured in Vogue, Harper's Bazaar, W, and Elle. <a href=""https://www.last.fm/music/Suki+Waterhouse"">Read more on Last.fm</a>. User-contributed text is available under the Creative Commons By-SA License; additional terms may apply."
58,lizzy mcalpine,1015504,63871798,"Elizabeth Catherine McAlpine, also known as Lizzy McAlpine (born September 21, 1999) is a vocalist, songwriter, and musician who hails just outside of Philadelphia, Pennsylvania. She studied songwriting at Berklee College of Music located in Boston before leaving in her junior year to pursue music full-time. In April 2020, at the beginning of the COVID-19 pandemic, she started the Instagram #BerkleeAtHome streaming concert series. Her musical style has been described as ""folk-focused"", ""folk-pop"", and a blend of ""jazz, pop, and R&B"". Her collaborators include Jacob Collier, Tom Rosenthal, Ben Kessler, John Mayer,  and Finneas.

In 2018, McAlpine released her debut EP, Indigo. She studied in Spain in the fall of 2019, where she wrote her debut studio album, Give Me a Minute, where a mixture of pain, inner-conflict, and sorrow is expressed through Lizzy as she reflects on her past relationships. The album was released in August 2020 and it briefly hit #1 on the Top Albums for Alternative Music in iTunes. The album has been streamed millions of times on Spotify and other digital service providers. The Dallas Observer named it one of the best albums of 2020, and BBC Media Centre has called her an ""up-and-coming vocalist"". 

McAlpine has garnered supporters from TikTok and Instagram, with several publications calling her a ""TikTok star"". Her unreleased song you ruined the 1975, posted in June 2020, has over 8 million views on TikTok as of April 2021.

In April 2021, McAlpine released an 8-song EP, When the World Stopped Moving: The Live EP. The EP is characterized for consisting fully of live instrumentation and vocals, without major processing, it shows a path of growth in the singer’s songwriting and vocal abilities. 

She started 2022 as the opening act for dodie's Build a Problem North America Tour. On April 8, 2022, McAlpine released her second studio album, five seconds flat and premiered five seconds flat, the film on YouTube. The album debuted at number five on US Billboard Heatseekers chart, while also peaking at number nine on Alternative New Artist Albums and number 19 on Top New Artist Albums charts. She made her late-night debut on November 22, 2021, performing the single Erase Me on Jimmy Kimmel Live!. Following the release of her second album, McAlpine announced that she would be touring North America and Europe in 2022 on her first headline tour, five seconds flat the tour, with support from Carol Ades and Ben Kessler.

In November 2022, McAlpine announced dates for her second headline tour, the end of the movie tour, for spring of 2023.

She officially signed with RCA Records on April 6, 2023.

Her third studio album, Older, released April 5th, preceded by the singles ""Older"" and ""I Guess."" ""Older"" (album) met critical and commercial success and was accompanied by her third headline tour: ""The Older Tour,"" which met the U.S., Europe, and Australia. ""Older"" was recorded with a live band and performed live on tour with the same band, without any tracks. On tour, McAlpine performed two nights at Los Angeles's The Greek Theatre, Philadelphia's The Met, and New York's Radio City Music Hall. McAlpine also performed a majority of its tracks on festivals such as Bonaroo and Lollapalooza. <a href=""https://www.last.fm/music/Lizzy+McAlpine"">Read more on Last.fm</a>. User-contributed text is available under the Creative Commons By-SA License; additional terms may apply."
59,felix jaehn,730148,9407665,"Felix Jaehn (pronounced ""Yeahn"" /jɛːn/, born in Hamburg, Germany on 28 August 1994) is a German music producer and DJ specialising in deep house. He took violin lessons at age of 5 and began his DJ career at 16. Jaehn lived in London for a year, where he attended a music school at the age of 17.

Returning to Hamburg, he came to prominence in 2015 through his remix of Jamaican artist OMI's song ""Cheerleader"". The single was an international hit for him topping the charts in Germany, Austria, Belgium (Flanders and Wallonia), Canada, Denmark, France, Ireland, the Netherlands, Slovakia, Sweden, Switzerland, United Kingdom and the United States.

In April 2015, he released a remix of Rufus and Chaka Khan classic ""Ain't Nobody"" retitled ""Ain't Nobody (Loves Me Better)"" featuring the vocals of Jasmine Thompson (based on an earlier charting version of the song by Thompson). The remix was an international pan-European hit topping the German Singles Chart. <a href=""https://www.last.fm/music/Felix+Jaehn"">Read more on Last.fm</a>. User-contributed text is available under the Creative Commons By-SA License; additional terms may apply."
60,tom odell,1701641,38573802,"Tom Peter Odell is a British singer-songwriter from Chichester (UK), who studied at the Brighton Institute of Modern Music. Signed to Columbia Records, Odell made his television debut on November 30, 2012 as a performer on ""Later… with Jools Holland"" on BBC. He released his debut extended play, ""Songs From Another Love"", on October 15, 2012; with his first studio album entitled ""Long Way Down"" which was released on June 24, 2013 (Sept 17, 2013 in US).

It was announced on December 6, 2012 that Odell had been shortlisted for the BRITs' Critics' Choice award, announced as the eventual winner on December 20, 2012. Odell was also announced as one of fifteen nominees for the BBC Sound of 2013 poll.

2016 - Second Studio Album    On June 10, 2016, Tom Odell released his second studio album, ""Wrong Crowd"". The first 2 singles from the album were ""Wrong Crowd"" (April 4, 2016) and 
""Magnetised"" (April 15, 2016).

2018 - Third Studio Album    Odell's third studio album, ""Jubilee Road"", was released on Columbia Records on October 26, 2018. The first track released from the album was ""If You Wanna Love Somebody"". The album debuted at No. 5 in the UK. <a href=""https://www.last.fm/music/Tom+Odell"">Read more on Last.fm</a>. User-contributed text is available under the Creative Commons By-SA License; additional terms may apply."
61,dean lewis,801243,19523337,"Dean Loaney (born 21 October 1987), known professionally as Dean Lewis, is a singer/songwriter from Sydney, Australia.

Lewis is best known for his 2016 single ""Waves"", which was certified 7× Platinum in Australia in 2019, and his 2018 single ""Be Alright"", which reached number one in Australia and was certified platinum within four weeks of release, eventually reaching 11× Platinum in Australia and multi platinum worldwide, including double platinum in the United States.

He began writing songs at a young age and played in various bands before launching his solo career in 2014. He released his debut EP, ""A Place We Knew"", in 2015. The EP's lead single, ""Waves"", was a major hit in Australia, reaching number four on the ARIA Singles Chart.

Lewis's music is characterized by its catchy melodies, heartfelt lyrics, and blend of pop, folk, and soul influences. He has been praised for his powerful vocals and his ability to connect with his audience on an emotional level.

Lewis is currently touring in support of his debut album, ""A Place We Knew"", which was released in 2019. The album has been met with critical acclaim and has further solidified Lewis's status as one of Australia's most popular and promising young artists. <a href=""https://www.last.fm/music/Dean+Lewis"">Read more on Last.fm</a>. User-contributed text is available under the Creative Commons By-SA License; additional terms may apply."
62,nathan dawe,332017,3698858,"Nathan Dawe is an English DJ and producer. He is best known for his 2020 single ""Lighter"" featuring KSI, which reached #3 on the UK Singles Chart. <a href=""https://www.last.fm/music/Nathan+Dawe"">Read more on Last.fm</a>. User-contributed text is available under the Creative Commons By-SA License; additional terms may apply."
63,sean paul,2543158,35052847,"Sean Paul Ryan Francis Henriques (born January 9, 1973 in Kingston, Jamaica) is a Grammy Award winning reggae and dancehall singer and rapper. He released his debut solo album, Stage One, in 2000 and followed this in 2002 with Dutty Rock, which won the 2004 Grammy Award for best reggae album and generated four top twenty Billboard Hot 100 hits, including #1 'Get Busy'. His new cd, Tomahawk Technique, was released in February 2012 and has generated another hit ""She Doesn't Mind"".Also in 2012 he married Jodi Stewart and made some songs for here like body.
In 2005 he released his third studio album, The Trinity, and collected another #1 hit, 'Temperature'. Sean Paul's 2002 sophomore album, Dutty Rock, is his most successful, with 4 top 20 hits, including the worldwide smash ""Gimme The Light"", ""Get Busy"", ""Like Glue"" & ""I'm Still In Love With You"" were also huge hits, keeping the Dutty Rock album a best seller throughout 2003. ""Temperature,"" from his 2005 follow-up cd, The Trinity, was a Billboard #1 Hot 100 hit. 

Sean Paul has Portuguese heritage from his paternal grandfather, Sephardic Jewish heritage from his paternal grandmother, African heritage from his maternal grandfather, and Chinese heritage from his maternal grandmother. Both his parents are Jamaican natives. His nicknames include Zion Lion and King of Israel. Because of his mixed heritage, some consider him a personification of the Jamaican Motto ""Out of Many, One People"". Sean Paul's voice and style of singing is often compared to Jamaican 1990s dancehall sensation Super Cat.

He played for the Jamaican national water polo team and alleges to be related to King Solomon through his father.

In 1996, Paul and Spanner Banner recorded the Jamaican chart-topper, ""Ladies Man"", through the singer's Sweet Angel Productions. The song resulted in his embarking on sessions with Jeremy Harding, a then little-known producer who burst on the scene with his production of Beenie Man's crossover hit ""Who Am I"". The producer released the dancehall favorite ""Baby Girl."" The following single, ""Infiltrate"", joined the singer's combination hit in the Jamaican top charts.

A new version of Paul's ""Punkie"" track from the Dutty Rock album featuring Tego Calderón appeared on a recent (February 2005) Promo Only album with automaten spiele. April 2005's Promo Only Caribbean Series album included a new song by Paul (""We Be Burnin'""). Recently, Paul also collaborated with Nina Sky for his song ""Touch My Body"". Sean Paul has just recently released his new album, The Trinity. Sean Paul was a feature artist on Beyonce's number one hit, ""Baby Boy."" <a href=""https://www.last.fm/music/Sean+Paul"">Read more on Last.fm</a>. User-contributed text is available under the Creative Commons By-SA License; additional terms may apply."
64,tiësto,2833623,76134871,"Tijs Michiel Verwest, known professionally as Tiësto, is a Dutch DJ and music producer from Breda. He was voted ""the Greatest DJ of All Time"" by Mix magazine in a 2010/2011 poll amongst fans. In 2013, he was voted by DJ Mag readers as the ""best DJ of the last 20 years"". He is also regarded as the ""Godfather of EDM"" by many sources.

In 1997, he founded the label Black Hole Recordings with Arny Bink, where he released the Magik and In Search of Sunrise CD series. Tiësto met producer Dennis Waakop Reijers in 1998; the two have worked together extensively since then.

From 1998 to 2000, Tiësto collaborated with Ferry Corsten under the name Gouryella. His 2000 remix of Delerium's ""Silence"" featuring Sarah McLachlan exposed him to more mainstream audiences. In 2001, he released his first solo album, In My Memory, which gave him several major hits that launched his career. He was voted World No. 1 DJ by DJ Magazine in its annual Top 100 DJs readership poll consecutively for three years from 2002 to 2004.

Just after releasing his second studio album Just Be he performed live at the 2004 Summer Olympics opening ceremony in Athens, the first DJ to play live on stage at an Olympics. In April 2007 Tiësto launched his radio show Tiësto's Club Life on Radio 538 in the Netherlands and released his third studio album Elements of Life. The album reached number one on the Belgian album chart as well on Billboard Top Electronic Albums in the U.S. and received a nomination for a Grammy Award in 2008. Tiësto released his fourth studio album Kaleidoscope in October 2009, followed by A Town Called Paradise in June 2014. He won the Grammy Award for Best Remixed Recording, Non-Classical for his remixed version of John Legend's hit ""All of Me"" at the 57th Annual Grammy Awards. <a href=""https://www.last.fm/music/+noredirect/Ti%C3%ABsto"">Read more on Last.fm</a>. User-contributed text is available under the Creative Commons By-SA License; additional terms may apply."
