,artist,listeners,playcount,bio_content
100,newjeans,1356603,243085138,"NewJeans (뉴진스) now rebranded as NJZ (엔제이지) is a South Korean girl group formerly under ADOR, a subsidiary of HYBE Corporation. The group is composed of five members: Minji (민지), Hanni (하니), Danielle (다니엘), Haerin (해린) and Hyein (혜인). Mainly produced by Min Hee-jin, they are known for their 'girl next door' image and musical stylings reminiscent of the 1990s and 2000s.

The group debuted on July 22, 2022, with the single ""Attention"", their first number-one song on South Korea's Circle Digital Chart. It was followed shortly afterwards by two other singles, ""Hype Boy"" and ""Cookie"", with the former becoming the longest-running song on the Billboard Global 200 by a K-pop female act. The singles were all featured on their eponymous debut extended play (EP), released in August 2022. In January 2023, they released their first single album, OMG, to commercial success. It was accompanied by two singles, ""Ditto"" and ""OMG"". ""Ditto"" gained widespread popularity, becoming the longest-running number-one song on the Circle Digital Chart and the group's first entry on both the Billboard Hot 100 and the UK Singles Chart.
Their second EP, Get Up, peaked at number one on the US Billboard 200 and sold over one million copies in South Korea. Its lead single, ""Super Shy"", became the group's highest-charting single on the Billboard Global 200 (number two), the US Billboard Hot 100, and the UK Singles Chart. NewJeans has received rookie awards and was featured in listicles such as Time's Next Generation Leaders and Forbes's Korea Power Celebrity 40. IFPI named NewJeans the eighth best-selling artist worldwide in 2023. 

The group's name, NewJeans, has two meanings.  It alludes to the idea that jeans are a timeless fashion item and the group's intention to carve a timeless image for themselves. The name is also a word play on the phrase ""new genes"", referring to the group ushering a new generation of pop music. <a href=""https://www.last.fm/music/NewJeans"">Read more on Last.fm</a>. User-contributed text is available under the Creative Commons By-SA License; additional terms may apply."
101,mahmood,213418,8621806,"Alessandro Mahmoud (born 12 September 1992 in Milan), known by the stage name Mahmood, is an Italian singer-songwriter. His mother is Italian while his father is Egyptian. He won the 2019 Sanremo Music Festival on 9 February 2019 with the song ""Soldi"". He had earned a spot at the Sanremo Music Festival by winning the second night of the standalone Sanremo Giovani 2018 competition on 21 December 2018 with the song ""Gioventù bruciata"". He previously competed on the sixth series of the Italian reality television singing competition X Factor. 
As a result of winning Sanremo, Mahmood was offered the chance to represent Italy at the Eurovision Song Contest 2019, which he accepted. As a member of the Big Five Italy and Mahmood automatically qualified for the grand final, where he placed second in a field of 26. Achieving Italy´s best result since their return to the contest in 2011. <a href=""https://www.last.fm/music/Mahmood"">Read more on Last.fm</a>. User-contributed text is available under the Creative Commons By-SA License; additional terms may apply."
102,jung kook,1089956,594465617,"Jeon Jung Kook (Korean/Hangul: 전정국; born September 1, 1997 in Busan, South Korea), known monomously as Jungkook (stylized as Jung Kook) , is a South Korean singer, dancer, composer, and main vocalist of South Korean boy group.

He rose to prominence as a member and vocalist of the South Korean boy band BTS (Hangul: 방탄소년단), under Big Hit Entertainment. 

Debuted with BTS  on June 13, 2013, with the extended play 2 COOL 4 SKOOL and the title track No More Dream

He has performed three solo songs as part of BTS' discography— ""Begin"" in 2016, ""Euphoria"" in 2018, and ""My Time"" in 2020—all of which charted on South Korea's Gaon Digital Chart. He also recorded the soundtrack song ""Stay Alive"" for the BTS-based webtoon 7Fates: Chakho. 
In 2022, he was featured on American singer Charlie Puth's single ""Left and Right"", which peaked at number 22 on the US Billboard Hot 100. 

Later that year, he became the first South Korean artist to release an official song for the FIFA World Cup soundtrack with ""Dreamers"", which he subsequently performed at the 2022 FIFA World Cup Opening Ceremony. In 2023, Jungkook released his debut solo single ""Seven"" featuring Latto, which broke streaming and chart records, debuting at number one on the Billboard Hot 100, the Global 200, and the Global Excl. US charts, making him the first Korean solo artist to do so. His follow-up single ""3D"" featuring Jack Harlow reached the top five of the Billboard Hot 100 and made Jungkook the first South Korean solo artist to achieve two consecutive top-five entries on the UK Singles Chart. 

Jungkook's 'GOLDEN' , released in November 2023, is his highly anticipated solo debut album.  This album showcases his versatility as an artist, exploring various genres and highlighting his vocal prowess.  'GOLDEN ' is a collection of pop tracks with a touch of R&B and dance influences, reflecting Jungkook's musical tastes and artistic vision.  The album explores themes of love, passion, and ambition, offering a glimpse into Jungkook's personal and artistic journey.

'GOLDEN' achieved remarkable success, debuting at number two on the Billboard 200 chart, the highest debut for a K-pop solo album at the time.  It also topped the Billboard World Albums chart and achieved significant sales globally.  The album's pre-release singles, ""Seven"" (featuring Latto) and ""3D"" (featuring Jack Harlow), both achieved massive commercial success, topping the Billboard Hot 100 chart.  ""Seven"" also broke records for the fastest song to reach number one on Spotify's Global Chart.  GOLDEN's success solidified Jungkook's status as a global pop star and demonstrated his strong solo potential.


Jung Kook LastFM Related Pages: https://www.last.fm/music/Jung+Kook <a href=""https://www.last.fm/music/Jung+Kook"">Read more on Last.fm</a>. User-contributed text is available under the Creative Commons By-SA License; additional terms may apply."
103,mau y ricky,164789,2213714,"For the past few years, Mauricio and Ricky Montaner had been busy writing songs for other artists like Thalía, Miguel Bosé, Diego Boneta, Yuridia, Leslie Grace, to name a few, until recently when they decided the songs they were composing would be for their EP titled Arte under the label of Sony Music.

The young duo, Mau y Ricky, sons of music icon Ricardo Montaner, have released the album's first single, ""Voy Que Quemo,"" a song they decided best represents the music that is coming out in the LP, expected to release in July. ""After writing so many songs, it just seemed natural to start recording an album,"" Ricky, 25, tells Billboard, speaking on behalf of the duo since Mau was on vocal rest. ""We have 10 songs and an 11th that is an instrumental track. 'Voy Que Quemo' seemed like the best song to release first, and we're feeling super excited and nervous.""

Mau y Ricky partnered with Latin Grammy winner Julio Reyes Copello to produce their album and credit him for allowing them to grow artistically and teach them about following their intuition. ""We've grown as producers and songwriters, thanks to him. We also learned that the intuition of an artist is so important and it's something that needs to be respected because your intuition will differentiate you from others. We learned to write for ourselves and put out songs that will represent who we are.""

And that's exactly what Mau y Ricky did. They followed their intuition after listening to their song ""Arte"" which was almost going to be pitched to Wisin, but Ricky says, ""It didn't feel right for another artist to sing this song."" Another man they have to thank for guiding them since they started composing at a very young age is their father, who has written hit singles like ""La Cima del Cielo,"" ""Déjame Llorar"" and ""Me Va a Extrañar.""

""We've written songs together, so working with him helps you grow a lot because he's a very hard critic. Every song I've written since I was 8 years old, I'd run it by him and he'd give me feedback. He actually just heard the final product of our album and he loved it, thank God. But the best thing is that he's a fan of ours and we're huge fans of him. Yeah, he's my dad, but I'm a huge Ricardo Montaner fan.""

Besides a new album, Mau y Ricky fans can expect to see them onstage soon as they go out on tour. ""We haven't toured in such a long time because we were busy writing for others then started working on this album, but the stage is our natural habitat and where we feel most comfortable."" <a href=""https://www.last.fm/music/Mau+y+Ricky"">Read more on Last.fm</a>. User-contributed text is available under the Creative Commons By-SA License; additional terms may apply."
104,gims,267736,6216993,"Gandhi Bilel Djuna (born 6 May 1986), better known by his stage name Maître Gims and more recently just Gims, is a Congolese-French singer-songwriter and rapper. He grew up in France and currently lives in France and Morocco. He is a former member of the hip hop group Sexion d'Assaut and released his first major album, Subliminal in 2013. The album sold over a million copies in France and peaked at number two in the Syndicat National de l'Édition Phonographique. His other two albums follow: Mon cœur avait raison in 2015 and Ceinture noire in 2018 reached number one in France and Belgium (Wallonia) and peaked in the top 40 in various European countries, including Denmark, Italy and Switzerland.

In 2018, he was the 7th most performed artist in the world on Deezer. During his career he has worked with several international artists such as Sia, Pitbull, Lil Wayne, Stromae, Maluma, Sting and others. 

In 2020, he won the International Artist of the Year in Distinctive International Arab Festivals Awards after his featuring in Mohamed Ramadan's song ""Ya habibi"". On 17 September 2020, Netflix released a documentary about the last ten years of his career titled Gims: On the Record. <a href=""https://www.last.fm/music/Gims"">Read more on Last.fm</a>. User-contributed text is available under the Creative Commons By-SA License; additional terms may apply."
105,lojay,94942,987592,"Lekan Osifeso Jr, is a multi talented, dynamic Nigerian singer-songwriter and performing artist who has cemented himself as an afro-fusion sensation since his debut in 2016. 

Gangster Romantic is an introduction to the turbulent world of Lojay, marked by passionate affairs, in-depth reflection, acute fears, and romanticism. Lojay redefines himself on the 7– track follow-up to the well-received joint EP “LV N ATTN” with renowned producer Sarz. The artist known for slick, emotive vocals and sharp lyricism dives deeper into his craft, mining the edges of his darker emotions and expressing personal vulnerability in several melodic confessions.

The creative result is a moodier world, brimming with bouncy direction and effortless energy as he bares himself, leaving nothing behind. <a href=""https://www.last.fm/music/LoJay"">Read more on Last.fm</a>. User-contributed text is available under the Creative Commons By-SA License; additional terms may apply."
106,nessa barrett,808050,30188299,"American singer and songwriter from New Jersey. Barrett rose to prominence on the video-sharing app TikTok in 2019, though she has since transitioned into making music. Barrett began her music career in mid-2020 with the release of her debut single ""Pain"".[1] Barrett released her debut EP Pretty Poison in late 2021.

In 2019, Barrett joined the social media platform TikTok. Despite transitioning into music, Barrett has accumulated over 16 million followers on the platform as of July 2021.[3] Moreover, Barrett has garnered over 184 million likes on the platform and has had singles ""Pain"" and ""La Di Die"", featuring jxdn, used by over 89 and 75 thousand videos respectively.

Barrett began her music career in July 2020, when she released her piano-based ballad debut single ""Pain"". Barrett's debut single was released shortly after signing with Warner Records, the label reaching out and eventually signing her after discovering clips of her singing on TikTok.[4] Barrett continued her music career, intended to embody a ""punk, dark rock kind of vibe"", with the release of her dramatic second single and romantic-revenge anthem ""If U Love Me"" in October 2020.[5] Barrett shortly followed the release of her second single with a dark interpretation of Santa Baby, released in December 2020. In February 2021, Barrett released the dark anthem ""La Di Die"", which explores the downfalls of fame with fellow alt-pop artist Jxdn, produced by Travis Barker.[6][7][8] Barrett and collaborator Jxdn, along with Barker, performed the single live for the first time on the April 7, 2021 episode of Jimmy Kimmel Live! and performed the song again on The Ellen DeGeneres Show on April 12, 2021.

On June 25, 2021, Barrett released ""Counting Crimes"", a song said by Barrett to be ""about moving on from something toxic with an empowering bad bitch energy. Admitting that you have made mistakes, but the other person has done worse than you and understanding who really is the bad guy in the situation.""[9] Barrett confirmed on the Zach Sang Show in July 2021 that her debut EP is titled Pretty Poison. The EP is seven tracks and was released in Fall 2021.[2]

Singer-songwriter Nessa Barrett's Warner Records debut album, young forever, features edgy, gothic pop grounded in stories about heartache, mental health, and accountability. Writing and singing have always been the saving grace that helped Barrett feel less alone in the world and less alone with her thoughts as she battled demons from her past and mental health struggles, including borderline personality disorder and an eating disorder.

With young forever, Barrett embraces her internal and external conflicts, takes bleak thoughts, and expresses them bravely. ""I like the darkness in things,"" she says. ""I talk about a lot of things my generation is struggling with on this album."" From the moody single ""tired of california,"" where Barrett muses on the lack of authenticity in the City of Angels, to the psychological thriller-themed ""madhouse,"" which deliciously weaves synth with Barrett's manic melody, to the acoustic ""lovebomb,"" which finds Barrett singing about her struggles with BPD, young forever, is a dynamic debut rooted in reflection and raw emotions.

Punctuated by her grit-glam marvel, Barrett's music has intrinsically always been about empowering people who feel isolated. ""Growing up, I was very ashamed of my struggles, so the second I got a platform, I knew what I had to do with it because I didn't want anyone to feel the way I felt - alone."" With young forever, Barrett has crafted something truly special. <a href=""https://www.last.fm/music/Nessa+Barrett"">Read more on Last.fm</a>. User-contributed text is available under the Creative Commons By-SA License; additional terms may apply."
107,stromae,1652579,46645031,"Paul Van Haver (pronounced : pɔl vɑn ɦɑvər) (born 12 March 1985, Brussels), better known by his stage name Stromae [stʁɔmaj], is a Belgian musician, producer, singer, rapper and songwriter. Stromae was born to a Rwandan father, Pierre Rutare, and a Belgian mother, Miranda Marie Van Haver. He is originally from Laeken, in Brussels. He established himself in both the hip hop and electronic music genres. Stromae came to wide public attention in 2009 with his song ""Alors on danse"", which became a number one in several European countries. In 2013, his second album Racine carrée was a commercial success, selling 2 million copies in France alone and nearly 600,000 units elsewhere. He has sold over 8.5 million records worldwide. <a href=""https://www.last.fm/music/Stromae"">Read more on Last.fm</a>. User-contributed text is available under the Creative Commons By-SA License; additional terms may apply."
108,raye,1157600,31932951,"Hailing from South London, more specifically Croydon, RAYE (real name - Rachel Keen) is a British singer-songwriter. Aside from writing hits for other artists, RAYE has bounced between R&B, pop and dance music in regards to her own discography. Her debut album and one of her first independent releases ""'My 21st Century Blues'', was released on February 3 2023.

RAYE’s debut EP 'Welcome To The Winter' was released in 2014 and was comprised of predominantly R&B sounds. After signing with Polydor Records, RAYE had her breakthrough by featuring on the 2016 singles; ""By Your Side"" by Jonas Blue and ""You Don't Know Me"" by Jax Jones. The latter, co-written by RAYE herself, would peak at number three on the UK Singles Chart. Both songs were certified platinum or higher by the BPI, and marked a shift in RAYE’s career both commercially and sonically. After releasing the 'Second' EP in 2016, RAYE released ""I, U, Us"" as the lead single alongside a Charli XCX directed music video. This marked the first collaboration of several between the British songwriters. RAYE later co-wrote XCX's song ""After the Afterparty"" and appeared on a remix version, as well as featuring on the track ""Dreamer"" from her 2017 mixtape 'Number 1 Angel'. RAYE was short-listed for the BBC Music Sound of... award for 2017 and was named in third place. Later in the year, RAYE released the platinum certified hit ""Decline"" featuring Mr. Eazi, which would serve as the lead single from her 'Side Tape' EP which followed in May 2018. In October 2018, RAYE embarked on her own headlining tour, visiting a number of cities around the UK and Ireland. 

After releasing multiple singles in 2019 and 2020, RAYE’s debut mini-album, 'Euphoric Sad Songs' was released on 20 November 2020. The project featured the top 10 hit ""Secrets"" with Regard as well as ""Regardless"" with Rudimental. In early 2021, RAYE released the single ""Bed"" with Joel Corry and David Guetta. The song would peak at number three on the UK Singles Chart, becoming RAYE’s highest charting single as a lead artist on the chart. Later in the year, RAYE took to social media to reveal that her record label, Polydor Records, has been withholding her debut album for several years. Following the statements, RAYE disclosed in July that she is now officially an independent artist. 

RAYE was brought up in a musical family - her parents met at church - both of them musicians in the parish, and her musical heritage goes right back to her Grandfather, who was a songwriter and musician in his own right. Since the age of 10, she's been writing her own music, slowly developing all the time to become the artist she is today. Along the way, RAYE has become confidently adept at various different instruments including the cello, flute, and piano, alongside honing her production skills (and learning  to play the guitar). Music has always been a huge part of RAYE’s life. Brought up on the classic soul/jazz maestros of the 40's and 50's like Nina Simone, Ella Fitzgerald, Nat King Cole etc - this is where her love for songwriting and melody began. Since then her influences, have aligned with the times, citing Drake, and her all time hero Lauryn Hill as huge sources of inspiration. <a href=""https://www.last.fm/music/Raye"">Read more on Last.fm</a>. User-contributed text is available under the Creative Commons By-SA License; additional terms may apply."
109,george ezra,1287561,27683154,"George Ezra (full name George Ezra Barnett) is a British singer-songwriter from Hertford, England. Born on June 7, 1993, and the son of an art teacher, Ezra grew up in Hertford, attending Bengeo primary school and then Simon Balle Secondary School, before moving to Bristol, England, in 2011 to pursue a music degree at the influential music school “BIMM.” His younger brother Ethan Barnett is also a musician and goes by the name Ten Tonnes.

Ezra's music is described as deep, bluesy and mournful - particularly in tracks such as ""Budapest"" - and is peppered with influences from the likes of Bob Dylan and Woody Guthrie. Richard Pitt from BBC Bristol aptly described Ezra as ""a young man with the voice of a 50 year old”. 

Ezra appeared on the “Introducing...” stage at Glastonbury in 2013 and came fifth in the BBC’s Sound of 2014 poll. 

EP releases - 2013 & 2014
Ezra released his debut EP ""Did You Hear the Rain?"" in October 2013, with his second EP ""Cassy O'"" being released in March 2014.

First Studio Album - ""Wanted on Voyage"" (2014)
Ezra’s first studio album “Wanted on Voyage” was released on June 30, 2014. It became the third best selling album in 2014 in the UK.

Second Studio Album - ""Staying at Tamara’s"" (2018)
Ezra’s second studio album “Staying at Tamara’s ” was released on March 23, 2018. The 11-track album’s title comes from the time he spent in Barcelona writing the album, where he stayed in an apartment owned by a woman called “Tamara.”

Podcast Host
On February 12th, 2018, Ezra launched the first episode of his first podcast, “George Ezra & Friends”. On the podcast, he has interviewed several musicians including Ed Sheeran, Rag’n’Bone Man, Craig David, Hannah Reid of London Grammar and Ben Thatcher of Royal Blood.

On December 17, 2019, he launched his second podcast called “Phone A Friend” with his old friend and schoolmate Ollie MN. On this podcast, he and Ollie chat about life and their issues with mental health, in the hopes of encouraging others to do the same. 

Other
Ezra has a 1-inch scar on his forehead after running into a wall while he was a student at BIMM music college in Bristol. 


www.georgeezra.com <a href=""https://www.last.fm/music/George+Ezra"">Read more on Last.fm</a>. User-contributed text is available under the Creative Commons By-SA License; additional terms may apply."
110,lost frequencies,1056675,19636871,"Felix De Laet (born 30 November 1993), known by his stage name Lost Frequencies, is a Belgian DJ and music producer. He became famous with his remix of ""Are You with Me"" by country artist Easton Corbin. The song had originally appeared in Corbin's 2012 album All Over the Road, but had not been released as a single. Lost Frequencies remixed the song and released it as a single on 27 October 2014. The track topped the Belgian Ultratop chart on 15 November 2014 also reaching number two in the Belgian Wallonia francophone chart as well. In 2015, the track reached the number one spot in Austria, Germany and Switzerland. It also charted in several countries around Europe, reaching the top 10 in Finland, France, the Netherlands, Norway, Spain and Sweden. <a href=""https://www.last.fm/music/Lost+Frequencies"">Read more on Last.fm</a>. User-contributed text is available under the Creative Commons By-SA License; additional terms may apply."
