,artist,listeners,playcount,bio_content
0,bizarrap,756610,37076993,"Gonzalo Julián Conde, known artistically as Bizarrap, is an Argentine music producer and DJ. 

He specialises in genres such as trap, electronic music and rap. He is known for his Bzrp Music Session and his Bzrp Freestyle Sessions, which he performs with different artists. <a href=""https://www.last.fm/music/Bizarrap"">Read more on Last.fm</a>. User-contributed text is available under the Creative Commons By-SA License; additional terms may apply."
1,manuel turizo,425590,7636334,"Manuel Turizo Zapata (born April 12, 2000), better known as Manuel Turizo, is a Colombian reggaeton singer and songwriter. Born and raised in Montería, Córdoba, he began making music at the age of thirteen with the influence of his older brother, Julián Turizo. When he was sixteen he independently recorded and  three singles: ""Baila Conmigo"", ""Vámonos"" and ""Una Lady Como Tú"", the latter gained wide popularity in 2017, and shortly after he signed under the label La Industria Inc. ""Una Lady Como Tú"" became one of the most listened songs of 2017 in Spanish-speaking countries and made him gain a lot of popularity. As of July 2021, the music video for ""Una Lady Como Tú"" has recieved more than 1.4 billion views on YouTube and the song was streamed more than 495 million times on Spotify.

In October, 2017, he was featured in Piso 21 's song ""Déjala Que Vuelva"", which has gained more than 1.6 billion views on YouTube and more than 560 streams on Spotify. In December of the same year he released his second single ""Esperándote"", which accumulates more than 750 million views on YouTube. In 2018, he released various singles such as: ""Culpables"", ""Sola"", ""Una Vez Más"" with Noriel and ""Vaina Loca"" with Ozuna, the latter became his first Billboard Hot 100-charting hit, peaking at number 94 and staying on the chart for two weeks; while  his song ""Sola"" became his first number one song on the Billboard Latin Airplay chart in March 2019.  In August 2019, he released his first studio album ""ADN""  which featured songs with Zion & Lennox, Noriel, Ozuna, Darell, Nicky Jam, Sech, and Anuel AA. ADN peaked at number eight on the Billboard Hot Latin Albums chart.

In spring 2020  he released his single ""Quiéreme Mientras Se Pueda"" - Love Me While As You Can, during the COVID-19 pandemic. Later that year he released ""La Nota"" with Rauw Alejandro and Myke Towers, and in April 2021 he released his sophomore album ""Dopamina"".

From a very young age, Manuel and his brother, Julián, were surrounded by music, playing any instrument that was passed through in the search of perfecting art. Thus, while Julian chose the guitar, Manuel focused on singing and began taking vocal technique classes in Montería with a Cuban teacher. For him, compositions with universal lyrics that seek to reach the soul, are the formula of success and longs for its fans to continue with the support they have shown so far.

Manuel Turizo will grow under the spotlight, between concerts and fans, but he is confident that the humility and goal he has set to be one of the greatest urban artists in Latin America, will make him stay on a fixed course.
Google Translate for Business:Translator ToolkitWebsite Translator <a href=""https://www.last.fm/music/Manuel+Turizo"">Read more on Last.fm</a>. User-contributed text is available under the Creative Commons By-SA License; additional terms may apply."
2,depol,14588,210508,
3,marta santos,12275,137710,
4,arde bogotá,20005,1046997,
5,feid,492028,41961597,"Salomón Villada Hoyos, also known as Ferxxo or Feid, is a prominent Colombian singer and songwriter in urban music. Born on August 19, 1992, in Medellín, Colombia, he developed a passion for music from a young age and participated in music extension courses with his parents. Starting with the clarinet, he later shifted his focus to his voice and became a member of the University of Antioquia choir.

Since 2015, Feid has dedicated himself to singing and songwriting, experiencing significant success and becoming one of the most popular urban music artists today. With multiple hits and hundreds of millions of streams, he has collaborated with renowned artists such as Bad Bunny, Ozuna, Sech, Justin Quiles, J Balvin, Maluma, Karol G, De La Ghetto, Mora, and others. <a href=""https://www.last.fm/music/Feid"">Read more on Last.fm</a>. User-contributed text is available under the Creative Commons By-SA License; additional terms may apply."
6,elyella,15889,214661,
7,viva suecia,29496,1201340,
8,ozuna,738304,20793921,"Juan Carlos Ozuna Rosado (born March 13, 1992), known simply by his surname Ozuna , is a Puerto Rican Latin trap and reggaeton singer who is regarded as the "" New King of Reggaeton"". He has released two successful albums Odisea (2017) and Aura (2018), and since the beginning of his career, he has sold around 15 million records, making him one of the best-selling Latin music artists of all time. He made his acting debut in the film Que León. <a href=""https://www.last.fm/music/Ozuna"">Read more on Last.fm</a>. User-contributed text is available under the Creative Commons By-SA License; additional terms may apply."
9,david guetta,4663714,158061277,"Pierre David Guetta is a French DJ and music producer. He has sold over 10 million albums and 65 million singles globally, with more than 14 billion streams. In 2011, 2020, and 2021, Guetta was voted the number one DJ in the DJ Mag Top 100 DJs poll. In 2013, Billboard crowned ""When Love Takes Over"" as the number-one dance-pop collaboration of all time, with singer Kelly Rowland.

He released his first album, Just a Little More Love, in 2002. Later, he released Guetta Blaster (2004) and Pop Life (2007). Guetta achieved mainstream success with his 2009 album One More Love which included the hit singles ""When Love Takes Over"", ""Gettin' Over You"", ""Sexy Bitch"" and ""Memories"", the first three of which reached number one in the United Kingdom. The 2011 follow-up album, Nothing but the Beat, continued this success, containing the hit singles ""Where Them Girls At"", ""Little Bad Girl"", ""Without You"", ""Titanium"" and ""Turn Me On"". In 2018, he released the album 7 featuring J Balvin, Nicki Minaj, Jason Derulo, Sia, G-Eazy, and more. The album also featured twelve tracks by his alias Jack Back. In 2019, he started a new movement together with fellow producer Morten Breum called ""future rave"", releasing their New Rave EP in July 2020. Guetta and Sia reunited to release ""Let's Love"" in September 2020.

Guetta's accolades include two Grammy Awards, an American Music Award, and a Billboard Music Award. In June 2021, Guetta sold his recorded music catalog for an amount in the region of US$100 million, with Music Business Worldwide citing a source saying it was more than that, but less than US$150 million. <a href=""https://www.last.fm/music/David+Guetta"">Read more on Last.fm</a>. User-contributed text is available under the Creative Commons By-SA License; additional terms may apply."
10,harry styles,2679748,331057273,"Harry Edward Styles (born 1 February 1994 in Redditch, Worcestershire, England) is a three-time GRAMMY award-winning, British singer, songwriter, and actor. As a member of the British/Irish boy band One Direction, singer Harry Styles topped the charts, toured the world, and sold millions of albums before going solo in 2016. Styles was raised in Holmes Chapel, Cheshire, and he made his first foray into music with a high-school band named White Eskimo. In 2010, he left home and joined the seventh season of The X Factor, where fate and Simon Cowell would eventually lead him toward a life-changing opportunity with four other young men. As One Direction, Styles and his group mates Zayn Malik, Louis Tomlinson, Niall Horan, and Liam Payne would release five albums from 2011 to 2015, hitting number one across the globe and selling millions of records to an adoring and rabid fan base that drew comparisons to the fervor at the height of Beatlemania. In early 2016, after Malik had already parted ways with 1D, the remaining foursome announced their indefinite hiatus.

Months later, Styles signed a solo deal with Columbia Records. Reflecting the influence of childhood favorites like Queen, Elton John, Fleetwood Mac, The Rolling Stones, Freddy Mercury, and The Beatles, Styles' solo material took a more serious and rock-based approach, while still delivering the pop sound his faithful 1D fans desired. With the help of Grammy-winning producer Jeff Bhasker (who had worked with Kanye West and Bruno Mars), Styles put together a small band and, after rehearsing the songs, headed to Jamaica for two months to record an album. ""Sign of the Times"", a plaintive ballad, was released as its first single in April 2017. The self-titled full-length album Harry Styles followed in May and debuted at the top of the Billboard 200. After two world tours, Harry set to write his sophomore album Fine Line, releasing the hit songs ""Lights Up"",  ""Watermelon Sugar"" and ""Adore You"" as the singles.

Fine Line was released on 13 December 2019 by Columbia and Erskine Records. On March 14, 2021, Harry received the Grammy Award for Best Pop Solo Performance for ""Watermelon Sugar"" at the 63rd Annual Grammy Awards. He was also nominated for Best Music Video with ""Adore You"" and for Best Pop Vocal Album for his ""Fine Line"" album. In May of the same year, Styles also won the Brit Award for British Single for ""Watermelon Sugar"". 

On May 20, 2022, Styles released his third studio album, titled  Harry’s House. Its promotional single ""As It Was"" went on to break world records and earn Styles the title (male) for the most-streamed track on Spotify in 24 hours. <a href=""https://www.last.fm/music/Harry+Styles"">Read more on Last.fm</a>. User-contributed text is available under the Creative Commons By-SA License; additional terms may apply."
11,danny ocean,402699,8316558,"Daniel Alejandro Morales Reyes (born 5 May 1992), known by his stage name Danny Ocean, is a Venezuelan singer, songwriter and record producer born in Caracas, Venezuela. He began his professional music career in 2009 with the creation of his YouTube channel. Daniel  is best known for his song ""Me Rehúso"", the first Latin solo artist song to reach 1 billion streams on Spotify, which it did in 2020. <a href=""https://www.last.fm/music/Danny+Ocean"">Read more on Last.fm</a>. User-contributed text is available under the Creative Commons By-SA License; additional terms may apply."
12,sangiovanni,65101,1329864,"Giovanni Pietro Damian (born 9 January 2003) is an Italian singer-songwriter better known by the name  sangiovanni. He was born in Vicenza, Veneto, Italy. He first rose to fame after taking part in Italian talent show Amici in 2020, where he won the singers category and finished second overall. His song Malibu from his debut EP  sangiovanni topped the Italian single chart for four weeks and was certified seven platinum in Italy. Sangiovanni participated in Sanremo Music Festival 2022 with  Farfalle and finished fifth overall. On 8 April 2022 he released his first studio album Cadere Volare containing 12 songs. He competed in Sanremo for the second time in 2024 with Finiscimi. <a href=""https://www.last.fm/music/sangiovanni"">Read more on Last.fm</a>. User-contributed text is available under the Creative Commons By-SA License; additional terms may apply."
13,india martinez,47470,553729,"Born in Córdoba, she started studying flamenco while she was just 5 under the guidance of teacher Nieves Camacho. The family moved to Roquetas de Mar (Almería) when she was 11 years old. She sang on the local fishing port area, becoming popular as ""La Niña del Puerto"". In 1998, at age 13, she took part in the children talent show Veo, Veo hosted by Teresa Rabal, reaching the Andalusian finals. She was offered a scholarship by the Fundación Cristina Heeren to learn flamenco in Seville.

In 2003, she signed with ""La Voz del Sur"" that released her debut album Azulejos de Lunares in 2004. The album consisted of cover interpretations of classic boleros and tangos with new musical arrangements by Jose María Cortina. In February 2009 she released her second album Despertar that earned her a nomination for Best New Artist during the Latin Grammy Awards in 2009. The album Despertar was also nominated for the Best Engineered Production award (Mejor Ingenieria de Grabación). Her follow-up albums Trece Verdades (2011) and Otras verdades (2012) have been certified gold. <a href=""https://www.last.fm/music/India+Martinez"">Read more on Last.fm</a>. User-contributed text is available under the Creative Commons By-SA License; additional terms may apply."
14,sebastian yatra,531346,11586069,"Sebastián Obando Giraldo (born 15 October 1994), known professionally as Sebastián Yatra, is a Colombian singer and songwriter. He began as a Latin pop artist and has recorded many ballads, but has released several successful reggaeton singles. Yatra is noted for his romantic lyrics, melding traditional lyricism with modern reggaeton influences. He rose to prominence in Latin America in 2016 when he released the hit ""Traicionera"". He has released three studio albums and recorded with artists from a diverse range of musical genres throughout his career.

Born in Medellín and raised primarily in Miami, Yatra began singing at a young age and returned to Colombia to begin his musical career. He achieved breakout success with ""Traicionera"" followed by ""Robarte un Beso"" featuring Carlos Vives. ""Traicionera"" served as the lead single for his 2018 debut album, Mantra, which also featured the single ""Sutra"", featuring Puerto Rican rapper Dalmata. He then released the album Fantasia including the lead single ""Un Año"" featuring Mexican band Reik. He received continued success collaborating with Daddy Yankee, Natti Natasha, and the Jonas Brothers on the bilingual single ""Runaway"".

Yatra's music has been classified as Latin pop, reggaeton, and ballads. According to The Fader, Yatras music lands ""somewhere in between the olden times’ sappy romantics and the new wave’s sensuous vibras.""He is influenced by Latin pop and reggaeton artists Ricky Martin, J Balvin, Juanes, and Reik. In an interview with Billboard, he expressed a desire to collaborate with Italian opera singer Andrea Bocelli. Yatra believes that contemporary musicians commit an ""error in associating ballads with boring and slow and old"", and hopes to rejuvenate intererest in ballads for a younger audience.However, his music contains elements of other genres; Desire Thompson of Vibe described his song ""Traicionera"" as a ""trap-EDM blend"".

Despite growing up in Florida and being fluent in English, Yatra sings almost exclusively in Spanish. Yatra explains, “My goal was always to be a singer in Spanish. And I really wanted to understand where I come from and live it. A lot of times I went to Colombia and, even though I spoke Spanish and was always speaking Spanish with my parents, I still felt like an outsider. I wasn’t 100 percent part of it. I wanted to give my roots the importance they deserve. ”His June 2019 song ""Runaway"" was his first foray into bilingual songwriting. In December 2019, he collaborated with South Korean boy group Monsta X for the song ""Magnetic"", which features verses from Yatra in Spanish and a bridge from Monsta X in Spanglish. Sara Delgado of Teen Vogue called the song a ""truly international pop hit"". <a href=""https://www.last.fm/music/Sebastian+Yatra"">Read more on Last.fm</a>. User-contributed text is available under the Creative Commons By-SA License; additional terms may apply."
15,djo,1572268,44579842,"Djo is the musical moniker of American actor/musician Joe Keery, known for his role of Steve Harrington in the hit Netflix show Stranger Things, as well as being a former member of Chicago psychedelic rock band  Post Animal. In September 2019, he released his debut album 'Twenty Twenty', which was supported by the singles ""Roddy"" and ""Chateau (Feel Alright)"". After the success of his debut, Djo released 'DECIDE' in September 2022.

His third album 'The Crux' is scheduled for release in April 2025. <a href=""https://www.last.fm/music/Djo"">Read more on Last.fm</a>. User-contributed text is available under the Creative Commons By-SA License; additional terms may apply."
16,beret,88384,2110744,"Beret could refer to three artists:
One is a Spanish singer (Javier Beret). Beret is the new sensation of the urban Spanish music. With only 20 years old he has already published three albums and reached 64 million views in his Youtube channel. He offers something different mixing reggae, rap and dancehall. 

One is a ""French Hardcore"" band from the United States.

The other is a Japanese Jazz Band.  <a href=""https://www.last.fm/music/beret"">Read more on Last.fm</a>. User-contributed text is available under the Creative Commons By-SA License; additional terms may apply."
17,antoñito molina,3904,43434,
18,rosalía,1393510,127339717,"Rosalia Vila Tobella, known mononymously as ROSALÍA is a Spanish singer and songwriter. Born and raised in the outskirts of Barcelona, she has been described as an ""untypical pop star"" due to her genre-bending musical styles. After being enthralled by Spanish folk music at age 13, she studied musicology at Catalonia College of Music while also performing at musical bars and weddings. She completed her studies with honors by virtue of her collaborative cover album with Raül Refree, Los Ángeles and the baccalaureate project El Mal Querer. Reimagining flamenco by mixing it with pop and hip-hop music, it spawned the singles ""Malamente"" and ""Pienso en Tu Mirá"", which caught the attention of the Spanish general public, and were released to universal critical acclaim. Recipient of the Latin Grammy Award for Album of the Year and listed in Rolling Stone's 500 Greatest Albums of All Time, El Mal Querer started the ascent of ROSALÍA into the international music scene.

ROSALÍA explored urbano music with her 2019 releases ""Con Altura"" and ""Yo x Ti, Tu x Mí"", achieving global success. She gave reggaeton an experimental twist on her third studio album MOTOMAMI, departing from the new flamenco sound of its predecessor. The album caught international attention with its singles ""La Fama"" and ""Saoko"" and became the best-reviewed album of the year on Metacritic.

Throughout her career, ROSALÍA has accumulated ten number-one singles in her home country, the most for a local artist. She has also won a Grammy Award, eleven Latin Grammy Awards (including two Album of the Year wins), four MTV Video Music Awards, an MTV Europe Music Award, two UK Music Video Awards, and two Premio Ruido awards, among others. In 2019, Billboard gave her the Rising Star Award for ""changing the sound of today's mainstream music with her fresh flamenco-influenced pop"", and became the first Spanish-singing act in history to be nominated for Best New Artist at the Grammys. <a href=""https://www.last.fm/music/Rosal%C3%ADa"">Read more on Last.fm</a>. User-contributed text is available under the Creative Commons By-SA License; additional terms may apply."
19,manuel carrasco,73796,1022418,"Manuel Carrasco (born January 15, 1981) is a Spanish singer who was born in Isla Cristina, Province of Huelva (Andalucía), Spain. He was one of the three finalists of the second edition of TV program Operación Triunfo and his debut album called ""Quiéreme"" sold more than 200,000 records. <a href=""https://www.last.fm/music/Manuel+Carrasco"">Read more on Last.fm</a>. User-contributed text is available under the Creative Commons By-SA License; additional terms may apply."
20,estopa,278955,7071431,"Estopa is a pop/flamenco duo founded in 1999 by brothers José and David Muñoz of Cornellà de Llobregat (Baix Llobregat), Catalonia. Their first album, Estopa, has sold well over 1,000,000 copies to date (the equivalent of an American platinum album) and their latest, Voces de Ultrarumba, sold more than 200,000 copies on its first day of release. Their playful, Rumba-tinged compositions have made them one of the most successful pop groups in Spanish history, in terms of both album sales and critical acclaim.

In 2005, Estopa signed a global music publishing deal with BMG Music Publishing.

The name of the group, ""Estopa"" (tow, in english) refers to when both brothers worked together at a SEAT automobile factory and, in their own words, a boss kept on screaming at them, ""¡Dale estopa!"" which means something like ""Work hard!"". <a href=""https://www.last.fm/music/Estopa"">Read more on Last.fm</a>. User-contributed text is available under the Creative Commons By-SA License; additional terms may apply."
21,abraham mateo,133574,1967066,"Abraham Mateo (born in San Fernando (Cadiz), Spain on August 25, 1998) is a Spanish teen actor and pop singer. Abraham was discovered in 2009, when he was ten, by producers of the record label EMI Music Spain, who happened across Abraham's videos in Youtube and his multiple performances in the television show Menuda Noche on the Canal Sur TV of Andalucia, Spain. His self-titled debut album, Abraham Mateo, was released in Spain in December 2009. The album was produced by the spanish composer and producer Jacobo Calderon, who has worked before with internationally recognized latin singers such as Raphael, David Bisbal, and Luis Fonsi.

Beginnings

In 2006, when he was seven, he sang for the first time in public at the regional music competition for children ""Veo Veo"" organized by the Teresa Rabal Foundation in Andalucia, being awarded with a special mention of the jury. Two years later, he won the revelation award at the national music contest held in Murcia being selected to represent Spain at the ""Veo veo"" international competition. 

In 2005, Abraham auditioned for the television show ""Menuda Noche"" on the Canal Sur TV of Andalucia but was not cast for the show. Two years later he attended ""Menuda Noche"" to support his older brother Tony Mateo, who has been chosen to sing in the show, but Abraham was surprised by the show's presenter Juan y Medio and sang in place of his brother. Since then, Abraham has been a frequent guest of ""Menuda Noche"" singing in front of internationally recognized latin singers such as Raphael, David Bisbal, David Bustamante, and Juan Luis Guerra, who have praised Abraham for his strong vocal abilities and stage presence. Raphael said about him: ""That's singing without imitating anyone! You are a great singer!"", David Bustamante: ""You sing like the angels! Impressive! I think he is unique!"", and David Bisbal: ""I have no words! He has a wonderful technique, a very nice voice and a nice tessitura! I predict a huge success!"".

First album

Since his first appearances in ""Menuda Noche"", a friend of Abraham's family posted in Youtube videos of his performances, which soon enjoyed great popularity and caught the attention of producers of EMI Music Spain. Early 2009, when he was ten, he signed a contract with EMI Music Spain and released in December of the same year his debut album, recorded in Madrid, under the title Abraham Mateo.

The album produced by Jacobo Calderon and Jose Luis de la Peña contains twelve songs, seven of them were composed by Calderon himself and four tracks are covers of popular latin songs such as Raphael's ""Cuando tu no estas"" (""When you are not here""), Alejandro Sanz's ""Los dos cogidos de la mano"" (""The two holding hands""), Laura Pausini's ""La soledad"" (""La solitudine/The loneliness"") and Luis Fonsi's ""Imaginame sin ti"" (""Imagine me without you""). The album includes a duet with the french teen singer Caroline Costa, the runner-up in the 2008 edition of the television contest Incroyable Talent, the french version of America's Got Talent. Abraham and Caroline recorded for the album a spanish version of Badfinger's ""Without you"", the song has also been covered with great success by Mariah Carey. To promote the album, Abraham has toured through several cities in Spain and performed in many spanish radio and television shows, including the popular television programs Mas que baile, Tu si que vales, the show of Maria Teresa Campos, and the Christmas Eve Special of the Telecinco channel. He was also invited to perform at the International Carnival Maspalomas in Gran Canaria.

In summer 2010, he recorded his first song in english, a cover version of the Celine Dion hit I surrender.

Acting

Abraham acted in the TV movies ""Días sin Luz"" (2009) and ""Raphael: una historia de superacion personal"" (2010) both produced by Antena 3 Films and broadcasted by the spanish television channel Antena 3. In the biopic ""Raphael: una historia de superacion personal"", he portrayed the worldwide acclamed spanish singer Raphael in the early years of his career and sang some of the vocal tracks.

Official Website: www.abraham-mateo.com <a href=""https://www.last.fm/music/Abraham+Mateo"">Read more on Last.fm</a>. User-contributed text is available under the Creative Commons By-SA License; additional terms may apply."
