,artist,listeners,playcount,bio_content
68,the score,523315,12910041,"There are multiple artists under the moniker ""The Score""

1.) The Score is a pop-rock outfit straight out of Watertown, NY. The brain-child of singer-songwriter Arison Cain, the Score combines catchy hooks and melodies with a highly original style of vocal delivery reminiscent of bands such as Weatherbox and Say Anything. The band is credited with having a sound very reminiscent of 90's rock bands such as Weezer, Smoking Popes and Foo Fighters. The group self-released an EP, ""Steady Fingers! Steady Fight!"" in 2007,   In 2008, they followed up with the full-length release ""Songs for a Halfway Home"", produced in part by Ace Enders of The Early November. The band has shown no sign of slowing down, opening for national acts such as Hit The Lights, I Am The Avalanche, Ace Enders, Anthony Ranieri, Nightmare of You, Damiera, Fear Before, Thieves and Villains, Life In Your Way and many many more.

2.) The Score are a unique new group consisting of members from Los Angeles and London, with an original blend of hip-hop, R&B, soul and rock with jazz influence. 5 young 'real' musicians who write, compose and produce, play their own instruments, and perform live shows with raw energy. Brothers Cameron and Taylor Graves and Clyde 'CJ' Wilson are from L.A. and Brothers Nathan and Sean Allen are from London. The guys are trained musicians playing piano, keyboard, guitar, bass, percussion and drums. 
They have already written for, performed with or opened for artists as varied as Lemar, jazz legend Marcus Miller, Natasha Bedingfield, Omarion, Wicked Wisdom/Jada Pinkett Smith, Lindsay Lohan, Rhian Benson, Amy Winehouse and Faith Evans. 

3.) The Score where a mod band who produced only one single in November 1966. the a side was a cover of the beatles please please me but was a freakbeat version combing hard rock and pysch miles before hendrix and cream. the b side is ""beg me"" which is of their more famous song because of featuring on deca compilations like the mod scene. they never produced any more material and not much is known about them apart from these two songs. 

4) The Score is a Los Angeles-based band formed in New York. Their music is accused of copying Imagine Dragons, especially their work after Smoke + Mirrors

[edit] The Score on this compilation was formed in Manchester UK in 1965. Most of the bandmates were originally from Jimmy Powell and the 5 Dimensions. The band consisted of Ken White (guitar), Alan Megitt (bass), Clem Lee (Drums), Frank Davies﻿ (Guitar) and Eddy Lamb (vocals). They released a single on Decca Records in November of 1966, which included 'Please, Please me' and 'Beg me' on the B side. The Score, were part of the 'Northern Soul' movement in the north of England and played clubs like The Twisted Wheel and Wigan Casino. <a href=""https://www.last.fm/music/The+Score"">Read more on Last.fm</a>. User-contributed text is available under the Creative Commons By-SA License; additional terms may apply."
69,free nationals,804728,12800457,"Free Nationals are best known as Anderson . Paak's live band, until now. The Free Nationals are bassist Kelsey Gonzalez (bass), Ron “Tnava” Avant (keyboard/vocoder), Callum Connor (drums), and José Rios (guitar). In December 2019, the band released their self-titled debut, featuring collaborations with Mac Miller, Kali Uchis, Daniel Caesar, Unknown Mortal Orchestra, Conway the Machine and Westside Gunn. <a href=""https://www.last.fm/music/Free+Nationals"">Read more on Last.fm</a>. User-contributed text is available under the Creative Commons By-SA License; additional terms may apply."
70,vansire,1435614,31203543,"Vansire is a dream pop band from Rochester, Minnesota consisting of Josh Augustin and Sam Winemiller. They are currently signed to Spirit Goth Records. Vansire has performed at ROCKChester and First Avenue, played a live session with Audiotree, and collaborated with artists such as Chester Watson, Jeremiah Jae, and Mick Jenkins.

Vansire formed as band members Josh Augustin (vocals, synths, guitar, and drums) and Sam Winemiller (bass, guitar, and synths) were attending Century High School in Rochester, Minnesota. Augustin and Winemiller met while playing together on the school's drumline and continued to find themselves performing together through school activities (such as concert band and pit orchestra), something the duo says contributed to their creative synergy and friendship, which later helped in Vansire's formation.

In the summer of 2015, Winemiller approached Augustin after practice for the school's drumline with an idea to make a band ""that sounds like Mac [DeMarco]"". The pair's early recordings were made by holding instruments to the internal microphone of an iPad running GarageBand. Augustin and Winemiller, initially unsure of what to call their new project, turned to an online random word generator that landed on ""vansire"", an alternative name for the Marsh mongoose. From there, the two continued to record together in their basements, living rooms, and bedrooms under the new Vansire moniker.

In August 2016, Vansire self-released their first album, ""Reflections and Reveries"". The duo recorded the album entirely in Winemiller's basement in a roughly one-year period from August 2015 to August 2016, and included Winemiller's brother, Issac, on bass for some songs.

During this time, Augustin began studying at the Oberlin Conservatory of Music and Oberlin College, while Winemiller started at the University of Minnesota. Despite the distance, the duo vowed to remain committed to the Vansire project, now describing it as ""a long-distance band relationship.""

Vansire released their second album Angel Youth in April 2018 on Spirit Goth Records. Augustin and Winemiller produced and mastered the album themselves, and it is the band's first full-length album that featured collaborations with other artists.

In June 2019, the duo released their single ""Metamodernity"", also recording an Audiotree Live session at Audiotree's studios in Chicago later that August.

In July 2020, Vansire released ""Central Time"", a single featuring Chicago-based rapper Mick Jenkins in their first collaboration together. In an interview announcing the single, Augustin said the single began as an instrumental demo that Winemiller sent him in September 2019, which sat untouched for roughly eight months until the duo returned back to it, finishing it up at the beginning of June 2020.

During this period of the band's history, Augustin said that Vansire found itself leaning in an ""increasingly dance-oriented direction"" with regard to musical sound and that the duo has started to draw influence from more ""dancey, funk-imbued music"".

On October 16, 2020, Vansire released ""After Fillmore County"", a seven-song EP that brought back FLOOR CRY, and featured Philadelphia-based rapper Ivy Sole. In April 2021, Vansire released a remix of Sydney-based producer-artist Swaine Delgado's ""F Me Up"", their first remix. In May 2022, Vansire released their third LP, The Modern Western World"". <a href=""https://www.last.fm/music/Vansire"">Read more on Last.fm</a>. User-contributed text is available under the Creative Commons By-SA License; additional terms may apply."
71,leisure,409666,5314164,"There are five artists with the name Leisure:

1) LEISURE is a band from New Zealand that launched on SoundCloud in 2015 with 'Got It Bad.'  https://soundcloud.com/theleisurecollective

Made up of five independently talented and successful members who were looking for a new creative outlet unconstrained by over-thinking, over-planning, and excessive control; LEISURE are an anomaly in the music industry. This unusual melting-pot of contributions means LEISURE is greater than the sum of its parts, each member bringing different influences from 70s funk, to 90s rap and R&B, all the way to dance music from the early 2000s. Each member also brings a different skill set – strong pop song writing sensibilities, experimental production techniques, and the talent to mix and master their own work.

Having amassed over 60 million streams on their debut album, which entered at #2 in the NZ charts, they have built a rabid fan following that has seen their very occasional live shows sell out and become the stuff of legends – recently performing their debut, backed by the 72-piece Auckland Philharmonic Orchestra, to a sold-out Auckland Town Hall.

Their music has become a staple in the sync world, they have collaborated with hip-hop star, Goldlink, and have now signed globally to US / UK record label Nettwerk for their forthcoming album.

Their self-titled debut album release was critically acclaimed and with their sophomore album complete, fans worldwide continue to connect with their manifesto of living the good life, and their over-riding code to “keep things LEISURE”.

2) Leisure is a band from Boston, MA consisting of Jed Rouhana, Sam Hamad, and Chris Link. The three members played in bands together since High School. In 2010, they gave a demo CD to JR White of the San Francisco band Girls, during one of Girls' Boston shows. The CD included ""It's Alright (On The Suez Canal)"". White subsequently invited Leisure to open on their US tour. After touring, Leisure began work on their debut album ""Plastic Soul"", which they self-produced. The album is set to be released in 2012. More information can be found on their official website,www.leisureofficial.com and facebook page, www.facebook.com/leisuremusic

3) Leisure featured Middle Class Rut hitmakers Zack Lopez and Sean Stockham and a rotating cast of singers. The earliest incarnation of the band, which included D. Scott Sault, who would later front the short-lived Atlantic Records act Quitter, self-released an EP, Polygraph Alliance, in 1999. After Sault's departure the band briefly included Die Trying (Island) frontman Jassen Jensen. The band eventually landed a deal with Dreamworks, then fronted by Darren, and, shortly thereafter, at least briefly, ex-Hotwire frontman Rus Martin stepped in. The band's one and only national tour was opening for CKY. No word on if an album was ever completed, though several demos, some more impressive (""Deathtrap"") than others, do exist. 

4) Leisure was formed 1998 in New York City. They play non-Britpop and sing about faith, hope and love. Drew sings/play guitar, Peter plays keys/sings, Steve plays bass and Ted plays guitar/sings. They had recorded 2 EP’s (Occasional Music 1.0 & 2.0) with SoundOptik (Ryan Adams, The Strokes, Yeah Yeah Yeahs, Jon Spencer Blues Explosion), Jesse Sprinkle (Poor Old Lu, Serene UK, Starflyer 59) and Andrew D. Prickett (The Violet Burning, Cush, The Prayer Chain). Their music can be heard on XM Satellite Radio.

5) Leisure is still a young band but has some experience however. Formed in November 2004 with the idea of playing only covers. In view of the result of exalting rehearsals, the band decided quickly, under the impulse of Francois, the bands songwriter, to create a set entirely made of their own compositions. The band chose clearly its style, under the British influence and sensitive to each decade (from The Beatles, the Kinks to The Libertines as well as Oasis). Leisure is made up of five members : a drummer with a heavy strike (Nessim, 23), a bassist who gives a certain feminine touch to the band (Coralie, 19), a rhythmical thorough guitarist (Nicolas, 22), a soloist gifted guitarist (Francois, 21) and a charismatic singer (Siamack, 20). The year 2005 has meant toil for the band, accumulating compositions and hours of intensive rehearsals. The band performed at that time in the main venues of Bordeaux, like lInca, lAssonette, la Centrale and some open air gigs like the participation to the festival « Tête de lArt ». At the end of the year, Leisure recorded his first demo called « Shoots in the Streets », recorded and mixed by Kim, produced by the band itself and containing five of their songs played live. The year 2006 is promising for the band which had the honor to play in renowned places such as lHeretic et le SonArt, still improving their set on stage and their compositions. They were also broadcasted several times on radios, like Radio Sauvagine (94.9 FM). After having had the ambition to be known in Bordeaux, the band thinks of exporting itself little by little in whole France. <a href=""https://www.last.fm/music/Leisure"">Read more on Last.fm</a>. User-contributed text is available under the Creative Commons By-SA License; additional terms may apply."
72,awfultune,611751,9493686,"awfultune (she/they) is the music project of Layla Eden. Raconteur, songwriter, storyteller and vocalist who since 2018 has been producing and releasing music independently from a laptop in upstate New York, and now sits on top of over 300 million global streams - officially evolving out of indie bedroom-pop obscurity. <a href=""https://www.last.fm/music/awfultune"">Read more on Last.fm</a>. User-contributed text is available under the Creative Commons By-SA License; additional terms may apply."
73,kokoroko,224490,2419755,"KOKOROKO are a young, London based Afrobeat 8-Piece band led by trumpeter Sheila Maurice-Grey, playing a fusion of Jazz and Afrobeat.

Members:
Sheila Maurice-Grey, Cassie Kinoshi, Richie Seivwright, Yohan Kebede, Duane Atherley, Tobi Adenaike, Onome Edgeworth, Ayo Salawu. <a href=""https://www.last.fm/music/Kokoroko"">Read more on Last.fm</a>. User-contributed text is available under the Creative Commons By-SA License; additional terms may apply."
74,foster the people,3237787,99157583,"Foster the People is an alternative rock band that formed in Los Angeles, California, United States in 2009. The band consists of Mark Foster (vocals, guitar, keyboards), Cubbie Fink (bass, vocals) and Mark Pontius (drums). The band released their debut self-titled EP in January 2011. The band's debut full length album, Torches, was released on May 24, 2011 on Star Time/Columbia. Their first single ""Pumped Up Kicks"" was a sleeper hit during the summer of 2011 and peaked at #1 on the Billboard Alternative Songs Chart, #3 on the Billboard Hot 100 and #18 on the UK Singles Chart.

Initially the solo project of Mark Foster, he later added Fink and Pontius in 2009, forming a full band in the process. Two other musicians, Sean Cimino (guitar, keyboards, vocals) and Isom Innis (keyboards, vocals), tour with the band as additional members.

Discography:

1. Albums:

2011 - Torches
2014 - Supermodel
2017 - Sacred Hearts Club
2024 - Paradise State of Mind

2. EPs: 

2019 - Pick U Up
2020 - In The Darkest Of Nights, Let The Birds Sing

3. Singles:

2011 - Pumped Up Kicks
2011 - Call It What You Want
2012 - Don't Stop (Color on the Walls) (Remixes) - EP
2014 - Coming Of Age
2014 - Pseudologia Fantastica

Official website: http://www.fosterthepeople.com/

twitter: @fosterthepeople 
facebook: http://www.facebook.com/pages/Foster-The-People

Go to www.fosterthepeople.com and join their email list if you want to get involved or just want a free download of ""Pumped Up Kicks""! <a href=""https://www.last.fm/music/Foster+the+People"">Read more on Last.fm</a>. User-contributed text is available under the Creative Commons By-SA License; additional terms may apply."
75,the national,2334837,195211101,"The National is an indie rock band formed in 1999, by friends from Cincinnati, Ohio, USA. The band's lyrics are written and sung by Matt Berninger in a distinctive, deep baritone. The rest of the band is composed of two pairs of brothers: Aaron Dessner (guitar, bass, keyboards), Bryce Dessner (guitar), Scott Devendorf (bass, guitar) and Bryan Devendorf (drums). 

Their self-titled debut album""The National"" (Brassland 2001) was recorded and released before they had played even a single show. They cut the album with engineer Nick Lloyd and formed a label with writer Alec Bemis, so those recordings could be released. Kerrang! magazine gave it four Ks, calling it ""the stuff underground legends are made of.""

The National made a second album, ""Sad Songs for Dirty Lovers"" (Brassland/Talitres 2003). The staff was the same, though Peter Katis, who produced ""Turn on The Bright Lights"" and ""Antics"" by Interpol, helped produce and mix, and Australian composer Padma Newsome from Clogs collaborated on arrangements and strings.

Following the first session of several for Bernard Lenoir on France's Radio Inter, an in-between EP was released, Cherry Tree, containing what would become the blueprint for the sound on their next record and the session of Sad Song's standout Murder Me Rachael. After these accolades and being impressed by their live show, Roger Trust signed them to Beggars Banquet.

A show at their favorite bar became a van ride to neighboring cities, became a plane ride to Europe, became two summers overseas. Their ties to those good jobs slackened. And they continue on their own path, moving out even further out in Brooklyn to Ditmas Park, where there is space and familiar suburban streets and even Geese on Beverly Road. Their album, ""Alligator"", much of which was recorded at their homes in Ditmas Park, was engineered by Paul Mahajan, who has worked with the Yeah Yeah Yeahs and TV on the Radio. Padma Newsome camped out for a month with the band, and Peter Katis added more production and mixed the record at his house in Bridgeport, Connecticut.

Berninger's potent baritone still intones about matters fraught and funny and sad; about record collections, missing persons and medium-sized American hearts. But the record's not simply gothic or miserablist -- more like the plays of Tennessee Williams, it's full of peculiar intimacies and awkward grace. Alligator's heroes are reckless and possessed seducers, but they are apologetic ones. In The National's imaginings, in songs alternately lush and spare, there is something twighlit and dreamy worked out in the basement of our brains.

""Abel,"" ""Secret Meeting,"" and ""Lit Up"" were released as singles.

On May 22, 2007, The National released their follow-up to Alligator, Boxer, on Beggars Banquet. Taking advantage of the fact that nobody had heard their first album and earliest demos, Matt proceeded to steal lyrics and melodies from them and give them the attention they deserved while keeping the intimacy that made them special. They even managed to convince new friend Sufjan Stevens to lay down some piano tracks for them, and recorded the album in a scant 6 months after coming off the long post-Alligator road.

""Mistaken for Strangers"", ""Fake Empire"" and ""Apartment Story"" have been released as singles. The band have just finished touring North America and are on a large European autumn/winter tour after playing high slots at several large festivals. In their Dec. 07/Jan. 08 issue, Paste magazine named Boxer best record of 2007.

The band's fifth album, High Violet, was released on May 10, 2010 by 4AD Records. ""Bloodbuzz Ohio"", ""Anyone's Ghost"" and ""Terrible Love"" were released as singles.

In 2013 their sixth studio record Trouble Will Find Me was released and named ""Best New Music"" by Pitchfork. The album contained the single ""I Need My Girl"". In 2015, the album outtake ""Sunshine On My Back""  was released.

Four years after Trouble Will Find Me, marking the longest timespan between albums in their career so far, they released their seventh album Sleep Well Beast on September 8th, 2017 and were yet again met with great critical success.

The National homepage: http://www.americanmary.com/
The National blog http://tntl.tumblr.com
The National on Twitter http://twitter.com/TheNational
The National on Instagram http://instagram.com/TheNational
Brassland homepage: http://brassland.org/
Beggars Banquet homepage: http://www.beggars.com/ <a href=""https://www.last.fm/music/The+National"">Read more on Last.fm</a>. User-contributed text is available under the Creative Commons By-SA License; additional terms may apply."
76,ren,361442,8953401,"There are multiple artists by this name:

1) Ren Gill, a singer, songwriter, producer, rapper, multi-instrumentalist based in Brighton. Started his career busking. Signed with Sony Records in 2010, but got dropped due to a mysterious illness he developed the same year, eventually diagnosed as Lyme disease. Self-released his debut album Freckled Angels in 2016 with the intention of raising awareness of his illness. Also a member of The Big Push from 2019 to 2022. He has attracted some degree of notoriety for his self-released videos, which are often solo performances filmed in one take; his track ""Hi Ren"", about his struggles with mental and physical illness, received 5.85 million views on YouTube within two months of its release. In 2023 he managed to reach top 1 in UK's album charts with the album Sick Boi.

2) Tokyo-born male singer-songwriter ReN (born 28 Feb 1994) whose debut album ""Lights"" got released in June 2016

3) A 17-year-old (as of February 2020) female Canadian singer-songwriter making her career debut in February 2019 with her single, ""Waves""

4) REN is a Japanese Rapper/Singer

5) Arranger, composer, producer, and freelancer, who is also involved in the Touhou doujin music scene, as a member of Higan Daybreak.

6) A South Korean sub-vocalist and maknae in the K-pop group NU'EST, soon to be a soloist <a href=""https://www.last.fm/music/Ren"">Read more on Last.fm</a>. User-contributed text is available under the Creative Commons By-SA License; additional terms may apply."
77,jack stauber's micropop,696427,26429837,"Jack Stauber is a singer-songwriter from Erie, Pennsylvania. He has been uploading to a Youtube channel since April 1, 2013. Jack has four published albums on both his Bandcamp and Spotify.

Jack was part of the band Joose, who played several live shows and released multiple albums starting in 2014. On their YouTube channel they have uploaded several live shows and singles. He was also the lead singer of Zaki. 

Jack also publishes under the name Jack Stauber's Micropop, which releases extended versions of Jack's short YouTube songs found on his channel. Extended versions are often released early for Jack's patreons. So far there are four Micropop EPs. 

Jack's music genre is generally folk, indie, and avant-pop. Jack's youtube channel features a multitude of different videos, which typically include ""ms-paint animation"", 3D animation, stop/clay-mation, and other mixed media. The effect that they possess is generated by genuine VHS Tape development and recording. Themes within the videos may be that of a typical song or something more cryptic in nature. Many of them are super-catchy. He has also gained the attention of Adult Swim, and has made both an ""adult swim smalls"" and a whole mini-series called ""SHOP: A Pop Opera"" <a href=""https://www.last.fm/music/Jack+Stauber%27s+Micropop"">Read more on Last.fm</a>. User-contributed text is available under the Creative Commons By-SA License; additional terms may apply."
