,artist,listeners,playcount,bio_content
116,broken bells,1301577,30603131,"Broken Bells is an American indie rock duo which formed in 2009 in Los Angeles. The band consists of James Mercer (vocals, guitar) and Brian ""Danger Mouse"" Burton (multiple instruments, production). Mercer is a member of the indie rock band The Shins and Burton is a member of Gnarls Barkley and Dangerdoom, as well as being a respected producer for such artists as Beck, Gorillaz, The Rapture and The Black Keys.

The debut self-titled album by Broken Bells was released on Columbia Records on March 9, 2010. The first single from the record, ""The High Road"", was released on December 21, 2009.

NPR's ""All Things Considered"" aired an interview with the duo on March 16, 2010.  A transcript of the article can be found here.

An EP, Meyrin Fields, was released on March 29, 2011.

Their second LP, After the Disco,  was released on February 4, 2014.

Their third album, INTO THE BLUE, was released on October 7, 2022. 

www.brokenbells.com <a href=""https://www.last.fm/music/Broken+Bells"">Read more on Last.fm</a>. User-contributed text is available under the Creative Commons By-SA License; additional terms may apply."
117,ta-ku,408799,6992081,"Within just 4 years of operation in his chosen field, Regan 'Ta-ku' Mathews, from Perth, Australia has evolved from a self-taught student of music into a scholar of progressive beat production, cultivating a unique sound that has since resonated to all corners of the globe. As an astute observer of the melodic elements of soul music and the percussive elements of hip-hop, Ta-Ku takes influence from pioneering beatsmiths such as J Dilla, 9th Wonder, and DJ Premier.

In 2008, an invite to the prestigious Red Bull Music Academy in Barcelona, taking counsel from the likes of of DJ Toomp, Chuck D, Bun B, Omas Keith, and Dennis Coffey, and sharing alumni status with artists like Teebs, Onra, Dorian Concept, and Pursuit Grooves. The trip was a breakthrough moment for Ta-Ku as he channeled his experience and new found motivation to liberate a slew of free beat tapes within months of his return. Shortly after flooding the internet with a diverse array of releases, his output was rewarded with subsequent collaborations involving CyHi Da Prynce (G.O.O.D. Music), John Robinson, Raashan Ahmad, (Paper Chain labelmate), Joe Scudda, Outasight, Kid Daytona, Phil Ade, Raaka, (Dilated Peoples) amongst many others. Ta-Ku's work ethic continued to garner worldwide attention and within two years of his return from the Red Bull Music Academy he'd become a regular fixture on countless blogs and online zines, securing himself a prized feature on Giles Peterson's esteemed Brownswood Electr*c Compilation.

In 2011, Ta-Ku aspires to take his hip-hop roots and apply them to further experimentation within the electronic and new soul realms. His musical identity continues to evolve with the progressive nature of the genres he has contributed to, illustrated most recently with a Soulection endorsed 24 mixtape and his debut EP and 12"" releases through PROJECT: Mooncircle and DakerThanWax respectively.

He has recently released an EP by the name of LATENYC on L.A's HW&W Records in the lead up to his instrumental LP release SCARLETTE. LATENYC is 9 tracks of instrumental future soul music and features Melbourne vocalist Chet Faker. 

Most recently he has released the albums, 50 Days for Dilla (Vol. 1) and 50 Days for Dilla (Vol. 2), via HW&W Recordings, in dedication to J Dilla.

Releases Available Now thru: 
Brownswood
PROJECT: Mooncircle 
HW&W Recordings 
Paper Chain 
Free Form 
Feelin' Music 
Soulection 
Daker Then Wax 

Contact : info@ta-ku.me

www.soundcloud.com/takugotbeats
www.ta-ku.me
www.twitter.com/takubeats
www.facebook.com/takugotbeats <a href=""https://www.last.fm/music/Ta-ku"">Read more on Last.fm</a>. User-contributed text is available under the Creative Commons By-SA License; additional terms may apply."
118,edwin raphael,161677,1001604,"Edwin Raphael is an emerging Montreal-based artist making waves with his uniquely detuned sounding guitars and absorbing melodies with his debut summer EP ‘Ocean Walk’ in 2015.
Equipped with smooth, absorbing melodies, chilling lyrics and his innate musical capabilities, Edwin lets us delve into his ocean of thoughts on a dazzling rustic soundtrack.
‘Harbours’ his first single has been labelled as a ""hidden gem with somber instrumentals and an eerie, yet beautiful listen” by pressrelease.ca. His work is a passionate blend of both alternative and indie-pop genres taking you into a cold water dive of pure solace. 
His second ep, “Cold Nights”,  presented a darker and heavier progression in terms of songwriting and production with heartbreak song 'Colder' becoming an instant hit.
Garnering more than seven million streams on Spotify itself, Edwin is set to release his debut full length album ""Will You Think of Me Later?"" in March 2019. With singles such as ""Isle of Strawberries"", ""Sober"" and ""Tangerine Skies"" have already highlighted Edwin as someone who is on top of his songwriting abilities and one to wat H out for in the coming year.  <a href=""https://www.last.fm/music/Edwin+Raphael"">Read more on Last.fm</a>. User-contributed text is available under the Creative Commons By-SA License; additional terms may apply."
119,ry x,667713,10382897,"RY X is Australian singer-songwriter and producer Ry Cuming (born in Angourie, NSW). He was the first artist signed to the Stockholm-based label Dumont Dumont. In 2014, he became the lead singer of the band The Acid. 

Cuming started writing music at 16, after he heard Buckley's album Grace. His song ""Let Your Spirit Fly"" appeared on the soundtrack of the 2006 film ""Hoot"". He moved to Los Angeles, California, where he was signed by Jive Records, releasing his self-titled debut album on 20 July 2010. He briefly toured with Maroon 5, becoming their opening act in select venues. 

After moving to Los Angeles, his ""Berlin"" EP was released both as 12"" vinyl and digital on 28 August 2013. His second album ""Dawn"" was released on 6th May 2016 (his previously released self-titled album was under his real name Ry Cuming).

In 2014, he became the lead singer of the band The Acid. 

On May 6, 2016, he released his album ""Dawn"", followed by ""Unfurl"" on 15 February 2019. <a href=""https://www.last.fm/music/Ry+x"">Read more on Last.fm</a>. User-contributed text is available under the Creative Commons By-SA License; additional terms may apply."
120,cut_,68221,595725,"Different projects with this name

1) Cut_ is a project led by Ray Wilson. Millionairhead  is the only album by the band and Wilson's first release on which he took on the majority of the songwriting duties.
The band only recorded and released this one album; Wilson would go on to record his own solo albums as well as with the reformed version of Stiltskin.
Wilson recorded a reworked version of ""Another Day"" for his solo album Change in 2003. He frequently plays some songs from this album at his solo concerts. Live versions of ""Another Day"", ""Sarah"", and ""Gypsy"" can be found on Live (2004), live versions of ""Another Day"", ""Sarah"", and ""Ghost"" can be found on An Audience and Ray Wilson (2006).
In October 2007, the album was re-released worldwide with three bonus tracks which were previously released b-sides.

2) CUT_ is a live electronic improvisation act from Amsterdam based on live composition and looped vocals. Music inspired by the moment, every show is unique. CUT_ was formed with the intention to be a one time event but was extended due to great success. CUT_ is influenced by electronic acts such as: Mount Kimbie, Burial, James blake and the knife. But also by Hip-hop and Trip-hop acts like: Lamb, The Pharcyde, Massive Attack and DJ Shadow <a href=""https://www.last.fm/music/CUT_"">Read more on Last.fm</a>. User-contributed text is available under the Creative Commons By-SA License; additional terms may apply."
121,mavi,802621,23009336,"There are two artists with this name:

1) Mavi (born [yearborn]October 7th, 1999[/yearborn]) is a rapper from Charlotte, North Carolina who remained fairly unknown until October 18th, 2019 with the drop of his album, let the sun talk. He also gained a lot of attention from a feature he did on Earl Sweatshirt’s FEET OF CLAY on the track ""EL TORO COMBO MEAL"".

2) Mavi, born on February 6, 2004 in Üsküdar, Mavi Solman, with his stage name ""Mavi"" is one of Turkey's youngest trap musicians. <a href=""https://www.last.fm/music/Mavi"">Read more on Last.fm</a>. User-contributed text is available under the Creative Commons By-SA License; additional terms may apply."
122,sons of the east,181895,1823661,"Sons of the East is a three-piece indie-folk band from Sydney, consisting of Jack Rollins, Nic Johnston and Dan Wallage. Formed in mid 2011, the band has played at multiple venues throughout Sydney and up and down the east coast of NSW, and seem to draw a crowd wherever they play. Their original blend of keys, guitar, banjo and vocal harmonies have seen them build a strong following that is continually growing. <a href=""https://www.last.fm/music/Sons+Of+The+East"">Read more on Last.fm</a>. User-contributed text is available under the Creative Commons By-SA License; additional terms may apply."
123,old sea brigade,259025,2331011,"The nom de plume of Atlanta, Georgia-raised, Nashville-based singer/songwriter Ben Cramer, Old Sea Brigade emerged in 2016 with a critically lauded EP that featured a compelling, heartfelt, and atmospheric blend of folk, country, Americana, and indie rock that invoked names like Bon Iver, Iron and Wine, and the National. A string of singles and an EP for the Nettwerk label paved the way for his 2019 full-length debut, Ode to a Friend.

After several years playing in bands around the Atlanta area, Cramer decided to forge ahead as a solo act, adopting the Old Sea Brigade name in 2015. Self-released in 2016, his eponymous debut EP earned him enough buzz to land key support slots for Hiss Golden Messenger, Julien Baker, and Benjamin Francis Leftwich during his first U.S. tour. Later that year, he inked a deal with Nettwerk and began work on a follow-up release. Cramer's first single for Nettwerk, the rousing ""All the Same,"" dropped in September 2016 and was later included on 2017's Wash Me Away, the first of three EPs he would issue that year. The song ""Tidal Wave,"" from his next EP, Cover My Own, notched significant play on streaming networks. Cramer closed out a banner year with the Christmas EP Songs for the Holidays. Scattered throughout 2018 were the singles ""Hope,"" ""Feel You,"" and ""Sinkhole,"" which preceded Old Sea Brigade's 2019 full-length debut, Ode to a Friend. <a href=""https://www.last.fm/music/Old+Sea+Brigade"">Read more on Last.fm</a>. User-contributed text is available under the Creative Commons By-SA License; additional terms may apply."
124,conociendo rusia,51669,1866655,"Conociendo Rusia es un proyecto liderado por Mateo Sujatovich. Desde el primer disco, homónimo, que la intención está clara: refundar la canción clásica argentina. Subido en los hombros de los más grandes, su manera de componer nos regala música

que es familiar y novedosas a la vez.

Una combinación explosiva. En 2019 Mateo vuelve quedar en boca de todos con “La mexicana”, un single que al ritmo de una ranchera rockera aborda el desamor y se sigue acercando al oido popular. Su búsqueda se profundiza en “Cabildo y Juramento”. Audaz e intensamente contemporáneo, el álbum es una radiografía de estos años, signados por una exaltación amorosa y una efervescencia juvenil que se escucha en cada tono del álbum. Conociendo Rusia se encuentra en un gran momento artístico y se posiciona como uno de los referentes más fuertes de la escena del nuevo rock argentino. En los últimos años se consolidó en Argentina con un público que no para de crecer.  Llevó sus canciones a México, se presentó en venues como Niceto Club (CABA), Studio Theater (Córdoba) y Guajira (La Plata) con localidades agotadas, y formó parte de los principales festivales del país como Lollapalooza, La Nueva Generación, Cosquín Rock y Rock en Baradero. Realizó un proyecto de streaming a través del cual llegó a distintos lugares del mundo como Europa, Estados Unidos y Latinoamérica.

Actualmente se encuentra nominado en 3 categorías de los Latin Grammys. <a href=""https://www.last.fm/music/Conociendo+Rusia"">Read more on Last.fm</a>. User-contributed text is available under the Creative Commons By-SA License; additional terms may apply."
125,cage the elephant,2880009,114664649,"Cage the Elephant is an alternative rock band which formed in 2005 in Bowling Green, Kentucky, United States.

The band consists of Matt Shultz (vocals), Brad Shultz (guitar), Nick Bockrath (guitar), Daniel Tichenor (bass, vocals), Jared Champion (drums) and Matthan Minster (keyboard, vocals, guitar). 

Their breakthrough single was Ain't No Rest For The Wicked, which peaked at #83 on the Billboard Hot 100, #32 on the UK Singles Chart and #3 on the Billboard Alternative Songs chart. This song was also featured as the intro song for the 2009 video game ""Borderlands.""

Thus far, they have earned dozens of Gold, Platinum & Multi Platinum certifications, tallied over 5 billion streams, & notched 11 #1 records on Alternative Radio. The guys consecutively garnered 2 GRAMMY® Awards for ""Best Rock Album"" for both Tell Me I'm Pretty
[2015] and Social Cues [2019]. Of the latter, Entertainment Weekly raved, ""The album's introspection paired with its urgent energy make Cage The Elephant sound more passionate than ever."" In the meantime, their music has also surged through pop culture as ""Cigarette Daydreams"" graced the soundtrack of Marvel's Spider-Man 2 video game, ""Goodbye"" appeared in The Summer | Turned Pretty, & ""Trouble"" powered a global campaign for Amazon Prime.
The Kentucky-bred six-piece instinctually lean on their enduring bond as both musicians & friends to get through anything & everything.
Moments of elation might take the form of sticky hooks, swaggering rhythms, or upbeat guitars, while tense riffs & jittery grooves could give shape to feelings of anxiety, doubt, or instability. As such, the group fearlessly alchemize a season of tragedy & turbulence into the 12 tracks on their 6th full-length album, Neon Pill. <a href=""https://www.last.fm/music/Cage+the+Elephant"">Read more on Last.fm</a>. User-contributed text is available under the Creative Commons By-SA License; additional terms may apply."
126,matt corby,415862,6002592,"Matthew John ""Matt"" Corby (born 7 November 1990, Australia) is an Australian singer songwriter.

Matt Corby has certainly carved a unique path for someone that started his career aged 16 on a reality TV talent show in 2007. In 2009, he independently released his debut EP 'Song For...' before relocating to London and signing with renowned UK indie label Communion after capturing the attention of the label's owner; Ben Lovett of Mumford and Sons fame.

Matt Corby’s songs and vocals elicit a sensation that is nothing short of captivating. Having previously been compared to legendary artists such as Nick Drake and Jeff Buckley, Matt’s songs continue to deliver a uniqueness and maturity well beyond his years while his live performances have become renowned for bringing large audiences to a complete stand still.

After recording with Ian Grimble (The Libertines, Seasick Steve) and releasing his hauntingly beautiful EP 'Transition To Colour' in late 2010, Matt has been busy engaging audiences with his live shows. Matt spent the earlier part of 2011 playing sold out shows in London and showcasing at SXSW in Austin, Texas in February before coming back to Australia to play a string of intimate “Secret Garden” shows in fans’ backyards. He soon after joined UK band Elbow as the main support on their national tour of sold out Splendour sideshows in July.

On 1 October 2015, Matt released his first song in two years, 'Monday' from his debut album, 'Telluric'. The song was described as containing ""lush, transcendent harmonies, wailing falsetto, folky boom-claps and heartbreaking lyrics"", and later voted 53 in the Triple J Hottest 100 of 2015. 'Telluric' was eventually released on 11 March 2016.

On 7 September 2018, Matt announced his 2nd studio album 'Rainbow Valley', released 2 November 2018.

Personally, Matt enjoys surfing and reading, and became a father with his first child in early 2018.

External Links
http://www.mattcorby.com.au
http://www.myspace.com/mattcorbyau
http://www.facebook.com/mattcorby
http://twitter.com/mattcorby <a href=""https://www.last.fm/music/Matt+Corby"">Read more on Last.fm</a>. User-contributed text is available under the Creative Commons By-SA License; additional terms may apply."
127,half•alive,537355,18852796,"half•Alive are a California-based musical trio formed in 2016. The band consists of lead vocalist Joshua William ""Josh"" Taylor, drummer Brett Kramer, and bass guitarist J. Tyler Johnson. The band's journey began when Josh Taylor, formerly of the band The Moderates, embarked on a songwriting endeavor after parting ways with his previous group. This led to the creation of their first EP, ""3,"" which was released in April, 2017. The EP quickly gained traction online, amassing millions of streams and establishing a dedicated fanbase for the band.

However, their breakthrough came in 2018 with the release of their single ""still feel."" with an accompanying music video, received media attention and led to the band signing a record deal with RCA Records. ""still feel."" also charted on Billboard's Alternative Songs chart and has amassed over 80 million streams on YouTube and Spotify.

In August 2019, half•alive released their debut studio album titled ""Now, Not Yet."" The album was well-received, and the band embarked on a worldwide tour, performing in North America, Europe, Australia, and New Zealand. 

In 2022, the band released ""Give Me Your Shoulders, Pt. 1,"" which served as the first part of their second studio album. However, they later announced the cancellation of ""Give Me Your Shoulders, Pt. 2"" and unveiled a new single called ""Did I Make You Up?"" This single was followed by the release of their second album, ""Conditions of a Punk,"" in December 2022.

On October 13, 2022, they released the single ""Did I Make You Up?"" along with its captivating music video, which culminated in the announcement of their second album, ""Conditions of a Punk,"" set to be released on December 2, 2022.

half•alive's musical style is a blend of beat-driven dance-pop, dark electro-rock, and indie pop. They draw inspiration from various genres and incorporate elements of R&B, funk, soul, and electronic music. The band has cited influences such as Sufjan Stevens, Vulfpeck and Christine and the Queens. Their lyrics often touch on themes of anxiety and religion, and they strive to create a balance between abstract and relatable lyrics to allow listeners to interpret the songs in their own way. <a href=""https://www.last.fm/music/half%E2%80%A2alive"">Read more on Last.fm</a>. User-contributed text is available under the Creative Commons By-SA License; additional terms may apply."
128,caamp,375044,11302803,"Caamp is an American band from Ohio. The band began as a project between childhood friends Taylor Meier and Evan Westfall, who met at a summer camp while they were middle school students. In 2013 Taylor began playing in coffee shops around Athens while studying at Ohio University. They later added bass player Matt Vinson and Joseph Kavalec on the keyboards.

To date, Caamp has released four albums. Their first album, self-titled, was released in 2016. In 2018, Caamp released a six-song EP called Boys. Their second album, By and By, was released in 2019.

On June 24, 2022, the band released their third studio album, Lavender Days. The release of the album was preceded by three singles: ""Believe"", ""Apple Tree Blues"", and ""Lavender Girl"".

http://www.caamptheband.com/
https://www.facebook.com/CaampBoys/ <a href=""https://www.last.fm/music/Caamp"">Read more on Last.fm</a>. User-contributed text is available under the Creative Commons By-SA License; additional terms may apply."
129,men i trust,1716355,86337351,"Men I Trust is Dragos, Emma, Jessy, Mathieu and Alexis. Founded in 2014, the indie dance band from Montreal, Canada loves smooth sounds, calm melodies and simple rhythms that relax, but make your right foot tap and your chin bounce on the beats. They record, mix, master and shoot their music videos. 

Jessy and Dragos knew each other since their fourth year of high school. Back then (mid-2000’s), Dragos had somewhat of a background in classical piano and Jessy mastered the dark and esoteric art of the metal guitar solist.

In 2012, while finishing his master’s degree in audio postproduction at Laval University, Dragos spent most of his days and sleeping hours at the “LARC” studio working on his solo projects. He randomly met Jessy again, who was finishing his bachelor degree in Jazz guitar, in one of the faculty’s hallways and talked about doing a French-Touch / Italo-Disco track together. Some weeks later, they did just that. And it worked out so well that they decided to extend their collaboration to a whole project where many singers such as Odile Marmet-Rochefort, Gabrielle Shonk, Helena Deland and Geoffroy Sauvé, would be involved.

Between 2012 and 2016, all of Jessy’s and Dragos’ releases were made as part of Dragos’ masters and (dropped) PhD studies in order to gain access to the LARC’s infrastructure and to develop a unique sound.


Emma was a fortuitous encounter. In 2015 a mutual friend presented her to Dragos through a video posted over the Internet. She was casually singing and playing the guitar around a campfire with some of her friends. Emma’s voice was different, being less clear, more grainy and fragile with a mysterious twist that caught their attention. They reached her and tried recording one song called “Out in myself”, which turned to be one of the band’s easiest to record.

Jessy and Dragos then invited her to join them on live shows with Odile at the beginning of 2015. The womans' voices blended wonderfully together and the band got lots of positive feedback from the experience. Emma has been part of Men I Trust since then.

With their second album “Headroom"", Men I Trust truly became a trio. <a href=""https://www.last.fm/music/Men+I+Trust"">Read more on Last.fm</a>. User-contributed text is available under the Creative Commons By-SA License; additional terms may apply."
