,artist,listeners,playcount,bio_content
119,bon entendeur,144988,1848355,"From shared passions was born an extraordinary project: Bon Entendeur. A duo in love with French culture and curious to invent hybrid formats fed by their passions. The result: Aller-retour. A cluster of beautiful ideas gathered in a unique album. 

Their adventure starts with a rather classical approach: arranging playlists fed with music they like. They gradually added what would become their trademark: the grain of a personality's voice on mixed music. Their format is declined during 5 years, 40 mixtapes, more than 70 million listening. A quality signature. Bon Entendeur has this desire to talk about culture in its original version. This sense of aestheticism, of appropriateness. And of the stage. Behind the turntables, they mix their tributes and move the packed halls on a very fine sound. They also have the audacity to never run out of ideas, and in 2015 they offered their first revisit of a song from the 70s, Le temps est bon. A success.

Their album Aller-Retour concentrates their DNA: it is composed of revisited songs from the 60s and 70s and original productions mixed with interviews. All elegantly arranged in 14 tracks. Bon Entendeur creates sounds that are new, that go back and forth with their inventive digital generation and the immense heritage of their predecessors. <a href=""https://www.last.fm/music/Bon+Entendeur"">Read more on Last.fm</a>. User-contributed text is available under the Creative Commons By-SA License; additional terms may apply."
120,paper planes,91312,793495,"There is more than one band with the name Paper Planes.

1) Settling on the name Paper Planes  in 2001, after a few years of earlier gigs as a 3 piece under various names, the band from Melbourne, Australia was formed.  Created by singer, songwriter and guitarist Claire Birchall the band became a 4 piece at this time. Their music has been described as head-nodding old school indie rock soaked in sunshine, with just enough shade to keep the pop-police at bay.  There latest release ""Golden Sounds"" was released at the end of 2009.
 
2) Formed in late 2008 and based in Glasgow, Scotland is the indie rock quartet Paper Planes.  They are fronted by New Jersey native  Jennifer Paley backed by Scottish boys Craig O’ Brien (drums) Fraser McFadzean (bass), and Christopher Haddow (guitar). 

Paper Planes blend traditional Glaswegian pop and rock sounds (think Camera Obscura, Franz Ferdinand, Orange Juice) with a healthy dose of early American punk, garage, and surf influences. This blend gives them a distinctly muscular sound, especially compared to their indie contemporaries. 

3) Paper Planes (เปเปอร์ เพลน) is a rock band from Bangkok, Thailand. Paper Planes got their first mainstream succes in 2017 when they signed to the label Genie Records with their song ""ก่อนเสียเธอไป"". The band consists out of Tunwa Ketsuwan on vocals, Kitsakon Chanthakasemkun (Yky) on guitar, Nakarin Kunphukdee on bass and Ritamnat Khwantong (Jazz) on drums.
 <a href=""https://www.last.fm/music/Paper+Planes"">Read more on Last.fm</a>. User-contributed text is available under the Creative Commons By-SA License; additional terms may apply."
121,london grammar,876039,31792180,"London Grammar is an English indie-pop band formed in Nottingham in 2009. Their debut album,  ""If You Wait"", was released in September 2013.

Singer Hannah Reid (born on 30 December 1989) and guitarist Dan Rothman met in the dorms of Nottingham University where they began writing music together in 2009. They later added multi-instrumentalist Dot Major to complete the London Grammar line-up. 

Their popularity rose with the 2012 release of ""Hey Now"" which they uploaded to the internet and instantly found an online cult following. Their self-released 2013 debut EP ""Metal & Dust"" reached the Top 5 of the iTunes chart. The same year they signed to Ministry of Sound and the single ""Wasting My Young Years"" appeared as the first release on the label. 2013 also saw them play a sold-out show at the Islington Assembly Hall and make an appearance at the Great Escape Festival in Brighton. 

""Strong"" was the next single extracted from the album ""If You Wait"", released on September 9th, 2013. 

The band's album ""Truth Is a Beautiful Thing"" was released on 9 June 2017. 

On 19 August 2020, London Grammar released “Baby It's You,” their first single since 2017. 

Official site: http://londongrammar.com <a href=""https://www.last.fm/music/London+Grammar"">Read more on Last.fm</a>. User-contributed text is available under the Creative Commons By-SA License; additional terms may apply."
122,kevin kaarl,214141,8632493,"Kevin Kaarl es un joven cantautor de tintes nostálgicos y norteños, cuyo talento se ha ido abriendo camino en el mundo de la música con sus canciones de folk campirano que ha compuesto a lo largo de todo su proyecto en el que está acompañado por su hermano gemelo, Byan Kaarl, quien toca la trompeta y hace segunda voz. <a href=""https://www.last.fm/music/Kevin+Kaarl"">Read more on Last.fm</a>. User-contributed text is available under the Creative Commons By-SA License; additional terms may apply."
123,rhye,728787,16626645,"Rhye is the musical project of Toronto native Milosh. Originally conceived as a collaboration between him and Robin Hannibal of Danish electro-soul outfit Quadron, the project has evolved into a music collective led by Milosh and focused around its associated live band.   <a href=""https://www.last.fm/music/Rhye"">Read more on Last.fm</a>. User-contributed text is available under the Creative Commons By-SA License; additional terms may apply."
124,chloe moriondo,599981,15593784,"chloe moriondo (she/they) (born September 29, 2002) is an American singer-songwriter and YouTuber from Michigan. Her style blends elements of indie pop and bedroom pop, with the occasional hyperpop. Her YouTube channel, which she began in January 2014, sits at over 3 million subscribers and over 200 million video views.

Chloe started their music career by posting covers to songs on their YouTube channel where their first original song, Waves, was posted. Their covers and original songs quickly got the attention of millions of viewers, such as Cavetown who they would later collaborate and tour with.

On July 31, 2018, she self-released her first studio album, Rabbit Hearted.. On April 24, 2020, she released her first EP, Spirit Orb, where we can hear a shift in sound from her older ukulele heavy, acoustic singer/songwriter tunes, to a more rock-focused electric guitar sound. In August 2020, Moriondo was signed to Fueled by Ramen and released I Want to Be with You.

On May 7, 2021, Chloe released their first studio album, Blood Bunny with singles I Want to Be with You and GIRL ON TV. In this album Moriondo dives even further into exploring their identity through music, adopting a new pop-punk style and even writing about everything from her favorite bands to cannibalism. In 2021, they made their late-night debut performing Bodybag on Jimmy Kimmel Live! They later performed a variation of I Want to Be with You on The Late Late Show with James Corden. In July 2021, they released blood bunny (acoustic), with reworks of tracks from the album, produced by frequent collaborator Cavetown.

In April 2022, she released her second EP, puppy luv. In June 2022, she released Blood Bunny (Deluxe), including fan favorite song Hell Hounds and a new collaboration with dodie in I Eat Boys (feat. dodie). She also joined mxmtoon on her North America tour rising (the world tour) from May to June 2022. 

In October 2022, Moriondo released their album SUCKERPUNCH, true to its name, the album features hard-hitting tracks, as well as being their first foray into hyperpop following the indie pop of Blood Bunny. From October 12th 2022, through November 19th 2022 they are playing shows in the United States and Canada. They will be touring the United Kingdom and mainland Europe from January 28th 2023 through February 18th 2023. <a href=""https://www.last.fm/music/Chloe+Moriondo"">Read more on Last.fm</a>. User-contributed text is available under the Creative Commons By-SA License; additional terms may apply."
125,the war on drugs,839684,33846981,"
The War on Drugs is an American indie rock band from Philadelphia, Pennsylvania.

Band member Adam Granduciel (born Adam Granofsky in Dover, Massachusetts) moved from Oakland, California to Philadelphia in  2003, where he met Kurt Vile and began playing music with him. They began playing as The War on Drugs in 2005, and self-released a demo EP. While Vile and Granduciel formed the backbone of the band, they had a number of accompanists early in the group's career, before finally settling on a lineup that added Charlie Hall as drummer/organist, Kyle Lloyd as drummer and Dave Hartley on bass. Granduciel had previously toured and recorded with The Capitol Years, and Vile has several solo albums. The group gave away its Barrel of Batteries EP for free early in 2008. Their debut LP for Secretly Canadian, Wagonwheel Blues, was released in 2008.

Reviewers of the band's music make note of its Americana overtones. The group's sound has been described as influenced by Bob Dylan, Bruce Springsteen, and My Bloody Valentine.

The lineup underwent several changes, and by the end of 2008, Kurt Vile, Charlie Hall, and Kyle Lloyd had all exited the group. Granduciel and Hartley were joined by drummer Mike Zanghi as the group slimmed to three members.

After Zanghi's exit in 2010, Steven Urgo took over drum duties and  Robbie Bennett joined on keys.   <a href=""https://www.last.fm/music/The+War+on+Drugs"">Read more on Last.fm</a>. User-contributed text is available under the Creative Commons By-SA License; additional terms may apply."
126,silvestre y la naranja,74352,1221765,"Silvestre y La Naranja nació en Buenos Aires, Argentina. En los últimos años, la banda ha surgido dentro del circuito under como una de las propuestas más atrayentes e innovadoras, y se ha presentado con frecuencia en las mejores salas de la ciudad y el país. <a href=""https://www.last.fm/music/Silvestre+y+La+Naranja"">Read more on Last.fm</a>. User-contributed text is available under the Creative Commons By-SA License; additional terms may apply."
127,no vacation,756976,13164582,"No Vacation is a indie pop band based in San Francisco, U.S.A.. The band started as a dorm room collaboration between Basil Saleh and Sabrina Mai before evolving into a band. After a year long hiatus, No Vacation has re-emerged from hibernation. As they quietly work on their next album and transition out of San Francisco, No Vacation will bring their novice sounds to New York City, U.S.A.. The majority of the still untitled album was written during No Vacation’s break up and expresses the feelings of belongingness, regret, and struggles of resilience. <a href=""https://www.last.fm/music/no+vacation"">Read more on Last.fm</a>. User-contributed text is available under the Creative Commons By-SA License; additional terms may apply."
128,sub urban,702047,10367737,"Daniel Virgil Maisonneuve (Sub Urban)  was born on October 22, 1999, in Nyack, New York to a French Canadian father and a Taiwanese mother. While raised in the suburbs of Ridgewood, New Jersey, he began producing music at the age of 15. He was trained in classical piano at the age of 6, but quit after claiming that he was ""sick of playing other people's compositions"". In the fall of 2016, Maisonneuve dropped out of high school to pursue his musical career, ""isolating"" himself to work on various demos and songs. The most popular song of his to come out of this period of self-isolation was ""Cradles"", which skyrocketed in popularity after being shared heavily on video-sharing application TikTok.

In 2014 and 2018, Maisonneuve frequently collaborated with British producer DNMO on tracks such as ""Sick of You"" and ""Broken"". Maisonneuve states that ""most of his inspiration has derived from artists such as K. Flay, EDEN, Aries, verzache, Joji, Cage the Elephant and NoMBe"".

On March 13, 2020, Maissoneuve released his first EP, titled Thrill Seeker, where he has the participation of the South Korean hip-hop artist, REI AMI, with the song ""Freak"", accompanied by video and official audio. <a href=""https://www.last.fm/music/+noredirect/sub+urban"">Read more on Last.fm</a>. User-contributed text is available under the Creative Commons By-SA License; additional terms may apply."
129,aisha badru,131406,739586,"Aisha Badru is an American singer-songwriter based in New York. She self-released her debut EP, Vacancy, in 2015. <a href=""https://www.last.fm/music/Aisha+Badru"">Read more on Last.fm</a>. User-contributed text is available under the Creative Commons By-SA License; additional terms may apply."
130,phantogram,1515308,36278286,"Phantogram are a trip-hop/psych-pop duo which formed in 2007 in Saratoga Springs, New York, USA. The band consists of Sarah Barthel (vocals, keyboards) and Joshua Carter (guitar, vocals). Their music can be described as a culmination of unique street beat rhythms, psychedelic melodies and organic textures. The band practices and writes music in an out-of-town farm called Harmony Lodge. The group name was inspired by the optical illusion called phantogram.

Barthel and Carter were friends since junior high school. Barthel pursued a visual arts degree while Carter formed the experimental band Grand Habit. In the summer of 2007 they reunited and worked on finishing some beat ideas Carter made earlier. The duo was originally called Charlie Everywhere when performing around the Saratoga Springs area on the local label Sub-Bombin Records. When they signed to BBE Records they changed the name to Phantogram, to avoid legal issues.

In March 2009, they self-released a five song EP, Phantogram EP, which featured four songs that ended up being on the full length. In the same year they released another EP, Running From the Cops on BBE Records.

The band's debut album Eyelid Movies was released in September 2009, on BBE Records in Europe, and in February 2010, on Barsuk Records in the US. The album received generally favorable reviews. The singles ""Mouthful of Diamonds"", ""When I'm Small"" and ""As Fas As I Can See"" supported the album.

Phantogram have supported acts such as Metric, The xx, J-Live, Brazilian Girls and have toured with The Slip, Zero 7 and Minus the Bear.

Sarah Barthel and Josh Carter were inspired by artists like J Dilla, Serge Gainsbourg, My Bloody Valentine, Madlib, Sonic Youth, The Beatles and David Bowie.

In 1 November 2011, the band issued the EP Nightlife. This EP includes the single ""Don't Move"".

The duo collaborated with Big Boi from OutKast on three songs from his second studio album, Vicious Lies and Dangerous Rumors: ""Objectum Sexuality (feat. Phantogram)"", ""CPU (feat. Phantogram)"" and ""Lines (feat. A$AP Rocky & Phantogram)"". Phantogram are also credited as producers for the song ""Objectum Sexuality"".

Official site: http://www.phantogram.net <a href=""https://www.last.fm/music/Phantogram"">Read more on Last.fm</a>. User-contributed text is available under the Creative Commons By-SA License; additional terms may apply."
131,freyr,120189,784920," <a href=""https://www.last.fm/music/Freyr"">Read more on Last.fm</a>. User-contributed text is available under the Creative Commons By-SA License; additional terms may apply."
132,yungblud,892100,32658686,"Dominic Richard Harrison (born 5 August 1997), known professionally as YUNGBLUD (pronounced ""Youngblood""), is an English singer, musician and songwriter. In 2018, he released his first EP, YUNGBLUD, followed shortly after by the album 21st Century Liability.  In 2019, he released another EP, The Underrated Youth. His second album, Weird!, was released in late 2020 and peaked at the top of UK Albums Chart and reached number 75 on US Billboard 200. <a href=""https://www.last.fm/music/Yungblud"">Read more on Last.fm</a>. User-contributed text is available under the Creative Commons By-SA License; additional terms may apply."
133,neil frances,496161,7216685,"The duo behind Neil Frances come from two different worlds, and yet their union sounds destined. Jordan Feller and Marc Gilfry first met in 2012. It wasn’t until four years later that Jordan called Marc to lend vocals to some demos, which were intended as a placeholder. As with the best of accidents, the two liked what they heard and Neil Frances was born.

Jordan grew up in Sydney, then spent time in London, before landing in Los Angeles. Marc, a California native, grew up outside of Los Angeles in Rancho Cucamonga, in a house across the street from his aunt, uncle and cousin. Since childhood, the two found themselves exposed to a range of music, from opera, disco, hip-hop and more, all of which informs their songwriting today.

These influences can be heard on Neil Frances’ dreamy debut EP, Took A While, consisting of five lustrous, reverberating dance tracks featuring one infectious melody after the other. Their sound caught the attention of Jungle and Poolside, who they toured with earlier this year. When the music discovery platform, The Wild Honey Pie first heard their music, they quickly invited them to play the launch of their Los Angeles dinner party series (held in early November) at Checker Hall. <a href=""https://www.last.fm/music/Neil+Frances"">Read more on Last.fm</a>. User-contributed text is available under the Creative Commons By-SA License; additional terms may apply."
134,remi wolf,768895,25629454,"Remi Francis Wolf (born February 2, 1996) is an American singer and songwriter from California. As a senior at Palo Alto High School, she appeared as a contestant on American Idol in 2014. After completing her studies at USC Thornton School of Music in 2018, she made her solo debut with the self-released extended play You're A Dog! in October 2019. Wolf subsequently released her second EP and major-label debut, I'm Allergic To Dogs!, on Island Records and Virgin EMI Records in June 2020, followed by her debut studio album, Juno, in October 2021. <a href=""https://www.last.fm/music/Remi+Wolf"">Read more on Last.fm</a>. User-contributed text is available under the Creative Commons By-SA License; additional terms may apply."
135,jon and roy,115694,1041103,"'Jon and Roy' is a band based out of Victoria, B.C., Canada.   Members include Jon Middleton, Roy Vizer and Ryan Tonelli.   They have recorded three albums, Sittin' Back (2005), Another Noon (2008) and most recently, Homes (2010). 

In the past few years the band has travelled all over their home country of Canada, touring and sharing the stage with many international acts including The Cat Empire, Xavier Rudd, State Radio and Finley Quaye.  The summer of 2010 also saw them performing at the Winnipeg, Calgary and Vancouver Folk Festivals.  

New album, Let it Go, will be released worldwide June 12th, 2012.

 <a href=""https://www.last.fm/music/Jon+and+Roy"">Read more on Last.fm</a>. User-contributed text is available under the Creative Commons By-SA License; additional terms may apply."
136,planet giza,291467,2547046,"Planet Giza is a Montreal-based trio that harmonizes the talents of Rami B, Tony Stone and DoomX. The crew is able to reflect their multi-cultural backgrounds through a repertoire of diverse sound. They attribute this versatility to the diverse community of Montreal, as well as their widely-varying musical influences. Since releasing their latest project Added Sugar in 2019, they have performed for London’s Clash Magazine and at Montreal’s International Jazz Festival. Their production has been featured on The Tonight Show with Jimmy Fallon in a performance by GoldLink. In 2021, they released their latest EP Don't Throw Rocks At The Moon with the lead single When The Moving Stops making waves. This led to Planet Giza having their first headline show in London. They’re currently working on the next album slated for release in 2022. <a href=""https://www.last.fm/music/Planet+Giza"">Read more on Last.fm</a>. User-contributed text is available under the Creative Commons By-SA License; additional terms may apply."
137,paco amoroso,79404,1856189,"Ulises Guerriero, mejor conocido por su nombre artístico Paco Amoroso, es un cantante argentino de trap experimental que junto a Ca7riel forma un dúo musical. Ambos ganaron gran popularidad en Argentina en el año 2019 gracias al éxito que tuvieron temas como «Ouke» y «A mí no». En cuanto a la carrera en solitario de Paco cabe destacar su colaboración con Bizarrap para la BZRP Music Sessions #3, la cual fue una de los primeros grandes éxitos de este productor.

Desde temprana edad tuvo un gran interés por la música y es que, de hecho, cuando apenas tenía seis años ya tocaba el violín; por aquel entonces también conocería a Ca7riel con quien varios años más tarde formaría un dúo de música que obtendría gran éxito dentro de la escena urbana argentina.

Este dúo ha llegado a publicar varios sencillos en conjunto, aunque también se han dado el tiempo para tener sus carreras en solitario. En cuanto a Paco a día de hoy cuenta con un single álbum y un álbum de estudio, este último publicado recién en noviembre de 2021. <a href=""https://www.last.fm/music/Paco+Amoroso"">Read more on Last.fm</a>. User-contributed text is available under the Creative Commons By-SA License; additional terms may apply."
138,robohands,244556,2845246,"
'Robohands' is the experimental solo/collaborative project of London based composer/multi instrumentalist Andy Baxter. The debut Robohands LP ‘Green’ was released on Village Live records in 2018, incorporating elements of jazz, krautrock and ambient music. The follow up, 'Dusk' was released independently in 2019 and new album 'Shapes' will be out on King Underground in 2020.


 <a href=""https://www.last.fm/music/Robohands"">Read more on Last.fm</a>. User-contributed text is available under the Creative Commons By-SA License; additional terms may apply."
139,bathe,201888,1295465,"(1) Sludge/doom metal/grindcore/mathcore from Columbia, South Carolina, United States

Bandcamp

(2) The duo of Devin and Corey comprise the band bathe, an R&B/Soul group located out of Brooklyn New York. <a href=""https://www.last.fm/music/bathe"">Read more on Last.fm</a>. User-contributed text is available under the Creative Commons By-SA License; additional terms may apply."
