,artist,listeners,playcount,bio_content
62,gregory alan isakov,950829,28501128,"Gregory Alan Isakov (born in 1979 in Johannesburg, South Africa) is a South Africa-born American singer-songwriter. He released his first album, Rust Colored Stones, in 2003.

Isakov has been described by Boulder Weekly, ""Strong, subtle, a lyrical genius"" and has been compared to his influences; Bruce Springsteen, Kelly Joe Phelps, Iron & Wine and Gillian Welch. Isakov's humble presence and his overwhelming voice and guitar style has been treasured by an ever-growing and captivated fan base. 

Born in Johannesburg, South Africa, Isakov immigrated to the States with his family and grew up in the Philadelphia area. He started touring at the age of 16 with his first band. In 1999 he sought out his solo acoustic roots and moved to Colorado where he now resides. 

Isakov has been taking on the folk music scene with his 2003 release ""Rust Colored Stones"" LP and his 2005 release ""Songs For October"". Isakov's song-craft lends to the deepest lyrical masterpieces, and his live performance has been known to quiet and shake the biggest rooms. 

Isakov has shared the stage with numerous touring artists such as Rodrigo y Gabriela, Alexi Murdoch, and Fiona Apple. He has performed throughout the United States, playing numerous music festivals such as Falcon Ridge Folk Fest, Rocky Mountain Folks Fest and Southpark Music Festival. Isakov has toured solo and with his band ""The Freight"".

In 2007, Gregory was named ""Best Male Singer-Songwriter"" by Westword Magazine.

Subsequent albums have included That Sea, The Gambler (2007), This Empty Northern Hemisphere (2009), The Weatherman (2013), Evening Machines (2018).
 <a href=""https://www.last.fm/music/Gregory+Alan+Isakov"">Read more on Last.fm</a>. User-contributed text is available under the Creative Commons By-SA License; additional terms may apply."
63,mazie,329009,3770008,"Pairing fatalistic lyrics with shiny alt-pop arrangements that are as infectious as they are unpredictable has seen the quick ascension of 23-year old Baltimore native mazie. Her single ""dumb dumb,"" which appears on her debut EP the rainbow cassette, is a perfect embodiment of mazie's multilayered, psychedelic twist on pop that's Stepford Wives meets Lisa Frank. It's ironic, it's iconic, and to date the track has over 35+ million cumulative streams.

mazie fell in love with singing at an early age and spent most of her childhood studying classical and jazz vocals. By the time she hit her teenage years living outside of Baltimore, she was writing her own music and recording it with her neighbor, Elie Rizk (Remi Wolf, Keshi, Bella Poarch), who was teaching himself to engineer and produce in his basement studio. The two spent years experimenting and collaborating before they landed on “no friends,” mazie’s breakout 2020 debut. Clocking in at less than two minutes, the utterly addictive single exploded online, earning widespread acclaim and quickly racked up millions of streams. “We were in total shock,” says mazie. “That song really defined the project for us, and when it started going crazy, everything just accelerated. <a href=""https://www.last.fm/music/Mazie"">Read more on Last.fm</a>. User-contributed text is available under the Creative Commons By-SA License; additional terms may apply."
64,mad tsai,233787,2996454,"Jonathan Chai (born July 13, 2001), professionally known by his stage name Mad Tsai, is a Taiwanese and Peruvian singer-songwriter who gained popularity on the app TikTok under the username, ""madsteaparty"". He gained even more fame when he came out to his mother with his viral song “boy bi”, uploading her reaction to TikTok.

Mad is originally from Huntington Beach, California, and at age 13, began writing music and performing at local shows to help talk about experiences navigating mental health, bullying, self-love, and identity. He was involved in marching band and choir as a teen and picked up the ukulele in high school.

Currently, Mad is based in Los Angeles and occupies the majority of his time as a student at UCLA. He is involved in the university’s acapella group Resonance and is pursuing two majors, music industry/history and English. Mad currently creates music and content whenever he can find the time for it. <a href=""https://www.last.fm/music/Mad+Tsai"">Read more on Last.fm</a>. User-contributed text is available under the Creative Commons By-SA License; additional terms may apply."
65,fantastic negrito,184897,1748059,"Xavier Amin Dphrepaulezz (born 1968), better known by his stage name Fantastic Negrito, is an African-American singer-songwriter whose music spans blues, R&B, and roots music. Negrito made a record deal with Prince's former manager, and later, in 1993, made another deal, this one with Interscope Records. On January 9, 1996, he released his first album, The X Factor, under the mononym Xavier. The album was released on Lexington House Records and distributed by Interscope. He was in a near-fatal car crash in 1999, which left him in a coma for three weeks; he has since said that he felt that this crash ""released"" him because Interscope terminated their contract with him, after which he resumed hustling. In 2007, he stopped making music, but he returned in 2014, describing his new musical style as ""black roots music for everyone"". In 2015, he won NPR's Tiny Desk Contest. In 2016, his album The Last Days of Oakland was released on the Blackball Universe label. Negrito won his first Grammy in 2017, when The Last Days of Oakland received the Grammy Award for Best Contemporary Blues Album. <a href=""https://www.last.fm/music/Fantastic+Negrito"">Read more on Last.fm</a>. User-contributed text is available under the Creative Commons By-SA License; additional terms may apply."
66,lord huron,1848873,50949208,"Lord Huron are an American alternative rock band founded by Ben Schneider, a Michigan-born visual arts major. 

Origins:
In the spring of 2010 Schneider traveled from Los Angeles to Northern Michigan. At Lake Huron, he developed songs for the first Lord Huron EP. He named the recording, Into the Sun. Upon his return to L.A., Schneider set to work putting a band together. The first to join him was his percussion-playing childhood friend Mark. Each of the band members of band hail from Michigan.

Into The Sun and Mighty
Lord Huron released two EPs in 2010, Into the Sun and Mighty. Pop & Hiss, the LA Times Music Blog, described Mighty as ""full of lush acoustic guitars and Midwestern-accented harmonies as warm as a winter fireplace, but it's the Caribbean-influenced percussion that fans Lord Huron's folk sound into flame,""and Pitchfork could only classify it as ""a stylistic superball, bouncing off any wall you put around it."" NPR's World Cafe wrote ""the band's lush harmonies are backed by a hazy whirlpool of polyrhythmic tropical drums and folk guitars.""
Despite the fact that Schneider played all of the instruments on both EPs, he has gathered a band for live performances, which have also gotten positive reviews. ""The totality of the experience was like being on hand for a combination drum circle, chamber performance, and Calypso street party,"" wrote LA Weekly.Some of the larger shows the band has performed at include Lollapalooza (2011) and Outside Lands (2011), as well as a marathon ten shows in four days at the SXSW (2011) music festival.

Discography

EPs
Into The Sun (2010)
Mighty (2010)
Time to Run (2012)

LPs
Lonesome Dreams (2012)
Strange Trails (2015)
Vide Noir (2018)
Long Lost (2021) <a href=""https://www.last.fm/music/Lord+Huron"">Read more on Last.fm</a>. User-contributed text is available under the Creative Commons By-SA License; additional terms may apply."
67,veintiuno,16870,393527,
68,matt maltese,1377147,46647866,"Themes like the banality and loneliness of life have been consistently weighed heavy on 27-year-old London artist Matt Maltese's records. Following his 2018 debut album ""Bad Contestant"" and acclaimed 2019 album ""Krystal"", which endeared him to tastemaker outlets like NME, NPR, Line Of Best Fit, Vice, Interview, DIY, Dork and more, his appropriately titled EP ""madhouse"" isn't just a score for the everyday boredoms we encounter.

Maltese has always nailed lonesome provocations with idiosyncratic dry wit but ""madhouse"" reckons with those emotions in a way the half Brittish, half Canadian hasn't yet fully explored until now. ""I've found that sometimes the majority of the emotional journey of love and life is actually the search for an understanding of it. And these songs try and make peace with all of that, poke fun at it and, ultimately, embrace it."" <a href=""https://www.last.fm/music/Matt+Maltese"">Read more on Last.fm</a>. User-contributed text is available under the Creative Commons By-SA License; additional terms may apply."
69,parcels,482090,12272720,"Parcels is an electro-pop boys quintet formed in Australia, now based in Berlin. They are a Berlin-based band composed of Louie Swain (keyboards), Patrick Hetherington (keyboards), Noah Hill (bass), Anatole ""Toto"" Serret (drums) and Jules Crommelin (guitar), who migrated there from Australia. The band formed in 2014 while at high school in Byron Bay, Australia, and are now based in Berlin, Germany.

Discography:
2015: Clockscared EP
2017: Hideout EP
2018: Parcels LP <a href=""https://www.last.fm/music/+noredirect/Parcels"">Read more on Last.fm</a>. User-contributed text is available under the Creative Commons By-SA License; additional terms may apply."
70,kaytranada,1230889,53624726,"Kaytranada (stylized as KAYTRANADA, sometimes shortened as KAYTRA) is Haitian-Canadian music producer, rapper and singer Louis Kevin Celestin (born August 25, 1992). Celestin rose to prominence after releasing a series of mixtapes, remixes, and original music projects beginning in 2010 under the alias Kaytradamus. By 2013, and under the moniker Kaytranada, he began gaining wider recognition and, the following year, signed a deal with XL Recordings, with whom he released his debut studio album, 99.9%, in 2016. In 2019, he released its follow-up, Bubba, for which he won two Grammy Awards including Best Dance/Electronic Album. Celestin is one half of the hip hop duo The Celestics, along with his brother Lou Phelps. 

Kaytranada arrived during the early 2010s with ear-perking remixes and an array of sounds that veered from J Dilla-inspired hip-hop beats to distinctly woozy house grooves. Numerous commissioned works and short-form solo releases led to his debut album, 99.9%—which went on to win the 2016 Polaris Music Prize and the 2017 Juno Award for Electronic Album of the Year. After signing to major-label RCA, the Haitian-Canadian released his second album, Bubba.   

Kaytranada has worked with a wide array of artists including Anderson .Paak, Kendrick Lamar, Chance the Rapper, Robert Glasper, Lauren Faith, Mick Jenkins, GoldLink, Snoop Dogg, Freddie Gibbs, and Alicia Keys. His 2016 debut album, 99.9% features guest appearances from Phonte, Craig David, Vic Mensa, Little Dragon, and more. Bubba, his second album, was released the following December with Pharrell, Kali Uchis, and Masego among the contributors—and has won the young producer two Grammys at the 2021 Grammy Awards. <a href=""https://www.last.fm/music/Kaytranada"">Read more on Last.fm</a>. User-contributed text is available under the Creative Commons By-SA License; additional terms may apply."
71,myd,326444,2866023,"
As a graduate in sound engineering at prestigious Parisian FEMIS film school, Quentin Lepoutre, aka Myd, offered his strong technical expertise to make his Club Cheval crew – him plus Canblaster, Panteros666 and Sam Tiba – become serious outsiders on the dance music map. A strawberry-blond version of Quincy Jones for the Facebook/Tumblr/post-empire generation, Myd’s a very versatile music-maker, both able to deliver purely functional, club-oriented tracky material, and poppier, regressive house fantaisies. His audio skills give his work a unique 3D coating, a singular, artificial patina. The sound of Myd is something wide and hyperactive, though displaying the compacted, throbbing textures that define the trademark Club Cheval sound.

Myd’s long-term ambition would be to build new standards for mainstream dance music. Traffic between underground scenes and mass-produced hits having never been so saturated, listeners need artists to act as musical scouts, to filter, sort out, and recompose this data overload, and instinctively conjuring its secret pathways and logic. And that’s pretty much what Myd’s here for. He aspires to become a proper pop producer, a true « music director », and can’t really be bothered with some niche-star status. Working with other artists always had him refine his own personal sound, and helped him use his production tools better and better. Myd’s sound lays on a rich, contrasted aural palette : it’s high-tech sounding, well-balanced, complex yet articulate. It blends Euro techno gusts with tropical siroccos, and an unmissable song-craft with a taste for baroque-ish sophistication.

Since his first track, « Train to Bamako », one the founding hits of the tropical house scene in 2009, Myd has produced many brilliant, smart remixes, for artists such as Yelle ou Two Door Cinema Club. Then last spring, he came back with the « Octodip » EP – that was less tropical and more focused on occult vocal cut-up work – for new French label Marble, created in early 2011 by former Institubes mainstays Para One, Surkin and Bobmo. As Club Cheval are currently working on their debut album, the future seems clear and vivid for our boy Myd, teeming with previously unheard musical ideas and aural stimuli. And meanwhile, go and check his productions, feel ecstatic, and just imagine what’s up next. <a href=""https://www.last.fm/music/Myd"">Read more on Last.fm</a>. User-contributed text is available under the Creative Commons By-SA License; additional terms may apply."
72,lewis ofman,227174,2312839,"With tints of youth and at the same time hints of 70’s Italian film soundtracks, Lewis OfMan's music creates a shivering atmosphere where melancholia meets elevation and joy. He started music as a drummer and then learnt the piano and guitar by himself. 

His songs, with sophisticated jazzy chords and polished up percussions, have the will to take his audience along in a shared emotionalism sphere. With his youthful features, Lewis steps forward as a precursor.

Fièrement auto-produit, Lewis OfMan s’inspire de bandes originales de films italiens des années 70. Ses mélodies témoignent d'un univers profond, enclin à la mélancolie, au frisson et à l’apaisement. Les compositions aux accords lunaires et aux percussions léchées de ce batteur de formation, transcrivent la volonté d’emmener son auditoire dans une sphère d’émotivité partagée. Tranchant avec ses traits juvéniles, Lewis s’avance en précurseur. <a href=""https://www.last.fm/music/Lewis+OfMan"">Read more on Last.fm</a>. User-contributed text is available under the Creative Commons By-SA License; additional terms may apply."
73,big red machine,499669,10956065,"
Side project of Justin Vernon (Bon Iver) & Aaron Dessner (The National).

From their website:
In 2008, Aaron sent Justin an instrumental sketch of a song called ""Big Red Machine"" for Dark Was The Night. This was before they had met in person. Justin wrote a song to it, interpreting the Big Red Machine title as a heart. 10 years of friendship later, there are 10 more songs. Big Red Machine. <a href=""https://www.last.fm/music/Big+Red+Machine"">Read more on Last.fm</a>. User-contributed text is available under the Creative Commons By-SA License; additional terms may apply."
74,the paper kites,1006814,20898606,"The Paper Kites are a folk rock band from Melbourne, Australia, formed in 2010. The band consists of Sam Bentley (lead vocals, guitar), Christina Lacy (keyboard, guitar), David Powys (guitar), Samuel Rasmussen (bass), and Josh Bentley (drums). Sam Bentley and Christina Lacy established the band, having been friends and musical collaborators since high school. Their performances in Melbourne was leading to the addition of David Powys on guitar and banjo, Sam Rasmussen on bass and synth, and Josh Bentley on drums to complete the lineup in 2010.

The band initially recorded demo recordings at Sam Bentley's home and Rasmussen's university. Encouraged by friends, they released homemade EPs and gained traction with their single ""Bloom"" in 2010. The band performed extensively in Australia and New Zealand, including opening for acts such as Hungry Kids of Hungary and Passenger.

The band initially gained attention with their single ""Bloom"" in 2010, leading to extensive performances in Australia and New Zealand. In 2011, they recorded their first EP, ""Woodland,"" followed by the release of the EP ""Young North"" in 2012. They toured nationally and opened for acts like Josh Pyke and Boy & Bear. Following the tour, the band did a small run of shows opening for UK band Bombay Bicycle Club in January 2013.

Their debut full-length album, ""States,"" was recorded in 2013, and they embarked on a national tour in Australia. They also toured internationally, including the United States and Canada. The band gained exposure with song placements in Grey's Anatomy and released their second album, ""Twelvefour,"" in 2015. It was a concept album written between midnight and 4 AM.

In 2018, they released the albums ""On the Train Ride Home"" and ""On the Corner Where You Live,"" with the latter recorded in Connecticut with producer Peter Katis. They embarked on an extensive tour and were nominated for Best Adult Contemporary Album at the ARIA Music Awards.

In August 2020, the band announced their fifth studio album Roses, a collaborative album of duets. The album features Julia Stone, Lucy Rose, Rosie Carney, Aoife O'Donovan, Nadia Reid, Maro, Amanda Bergman, Ainslie Wills, Lydia Cole and Gena Rose Bruce. The album was released on 12 March 2021.

In May 2023, the Paper Kites announced the forthcoming release of their sixth studio album, At the Roadhouse, which was released on 1 September 2023.

The Paper Kites' musical style has evolved over the years, incorporating elements of folk, fingerstyle guitar, harmonies, and moody soundscapes. Their versatility and influences from various genres have shaped their musical direction. <a href=""https://www.last.fm/music/The+Paper+Kites"">Read more on Last.fm</a>. User-contributed text is available under the Creative Commons By-SA License; additional terms may apply."
75,l'impératrice,533443,12258891,"L'Impératrice (French pronunciation: [lɛ̃peʁatʁis]; ""The Empress"") is a project that began in 2012, a French band with a myriad of dreams that have now become reality. However, the vision of each of them has not changed that much as they have become an international band and they claim to keep their feet very firmly on the ground, as, in their words, it is always a work in progress. Despite this, there are still achievements to unlock, one of which is playing at Madison Square Garden, one of their favourite venues.

The band was initially formed by keyboardist Charles de Boisseguin, who started the project solo until he met the other keyboardist, Hagni Gwon. Gwon later called in bassist David Gaugué and drummer Tom Daveau. Soon after, guitarist Achille Trocellier joined, and the group was officially formed in 2012. In 2015, french singer Flore Benguigui joined the group. After making 3 studio albums and spending 9 years with the band, Flore announced her departure from L'Impératrice in September 2024, citing ""profound personal, artistic, and fundamental disagreements"" between her and the band. Less than a month later, the band revealed their new vocalist Louve.

Their pop, funk and electronic sounds, Flore's sweet tone singing in French, coupled with a retro yet futuristic aesthetic, broke the language barrier and took them to stages they could never have imagined. After albums and EPs such as ""Sonate Pacifique"", ""Odyssée"", ""Vanille Fraise"" and ""Matahari"", their most recent album is 2024's ""Pulsar"", with songs in English and French, which included collaborations with artists such as Erick the Architect and Maggie Rogers.

L'Impératrice's retro pop and disco music places them as heirs to the French Touch trend pioneered by Daft Punk, to whom they have paid homage in their music videos, and represented by groups such as Air and Phoenix. But in their case, they pride themselves on being a band that doesn't rely so much on synthesizers, but plays their instruments entirely live.

They once received an email from a fan who congratulated them on their EP L'Odyssée but couldn't understand why on vinyl Flore Benguigui's voice sounded so different from the YouTube videos, almost sounding like a boy. The answer to the mystery: he had been playing the record at the wrong speed. This happy accident led the band to release a slowed-down version of the work. <a href=""https://www.last.fm/music/+noredirect/L%27Imp%C3%A9ratrice"">Read more on Last.fm</a>. User-contributed text is available under the Creative Commons By-SA License; additional terms may apply."
76,ren,360083,8907496,"There are multiple artists by this name:

1) Ren Gill, a singer, songwriter, producer, rapper, multi-instrumentalist based in Brighton. Started his career busking. Signed with Sony Records in 2010, but got dropped due to a mysterious illness he developed the same year, eventually diagnosed as Lyme disease. Self-released his debut album Freckled Angels in 2016 with the intention of raising awareness of his illness. Also a member of The Big Push from 2019 to 2022. He has attracted some degree of notoriety for his self-released videos, which are often solo performances filmed in one take; his track ""Hi Ren"", about his struggles with mental and physical illness, received 5.85 million views on YouTube within two months of its release. In 2023 he managed to reach top 1 in UK's album charts with the album Sick Boi.

2) Tokyo-born male singer-songwriter ReN (born 28 Feb 1994) whose debut album ""Lights"" got released in June 2016

3) A 17-year-old (as of February 2020) female Canadian singer-songwriter making her career debut in February 2019 with her single, ""Waves""

4) REN is a Japanese Rapper/Singer

5) Arranger, composer, producer, and freelancer, who is also involved in the Touhou doujin music scene, as a member of Higan Daybreak.

6) A South Korean sub-vocalist and maknae in the K-pop group NU'EST, soon to be a soloist <a href=""https://www.last.fm/music/Ren"">Read more on Last.fm</a>. User-contributed text is available under the Creative Commons By-SA License; additional terms may apply."
77,ethel cain,874868,72754759,"Hayden Silas Anhedönia, known professionally as Ethel Cain, is an American singer and songwriter from Perry, Florida.

Raised in a Southern Baptist family, she attended church and was involved in choir singing from a young age. In mid 2017, Cain began experimenting with writing, recording and producing her own ethereal style, inspired by Christian music and Gregorian chants. After releasing various mixtapes and EPs on streaming platforms as well as sites like SoundCloud and Tumblr, she adopted a more alternative sound and began using the Ethel Cain moniker in mid 2019. Cain's lyrics focus on nostalgic and Southern Gothic themes, such as poverty, substance abuse, domestic violence, death and transgenerational trauma. Her music has been associated with the ambient, alternative rock and dream pop genres.

In 2022, Cain released her debut studio album, Preacher's Daughter, to widespread acclaim from music critics — many of whom called it one of the best albums of the year.

Alongside the Ethel Cain moniker, Anhedönia has also released music as White Silas, Miss Anhedönia, אשמדאי, tommy, and ΛTLΛS. <a href=""https://www.last.fm/music/Ethel+Cain"">Read more on Last.fm</a>. User-contributed text is available under the Creative Commons By-SA License; additional terms may apply."
78,conociendo rusia,51544,1860775,"Conociendo Rusia es un proyecto liderado por Mateo Sujatovich. Desde el primer disco, homónimo, que la intención está clara: refundar la canción clásica argentina. Subido en los hombros de los más grandes, su manera de componer nos regala música

que es familiar y novedosas a la vez.

Una combinación explosiva. En 2019 Mateo vuelve quedar en boca de todos con “La mexicana”, un single que al ritmo de una ranchera rockera aborda el desamor y se sigue acercando al oido popular. Su búsqueda se profundiza en “Cabildo y Juramento”. Audaz e intensamente contemporáneo, el álbum es una radiografía de estos años, signados por una exaltación amorosa y una efervescencia juvenil que se escucha en cada tono del álbum. Conociendo Rusia se encuentra en un gran momento artístico y se posiciona como uno de los referentes más fuertes de la escena del nuevo rock argentino. En los últimos años se consolidó en Argentina con un público que no para de crecer.  Llevó sus canciones a México, se presentó en venues como Niceto Club (CABA), Studio Theater (Córdoba) y Guajira (La Plata) con localidades agotadas, y formó parte de los principales festivales del país como Lollapalooza, La Nueva Generación, Cosquín Rock y Rock en Baradero. Realizó un proyecto de streaming a través del cual llegó a distintos lugares del mundo como Europa, Estados Unidos y Latinoamérica.

Actualmente se encuentra nominado en 3 categorías de los Latin Grammys. <a href=""https://www.last.fm/music/Conociendo+Rusia"">Read more on Last.fm</a>. User-contributed text is available under the Creative Commons By-SA License; additional terms may apply."
