,artist,listeners,playcount,bio_content
169,fall out boy,4307715,305362560,"Fall Out Boy are a pop punk band formed in 2001 in Glenview, Illinois after good friends Joe Trohman and Pete Wentz met high schooler Patrick Stump. Stump originally auditioned as a drummer, but soon became the lead singer. The following year, the band debuted with a self-released demo and followed it up with the May 28, 2002 release of Split EP, which featured Project Rocket, on Uprising Records. The group released a mini-LP, Evening Out With Your Girlfriend, also on Uprising Records, in 2003.

2003–2004: Independent success

After the release of their mini-album, Fall Out Boy built a large following playing in the Chicago area. Drummer  Andy Hurley, formerly of Racetraitor, joined the band, while Mike Pareskuwicz and T.J. Kunasch left. At this time, Stump also took over rhythm guitar duties. After signing to Fueled By Ramen, they released their first full-length album, Take This to Your Grave, on May 6, 2003.

With singles Grand Theft Autumn/Where Is Your Boy and Saturday receiving video airplay on FUSE and mtvU and radio airplay on alternative stations across the country, the band soon gained a cult following. The album sold very well and eventually achieved gold status, but only after the success of their next album, From Under The Cork Tree.

In mid-2003 the band signed with Island Records, part of the super label The Island Def Jam Music Group along with Def Jam Records. While recording their mainstream debut, they released the acoustic EP My Heart Will Always Be the B-Side to My Tongue on Fueled by Ramen, May 18, 2004. It debuted at #153 on the Billboard Top 200, their first entry on the chart. The two-disc set included a DVD with videos, more acoustic performances, and a fan photo gallery.

2005–2006: Commercial debut

On May 3, 2005, Fall Out Boy released their major label debut, From Under the Cork Tree, which debuted on the Billboard 200 at #9, selling over 68,000 copies in its first week. The album achieved double platinum status and has sold over 2.5 million albums in the US alone. Earlier that year, the band’s stability was threatened when Wentz overdosed on the sedative Ativan in a failed suicide attempt. The track 7 Minutes In Heaven (Atavan Halen) from their album From Under the Cork Tree is based upon Wentz’s attempted suicide.

Their first single, Sugar We’re Goin’ Down, peaked at #8 on the Billboard Hot 100, #6 on the Pop 100 and #3 on the Modern Rock Charts. The video reached #1 on MTV’s TRL, where it was retired on August 26, 2005. The video also won the MTV2 Award at the 2005 MTV Video Music Awards, prompting a huge new interest and surge in sales. The band was also nominated for “Best New Artist” at the 2006 Grammy Awards.

The second single off the album, Dance, Dance, became their second Top 10 Single when it peaked at #9 on the Hot 100. It also reached #6 on the Pop 100 and became the bands top charted hit when it reached #2 on the Modern Rock Charts. The video for the song premiered on TRL on October 11, 2005; it soon reached #1 and was later retired on January 17, 2006. The third single off the album, A Little Less Sixteen Candles, A Little More ‘Touch Me’, was much less popular than both prior singles but still managed to peak at #65 on the Hot 100 and hit #1 twice on TRL, retiring on June 6, 2006.

2007: Continuing prosperity

Fall Out Boy’s third studio album, titled  Infinity On High, was released on February 6, 2007. The lead single,  This Ain’t A Scene, It’s An Arms Race, debuted at the 2006 American Music Awards. The video debuted on MTV on Tuesday, December 19, 2006. In the album’s opening week, Infinity on High reached number 1 on the Billboard 200, selling 260,000 copies.

“This Ain’t a Scene, It’s an Arms Race” peaked at number 2 on the UK Singles Chart on February 4, 2007, making it their most successful song in the UK to date. The single also peaked on the U.S. Hot 100 at number 2 and the U.S. Pop 100 at number 1.  The Carpal Tunnel Of Love (the second single released from the album) reached number 81 on the U.S. Hot 100 by way of digital sales alone. Thnks fr th Mmrs was released on April 9, 2007 and made it to #14 on the Billboard Hot 100 and peaked at #12 on the UK Singles chart.

Showing their versatility, Fall Out Boy has collaborated with rappers Kanye West, Babyface, Jay-Z, and Timbaland. Babyface produced and Jay Z is featured on Thriller. They also worked with Timbaland on his new album Timbaland Presents Shock Value, where they are featured on the track One and Only, for which Stump and Wentz both contributed in writing. Stump was also featured on two songs with Gym Class Heroes (also signed with Fueled By Ramen), including their #1 Single Cupid’s Chokehold. He also was a guest vocalist on Motion City Soundtrack’s single, Everything Is Alright as well as contributing to If You Could Remember.

2008-2009:

On April 1, 2008, Fall Out Boy released their live album, **** Live in Phoenix. The album was recorded in Pheonix on June 22. It contained a studio recording of Micheal Jackson’s Beat It with John Mayer as a guest on the guitar.

On December 16th, 2008, Fall Out Boy released their 4th studio album, Folie à Deux (literally meaning “madness shared by two”). The lead single for the album, I Don’t Care was released September 8, 2008.

On November 17, 2009, Believers Never Die - Greatest Hits was released, featuring two new songs titled Alpha Dog and From Now On We Are Enemies. Along with the release of this compilation, Fall Out Boy announced that they were taking a break. ""We're just taking a break and decompressing. We're not putting terms on when we're coming back. We're going to come back when everybody's excited about it and it's fun."" said Pete Wentz to J14 Magazine.

2010-2012: Hiatus

In early 2010 the band entered a state of hiatus, with each member eventually going off to explore their own musical interests. Wentz formed DJ duo Black Cards with singer Bebe Rexha in July 2010, releasing an EP before Rexha quietly left the group in January 2012. Trohman and Hurley started the band The Damned Things with Scott Ian from Anthrax and members of Every Time I Die, releasing their debut album Ironiclast in December 2010.

Stump recorded his debut solo album Soul Punk which was released on July 26, 2011. Despite gaining generally positive reviews, ticket sales were poor with many Fall Out Boy fans unwilling to follow him in his new musical direction. This negative feedback caused Stump to create his blog entry ""We Liked You Better Fat"" in which he honestly aired his feelings, causing Wentz to reach out to him and ultimately begin collborating again musically in February 2012.

2013-2014: Reunion and Save Rock and Roll

During 2012, the band reformed and began attempts to reinvent their sound. Sessions were difficult, with early attempts a struggle to produce new material. On February 4, 2013 the band simultaneously announced their reunion, a new single My Songs Know What You Did in the Dark (Light Em Up) and the album Save Rock and Roll which was released the following month.

2014–2016: American Beauty/American Psycho

Centuries - the first single of Fall Out Boy's sixth studio album - premiered on September 8, 2014. Another song titled Immortals was released October 14, 2014, as part of the soundtrack for the Walt Disney film Big Hero 6. On November 24, 2014, the title of Fall Out Boy's sixth studio album was announced as American Beauty/American Psycho; the album was released on January 20, 2015.

2017–2022: MANIA

On April 27, 2017, Fall Out Boy announced that their new album was set to be released on September 15, titled M A  N   I    A. The first single, Young and Menace was released the same day. The second single, Champion was released in the U.S. on June 22 and worldwide on June 23. On August 3, 2017, Patrick Stump tweeted that the album's release would be pushed back to January 19, 2018, because the band were not satisfied with the results of their work at the time.

A few months after the release of MANIA, Fall Out Boy released their ninth EP,  Lake Effect Kid. It was released on August 23, 2018 through Island and DCD2. It features themes from their older albums as well as a song that was a demo for  CitizensFOB Mixtape: Welcome To The New Administration  -- which was a promotional mixtape for Folie à deux.

They then released  Believers Never Die (Volume 2) on November 15, 2019. It is their second greatest hits album and was released through Island. It included two new songs,  Bob Dylan  and  Dear Future Self (Hands Up) .

2023–present: So Much (For) Stardust

Fall Out Boy released a new single,  Love From the Other Side, on January 18, 2023. The single featured the song,  Love From the Other Side, as well as an edit of the track. After the release of this single, they announced that their eighth studio album, So Much (For) Stardust, was to fully release on March 24, 2023. This album marked the first time the band had released music through Fueled By Ramen since Take This to Your Grave, their 2003 debut album. They also once again joined forces with producer Neal Avron, who produced From Under the Cork Tree, Infinity on High, and Folie à Deux. <a href=""https://www.last.fm/music/Fall+Out+Boy"">Read more on Last.fm</a>. User-contributed text is available under the Creative Commons By-SA License; additional terms may apply."
170,ikon,536041,16736964,"There is more than one artist with the name Ikon;

1) IKON is an Australian goth/darkwave band that has gained an international following.   Chris McCarter(vocals, guitar, programming) and Dino Molinaro (bass) began to create music as high school students in  Melbourne, Australia in 1988. In 1991, their band Death in the Dark, which included Michael Carrodus on vocals, changed its name to IKON. 

IKON has released five studio albums, five EPs and seventeen singles, with additional unique versions that have been produced for Germany, America and Russia. The band’s last full-length release, Destroying the World to Save It, attained number 21 on the Native DJ World Charts for best album of 2005. 
  
IKON has frequently toured Australia, Europe and the UK. IKON has played on the same bill as The Sisters of Mercy, H.I.M., Soft Cell, Death in June, London After Midnight and The Mission. IKON has performed at the Eurorock Festival (2001) in Belgium and at the M’era Luna Festival (2002) in Hildesheim, Germany before an audience of more than 15,000 people. The band has also appeared three times at the world’s largest goth festival, Wave Gotik Treffen in Leipzig, Germany, in 2003, 2005 (during that year Anthony Cornish joined the live line-up on guitar) and 2011. 

In 2007, the band embarked upon ‘The Burden of History’ tour of Europe to mark the release of the singles collection (1992-2007) of the same name. The  EPs League of Nations (2007) and Amongst the Runes (2008) demonstrate a progression in IKON’s signature sound, providing a taster of the forthcoming album Love, Hate and Sorrow (to be released in September 2009). While retaining the essence of influences such as Joy Division, early New Order and Death in June, the future for IKON promises to add further texture to the band’s style. Love, Hate and Sorrow embraces more melodic song structures without entirely relinquishing the shadowy threads that are interweaved in the lyrics, art work, and music of one of the world’s most successful and enduring darkwave bands. The single ""A Line on a Dark Day"" from the album will also be made into the band's first video clip.
www.ikondomain.com

2) A UK collaborative project of Elliot Ireland and Alex Rizzo, the people behind the Jalapeno label. They utilise a wide range of guest vocalists and instrumentalists to create an interesting fusion of dnb, jazz, downtempo and triphop. They have released a self-titled album and at least 2 singles, 'The Dove' and 'Tricolour'. The album took a long time to make and was created in 7 different countries with 8 different collaborations, in languages such as Portuguese and English.

From the Jalapeno Records Website on Ikon:
""As for the Ikon sound it's tricky to categorise: bossa nova melodies seem to seep effortlessly into epic cinematic productions, which mutate into slick drum and bass rhythms.""
""Musically the group cites most genres as being influential to the Ikon sound, particularly jazz, funk, soul and hip hop.""
""What the hell is Ikon about? ""Happy coincidences,"" opines co-founding member Alex Rizzo with a smile."" 
""Ikon is about producing lush, imaginative music and recreating sounds in an original way. Give us a keyboard a string, synth or computer- Rolf Harris's stylophone and we'll play it- the quirkier the better. If there's a sound we wanna emulate we'll try and get the original materials: like a 60s bass and a 60s mic to get the right effect."" 
www.jalapenorecords.com

3) A religious community in Belfast with the CD ""Dubh"".

4) A since-disbanded Stratford-based metal band with the CD ""Sterilized"".

5) Ikon is a finnish thrash metal band from Kouvola, since spring 2007.

6) Ikon is a drum & bass producer duo James Smyth & Andy Walters from United Kingdom.
http://www.rolldabeats.com/artist/ikon

7) iKon (Hangul: 아이콘), stylized as iKON, is a South Korean boy band formed in 2015 by YG Entertainment. The group was first introduced in the reality survival program WIN: Who is Next as ""Team B."" After that, Team B went on to appear in the 2014 reality survival program Mix & Match, which determined the final seven-member lineup of iKon: B.I, Bobby, Jinhwan, Junhoe, Yunhyeong, Donghyuk and Chanwoo. <a href=""https://www.last.fm/music/Ikon"">Read more on Last.fm</a>. User-contributed text is available under the Creative Commons By-SA License; additional terms may apply."
171,tate mcrae,1596905,112965023,"Tate Rosner McRae (born July 1, 2003) is a Canadian singer, songwriter, and dancer. Raised in Calgary, Alberta, McRae first rose to prominence as a finalist on the American television show So You Think You Can Dance at just thirteen, showcasing her exceptional dance abilities. Following her TV success, she began sharing original songs and covers on YouTube, quickly gaining a large following for her unique voice and emotive performances.

In 2020, McRae's breakthrough single, ""you broke me first,"" achieved worldwide success, charting internationally and solidifying her as a rising star in pop music. Known for her introspective lyrics and raw vulnerability, McRae’s music often explores themes of heartbreak, self-reflection, and personal growth, resonating deeply with young audiences. Her success has since been cemented by collaborations with major artists, a sold-out tour, and continued releases that blend her emotive vocals with her polished dance background.

McRae’s early career as a competitive dancer has profoundly influenced her music career, giving her performances a unique visual element that captivates her audiences. This influence is evident in her lead single ""greedy"" off her new album, THINK LATER which draws major inspiration from dance, blending rhythmic beats and dynamic choreography to create an amazing dance-pop track.

McRae's third studio album, ""So Close to What"" was released on Feb. 21, 2025. The record has been preceded by the singles ""It's ok I'm ok"", “2 hands"" & “Sports car.” Currently, it is set to be accompanied by the ""Miss Possessive"" tour: a sold-out arena tour. <a href=""https://www.last.fm/music/Tate+McRae"">Read more on Last.fm</a>. User-contributed text is available under the Creative Commons By-SA License; additional terms may apply."
172,nicki minaj,4169164,250184588,"Onika Tanya Maraj-Petty, born December 8th, 1982, is known professionally as Nicki Minaj. Minaj is a Trinidadian-born rapper and singer based in the United States of America. Nicki Minaj is most recognized for her musical versatility, alter egos, and the animated flow of her raps. She first gained underground attention after releasing her debut mixtape, Playtime Is Over. Nicki later released two more mixtapes before her debut album, Sucka Free and Beam Me Up Scotty. Beam Me Up Scotty was later reissued in 2020. Nicki first gained public attention with the release of her debut studio album, Pink Friday. The acclaimed album sold over 375k copies first week, the second-highest first-week sales for a female rap album. Maraj is one of the best-selling artists with over 100 million records sold among her extensive discography. Minaj has two diamond-certified singles, Bang Bang and Superbass. Superbass is her best-selling single to date being twelve times certified platinum, the highest certified solo single by a female rapper. Billboard staff ranked Minaj as the top-selling female rapper of the 2010s and one of the greatest rappers of all time. Maraj has the most number-one albums (Pink Friday, Pink Friday … Roman Reloaded, and Pink Friday 2) and top-ten songs (23) in the United States for a female rapper. In 2017, Maraj broke the record for the most entries on the Billboard Hot 100 by any female recording artist, surpassing Aretha Franklin. Later in 2018, Nicki became the first female artist to surpass 100 entries on the Billboard Hot 100. She has nine music videos with more than one billion views on YouTube, Minaj became the first female rapper to do so. These videos are Side to Side, Bang Bang (Both with over 2 billion views), Swalla, Tusa, Hey Mama, Beauty and a Beat, Anaconda, FEFE, and Super Bass. She is one of the two female artists to have nine music videos reaching this achievement, tying with Rihanna. The Pink Friday 2 World Tour, also known as Gag City Tour, is the fourth solo, and fifth overall, tour by rapper Nicki Minaj. In support of her fifth studio album Pink Friday 2, released in 2023. Consisting of 79 shows across three continents in its first leg. The tour has a gross of over $81.7 million based on the first 45 shows, the tour has become the highest-grossing tour of all time by a female rapper and of Nicki’s career, and the sixth-highest-grossing tour by a rapper. Nicki Minaj finished the first leg of her tour in July 2024 and will return to America for leg 2 on September 4th, 2024. This leg will consist of 22 shows and will end on October 11th, 2024 in Queens, New York <a href=""https://www.last.fm/music/Nicki+Minaj"">Read more on Last.fm</a>. User-contributed text is available under the Creative Commons By-SA License; additional terms may apply."
173,dinos,70043,7453908,"Dinos, anciennement Dinos Punchlinović, né le 30 novembre 1993 à Douala, est un rappeur français originaire de La Courneuve, en Seine-Saint-Denis. Il est considéré par beaucoup comme l'un des meilleurs lyricistes de la nouvelle génération du rap français. 

Dinos naît le 30 novembre 1993 à Douala, au Cameroun, et arrive en France à l'âge de 4 ans avec sa famille où ils s'installent dans la cité des 4000 à La Courneuve, en Seine-Saint-Denis. Il sort son premier projet, Thumbs Up, en 2011, puis commence à se faire un nom dans les Rap Contenders, où deux MCs s'affrontent a capella.

En mai 2013, Dinos signe sur le label Def Jam France et, le 3 juin 2013, sort un EP intitulé L'alchimiste en référence au livre du même nom de Paulo Coelho.

Courant 2014, Dinos quitte Def Jam France pour Capitol Music France et sort, le 14 avril 2014, un second EP intitulé Apparences, porté par le titre Namek; lequel rencontre un certain succès.

Après une longue période d'absence sur le devant de la scène il annonce son premier album Imany qu'il ne sortira que 2 ans après. Entre l'annonce de cet album et la sortie de celui-ci, il sort Pas Imany mais presque en 2016. Dinos marque son retour le 8 décembre 2017 avec le titre Flashé. Le 30 mars 2018, il dévoile le single Les pleurs du mal. Le 27 avril 2018, Dinos sort Imany, son premier album studio. Malgré un succès critique quasi-unanime, l'album ne fait que 3.131 ventes lors de sa première semaine d'exploitation. Il faut cependant préciser que cet album est très personnel et ne comporte aucun son destiné à être un succès commercial Le 20 août 2018, il participe à Colors, émission musicale allemande très populaire sur YouTube, et livre une prestation live de son titre Argentique. Il participe au projet 93 Empire produit par Affranchis Music (Sofiane), ou il est présent sur 2 titres (Drive By feat Sadek et Ixzo et Viens dans mon 93 feat Sofiane et Hornet La Frappe). Le 7 décembre 2018, l'artiste sort une édition « Deluxe » et qui comprend 7 titres inédits, dont Placebo, qui aura un grand succès sur les plateformes de streaming.

Un an et demi après Imany, le 4 octobre 2019, Dinos sort le titre XNXX, premier extrait de son album Taciturne, qui sort le 29 novembre de la même année. Viennent ensuite les titres Mack le Bizz Freestyle et Oskur, tous deux clippés. Avec Taciturne, Dinos écoule 7815 exemplaires en 1 semaine d'exploitation. Un score honorable d'autant plus que Dinos a sorti son album le même jour que Gradur et SCH, deux rappeurs habitués aux grands succès commerciaux. cela ne l’empêchera pas d'avoir son premier disque d'or plusieurs semaines avant la sortie de son dernier album Stamina,

Le 27 novembre 2020, il publie Stamina, son troisième album. Alors que l'album a réservé son lot de surprises, notamment la présence de featurings cachés, il a aussi rencontré un franc succès, que ce soit critique mais aussi commercial. Et pour preuve, selon les chiffres de ventes annoncés par Ventes Rap, ce troisième album de Dinos s'est écoulé à 23 236 équivalent ventes en première semaine. 
 <a href=""https://www.last.fm/music/Dinos"">Read more on Last.fm</a>. User-contributed text is available under the Creative Commons By-SA License; additional terms may apply."
174,katy perry,6129368,329698808,"Katheryn Elizabeth Hudson, known professionally as Katy Perry (born October 25, 1984 in Santa Barbara, CA) is an American singer, songwriter, and television judge. The story of who was born into a totally Christian environment and who years later would become a pop music star. Muse of those who feel different or excluded, Katy Perry got her first guitar (from the church) at the age of thirteen and dreamed of it, as many young people do. The difference is that she did it. She broke free from the shackles of faith (without ever losing it) and set out to live through songs about her experiences. The result? Aside from Michael Jackson, only she was able to place five songs from the same album at the top of the charts.

 After singing in church during her childhood, she pursued a career in gospel music as a teenager. Perry signed with Red Hill Records and released her debut studio album Katy Hudson under her birth name in 2001, which was commercially unsuccessful. She moved to Los Angeles the following year to venture into secular music after Red Hill ceased operations and she subsequently began working with producers Glen Ballard, Dr. Luke, and Max Martin. After adopting the stage name 'Katy Perry' and being dropped by The Island Def Jam Music Group and Columbia Records, she signed a recording contract with Capitol Records in April 2007.

Perry rose to fame in 2008 with her second album, One of the Boys, a pop rock record containing the controversial U.S number one song ""I Kissed a Girl"" and ""Hot n Cold"". Three subsequent albums have topped the U.S. Billboard 200. The disco-influenced Teenage Dream (2010) spawned five chart-topping U.S. Billboard Hot 100 singles–""California Gurls"", ""Teenage Dream"", ""Firework"", ""E.T."", and ""Last Friday Night (T.G.I.F.)"" — a record tying her with Michael Jackson's ""Bad"". Its follow-up record Prism (2013) was inspired by her divorce, and incorporates pop and dance along with themes of self-reflection, everyday life, and relationships. With the music videos for its chart-topping songs ""Roar"" and ""Dark Horse"", Perry became the first artist to have multiple videos reach one billion views on Vevo.  Her 2017 electropop album,  'Witness' featured a political subtext and a theme of liberation. Her sixth studio album 'Smile' followed in 2020.

Perry has nine U.S. Billboard Hot 100 number one singles and has received various awards, including four Guinness World Records, five Billboard Music Awards, five American Music Awards, a Brit Award, and a Juno Award. She has been included in the annual Forbes lists of highest-earning women in music from 2011 to 2019. Her estimated net worth as of 2016 is $125 million. Perry is one of the world's best-selling music artists, having sold over 18 million albums and 125 million singles worldwide. In film, she released an autobiographical documentary titled ""Katy Perry: Part of Me"" in 2012, and voiced Smurfette in the 2011 film The Smurfs and its sequel in 2013. Her Super Bowl halftime show performance is the most watched in history. Perry also began serving as a judge on American Idol in 2018. <a href=""https://www.last.fm/music/Katy+Perry"">Read more on Last.fm</a>. User-contributed text is available under the Creative Commons By-SA License; additional terms may apply."
