,artist,listeners,playcount,bio_content
100,dj antoine,564655,5662866,"The house scene today would be unimaginable without DJ Antoine. Always well turned out and being wooed by top sponsors (Paco Rabanne, Hummer (General Motors), Campary, SKYY Vodka, Moonlight, Chupa Chups, J. Lindeberg, Y3, Podspeakers, Numark etc.), this trendsetter is also an attention-getter.

Following a 10-year sprayer career as a bad boy in Basel's hip-hop scene, Antoine was gripped by the pumpin' house wave and has ridden it to the max ever since. Antoine is an unparalleled phenomenon with over 430'000 CDs sold, 12 Golden Awards as well as his famous Houseworks and Egoïste labels, making him the leading male DJ in Switzerland. And the latest news, there are two new CD's at start: the Double-CD “DJ ANTOINE – LIVE IN ST.TROPEZ” and the CD “DJ ANTOINE – MAINSTATION 2006”, now available.

DJ Antoine also ranks among the world's elite since his triumph at the Ericsson Dance Music Award 2001. It's no wonder that he is in demand among presenters around the world (Canada, Norway, England, Holland, Germany, Austria, Italy, Spain, France, Ukraine, United Arabian Emirates, etc.) 

Along with partner and friend Fabio Antoniali – alias Mad Mark – DJ Antoine has mixed countless international hits. Many famous artists, such as Mary J. Blige, Cyndi Lauper, Roberto Blanco, Puff Daddy, P. Diddy, Robin S, David Hasselhoff and Ivana Trump collaborate with the duo and have their songs exclusively remixed by the two.

HOUSEWORKS HISTORY

Since 2000, the label Houseworks has catered and promoted its glamorous events at some of the most well-known and popular addresses in the International club scene, with fire and passion. Houseworks is characterized by its unique, representation of lifestyle and extravagant taste.

Particularly in the Swiss House scene this Label is top. Houseworks not only sets constant trends - it is the alpha and omega for all events and caters to a clientele that is stylish, opened viewed, festive, dynamic and between the ages of 18 to 35. Houseworks' inspiring members have very high standards regarding the ambience, music, luxury and lifestyle. The success of this label brings in

over 100'000 visitors annually, among them considerable prominent clients.

DJ Antoine and his partner Mad Mark tour the most prominent Swiss clubs monthly (Kaufleuten Zurich, Pravda Lucerne, Prestige Berne, Mad Lausanne, Love Boat Montreux etc.) Recently one of their goals “HOUSEWORKS GOES INTERNATIONAL“ was successfully realized with DJ Antoine‘s last CD Compilation “DJ ANTOINE – HOUSEWORKS 6 – MAKES ME CUM“. It reaches such destinations like the top metropolises of MOSCOW, MIAMI, DUBAI, KIEV and various stations in POLAND. Since established, the Houseworks label has enjoyed a large and trendy customer base.

 Together with the extreme success of the Vinyl and party label Houseworks, DJ Antoine has already released some CD Compilations under the name Houseworks, which has rapidly sold 430‘000 CD‘s and has brought in 12 Gold awards. And the latest news, there are two new CD's at start: “DJ ANTOINE – LIVE IN ST.TROPEZ” and “DJ ANTOINE – MAINSTATION 2006”, out now. 

In 2002 a successful partnership with the label Paco Rabanne was developed to market the exclusive label for Perfume. Other renowned companies recognized the advantages provided by the successful relationship between DJ Antoine and Houseworks, thus partnerships with Moonlight, Chupa Chups, Hummer, Campari, SKYY Vodka, J. Lindeberg, Y3, Numark etc. followed.

 <a href=""https://www.last.fm/music/DJ+Antoine"">Read more on Last.fm</a>. User-contributed text is available under the Creative Commons By-SA License; additional terms may apply."
101,witt lowry,242681,5903178,"Witt Lowry, may have graduated with a degree in graphic design, but it wasn't until he decided to rap for a career that he found his true passion. With gritty, urgent, and powerfully confessional rhymes, Lowry breathlessly raps cutting lines aimed at spreading hope to his fans, therapy for himself, and a little bit of boasting for good measure. He is known for working on a song until he believes it is perfect, always striving to create quality masterpieces. Witt’s dedication to perfection, high energy, and honest brand of music has amassed a battalion of fans over multiple countries and continents, who are dedicated to spreading his music to anyone that will listen. After a few mixtapes, Witt's project, ""I Could Not Plan This"" released September 2017 and hit the #1 spot on iTunes Hip Hop in all major markets around the world, as well as hitting the Billboard Top 200, Heatseekers, Independent Albums, Digital Albums & Top Album Sales Charts. He then completed a headlining, 34 date US tour and a 13 date international tour in late 2017 into early 2018. In 2019 Witt released his album “Nevers Road” where he reached #1 on Billboard’s R&B/Hip-hop Album Sales Chart as well as #1 on Billboard’s Rap Album Sales Chart. He coupled that with a 17 date international tour, a 31 date US tour, and some major festivals like Lollapalooza during the summer of 2019. In 2020 and 2021 Witt has been working on his next project, his most ambitious and passionate one yet! #TEAMWITT <a href=""https://www.last.fm/music/Witt+Lowry"">Read more on Last.fm</a>. User-contributed text is available under the Creative Commons By-SA License; additional terms may apply."
102,angèle,351526,16964435,"Angèle Van Laeken (born 3 December 1995), better known by her stage name Angèle, is a Belgian singer-songwriter, musician, pianist, record producer and actress.

Angèle Van Laeken is the daughter of the singer Marka and of the actress Laurence Bibot. She was born in Uccle, Brussels-Capital Region. Her father encouraged her from an early age to learn the piano, which inspired her musical career. Angèle spent a difficult adolescence in a strict Catholic school before attending the Decroly School. The artistic options at this high school helped develop her musical skills. She then enrolled in the Jazz Studio Antwerp for a jazz education before joining her father's band.

Angèle gave her first performances in cafés around Brussels. She was first noticed for her cover of Dick Annegarn, ""Bruxelles"", and on Instagram videos where she mixed singing and comedy. In 2017, she was the support act for Ibeyi and the Belgian rapper Damso, whom she also accompanied in his album Lithopédion. Her first single, ""La Loi de Murphy"", was released in late 2017 and received millions of views on YouTube. A second single ""Je veux tes yeux"" was released in early 2018. The two video clips were directed by the Belgian photographer Charlotte Abramow.

Angèle is a fan of Ella Fitzgerald and Hélène Ségara. She is inspired by many musical genres from French songs to electronic music and rap, which she disliked as a teenager. She became influenced by rap particularly while performing with her brother Romeo Elvis and the rappers Caballero and JeanJass. <a href=""https://www.last.fm/music/Ang%C3%A8le"">Read more on Last.fm</a>. User-contributed text is available under the Creative Commons By-SA License; additional terms may apply."
103,maes,73705,4619288,"1.) Maes, de son vrai nom Walid Georgey, né le 10 janvier 1995 à Villepinte en Seine-Saint-Denis, est un rappeur français originaire de Sevran. 

Maes naît le 10 janvier 1995 à Villepinte en Seine-Saint-Denis. Il grandit à la cité des Beaudottes à Sevran avec ses deux parents, ses cinq frères et ses deux sœurs. Maes commence à rapper à l'âge de 14 ans ; avec ses amis Radmo et SY, ils forment le groupe MSR. Après le lycée, il effectue un séjour de 18 mois à la maison d'arrêt de Villepinte de début 2016 à fin 2017. 

Durant son incarcération, Maes sort son premier projet, une mixtape intitulée Réelle Vie. Quelque temps après sa sortie de prison, il se fait remarquer avec la série de clips #MaesEstLibérable ; il assure ensuite notamment la première partie du groupe 13 Block lors d'un concert à La Bellevilloise le 10 décembre 2017. Le 2 mars 2018, le rappeur sort sa deuxième mixtape : Réelle Vie 2.0.

Maes signe sur le label Millenium, filiale de Capitol Music France, quelques mois après la sortie de ce projet. 

En juillet 2018, Maes publie la chanson Billets verts, qui remporte un gros succès et sera certifiée or en France. Quelque trois mois après, il sort Avenue Montaigne (d'après la luxueuse artère parisienne). Ce single est suivi par Madrina en collaboration avec Booba. Maes annonce alors la sortie de son premier album studio : Pure.

Tourné à Bogota, le clip de Madrina paraît fin novembre 2018. Deux jours après, le 30 novembre 2018 l'album sort. Ce premier opus s'écoule à 17 047 exemplaires dès la première semaine. Une semaine plus tard, la chanson Madrina se hisse à la tête des classements français ; elle est certifiée or ce même mois de décembre 2018 – depuis certifiée diamant. Le premier album de Maes est certifié disque d'or début janvier 2019 puis disque de platine en juillet. 

Le 17 janvier 2020, Maes publie son deuxième album : Les Derniers Salopards. Il comporte 14 titres dont trois featurings avec Booba, Jul et Ninho, respectivement sur les titres Blanche, Dybala et Distant. Ces trois titres sont certifiés single de diamant. L'album devient quant à lui disque d'or en 11 jours puis platine en un mois. Les Derniers Salopards est le troisième album le plus vendu en France en 2020 toutes catégories confondues, derrière VersuS de Vitaa et Slimane et M.I.L.S 3.0 de Ninho. 

2.)  Dubstep producer from Manchester, England. <a href=""https://www.last.fm/music/Maes"">Read more on Last.fm</a>. User-contributed text is available under the Creative Commons By-SA License; additional terms may apply."
104,marwa loud,97732,1086734,"Marwa Loud is a Moroccan-born singer/rapper, born 1996 and now living in Strasbourg, France.  She has had several successful singles starting in 2017. <a href=""https://www.last.fm/music/Marwa+Loud"">Read more on Last.fm</a>. User-contributed text is available under the Creative Commons By-SA License; additional terms may apply."
105,yeison jimenez,17569,253505,"Yeison Orlando Jiménez Galeano ( Manzanares , Caldas , July 26, 1991) is a Colombian singer-songwriter and composer of popular music. <a href=""https://www.last.fm/music/YEISON+JIMENEZ"">Read more on Last.fm</a>. User-contributed text is available under the Creative Commons By-SA License; additional terms may apply."
106,twice,1323055,367055960,"There are numerous artists who have performed under the name Twice:

1. TWICE (Korean: 트와이스; Japanese: トゥワイス)  is a nine-member South Korean girl group formed by JYP Entertainment through the 2015 reality show SIXTEEN. The group is composed of: Nayeon (나연), Jeongyeon (정연), Momo (모모), Sana (사나), Jihyo (지효), Mina (미나), Dahyun (다현), Chaeyoung (채영) and Tzuyu (쯔위). 

On February 11, 2015, Park Jin-young announced that the lineup of JYP Entertainment's upcoming seven-member girl group would be decided through SIXTEEN, a competition survival show that would air on Mnet later that year. The show began on May 5 and ended with Nayeon, Jeongyeon, Sana, Jihyo, Mina, Dahyun, and Chaeyoung as the winners. Park then announced that he would be increasing the size of the group from seven members to nine by adding Tzuyu, who was the ""audience's pick"" since she was the most popular contestant by the show's end, and Momo, who was added by Park himself since he felt the group needed someone with her performance abilities. The decision was controversial at the time with many people complaining about eliminated contestants being able to join the group.

The group debuted on October 20, 2015 with the extended play The Story Begins and title track ""OOH-AHH하게"". TWICE rose to fame in 2016 with their single ""CHEER UP"" from their second mini Page Two; the song charted at number 1 on the Gaon Digital Chart and became the best-performing single of the year. It also won the title of ""Song of the Year"" at two major music awards shows: Melon Music Awards and Mnet Asian Music Awards. Their subsequent single ""TT"" from their third extended play TWICEcoaster : LANE 1 claimed the top spot for four consecutive weeks. The album was the highest selling K-pop girl group album of 2016, which sold 350,852 copies by the end of the year. Within 19 months after debut, Twice has sold over 1.2 million units of their four extended plays and special albums.

On January 3, 2017, the music video for ""TT"" hit 100 million views, becoming the fastest K-pop group music video to do so and breaking Twice's own record previously set by ""Cheer Up"". Later in that same year, ""TT"" would also become the first video by a K-pop female act to surpass 200 million views. On January 10, JYP Entertainment announced Twice's first solo concert tour within just a year and four months after debuting in October 2015. The three-day sold-out concert titled Twice 1st Tour: Twiceland – The Opening was held on February 17–19 at the SK Olympic Handball Gymnasium. A tour across Thailand and Singapore was also scheduled after the first stop in Seoul. After the Korean leg of the concert tour, Twice released a reissue of their third mini on February 20 titled TWICEcoaster: Lane 2 along with its lead single, ""Knock Knock"". The album sold 266,645 units in February 2017 alone. The title track was regarded as one of the best songs of 2017 by many critics at the end of the year.

In April, JYP Entertainment announced that Twice would be releasing a new Korean album in May before heading to Japan. On May 15, Twice released their fifth extended play SIGNAL. The title track ""Signal"" was produced by Park Jin-young, the founder of their entertainment label. This marks their first collaboration with Park. The mini contained six tracks, including ""Eye Eye Eyes""--co-written by members Jihyo and Chaeyoung—and ""Only 너 (Only You)"" written by former Wonder Girls' member HA:TFELT.

The group officially debuted in Japan on June 28, 2017 under Warner Music Japan with the release of their first compilation album titled #TWICE. The album debuted at number two on the Oricon Albums Chart, which sold 136,157 copies within seven days, the highest first week album sales of a K-pop artist in Japan in two years. In less than two months, it sold over 260,000 copies, earning it a Platinum certification by the Recording Industry Association of Japan.

Twice released their first full-length Korean album twicetagram on October 30, along with the music video for title track ""LIKEY"". ""LIKEY"" was composed by Black Eyed Pilseung and Jeon Gun. The album had heavy contributions from the members of Twice, who helped in composing and writing lyrics for the album's tracks. The album and its lead single debuted atop both Billboard's World Albums and World Digital Song Sales respectively—the group's first number 1, making Twice the first female K-pop act to lead on both charts. They also rose on the Heatseekers Albums as the album debuted at number 10, one position higher than Signal's peak at number 11. The Christmas-inspired reissue of twicetagram, titled Merry & Happy, along with its title track ""Heart Shaker"" was released on December 11, 2017.

In 2018, the group embarked on their first concert tour in Japan titled Twice Showcase Live Tour 2018 ""Candy Pop"" on January 19 in Aichi Prefecture. They planned to have a second tour in Seoul starting May 18, but first released their fifth extended play What is Love? on April 9. The title track ""What is Love?"", once again produced by Park Jin-young, is about ""the love girls would dream about or imagine after learning about it through books, movies or dramas"" and was described as having a bright melody and uptempo dance beat incorporating trap. Members Jeongyeon, Chaeyoung, and Jihyo also took part in writing lyrics for two songs on the extended play. The EP sold 335,235 copies in first month and made TWICE became the first female artist—and the fifth act—to earn a Platinum certification by the Korea Music Content Association (KMCA), for selling over 250,000 copies of the album.

On July 9, an expanded reissue of What Is Love? named Summer Nights, along with its lead single ""Dance the Night Away"" written by Wheesung, was released. The single surpassed 100 million streams and sold 2,500,000 downloads on Gaon Music Chart, earning group's very first Platinum certification's single both streaming and download making TWICE the second act—to earn a Platinum certification for streaming, download and album by the [i{KMCA[/i] since certification were introduced on April 2018.

On September 12, TWICE released their first Japanese studio album BDZ. Its lead single of the same name was pre-released as a digital single on August 17. It was followed with their concert tour named TWICE 1st Arena Tour 2018 ""BDZ"", beginning in Chiba on September 29. The studio album was certified Platinum by the RIAJ, it was group's fifth consecutive Platinum certification in Japan. Twice released their sixth EP Yes or Yes on November 5 with a lead single of the same name. The music video of the title track Yes or Yes achieved 31.4 million views on YouTube within the first 24 hours, becoming the seventh biggest 24-hour YouTube debut of all time. They released their second Japanese compilation album #Twice2 on March 6, 2019. It was also certified Platinum from the RIAJ.

TWICE made history as the first female K-pop act to hold a Japanese dome tour, named TWICE Dome Tour 2019 ""#Dreamday"". The tour garnered a total audience of 220,000 during five shows in Osaka, Tokyo and Nagoya, and was held in March and April 2019. All 220,000 tickets were sold out within a minute after the ticket sales commenced. On April 22, they released their seventh EP Fancy You. The music video of ""Fancy"", which garnered over 42.1 million views in a single day, also reached the seventh position in the list of YouTube's biggest debuts during the first 24 hours. The release of Fancy You made TWICE the best-selling Korean girl group of all time with a total of 3,750,000 copies sold from their twelve Korean releases, surpassing the twenty-year-old record of S.E.S. In total, TWICE has sold just under seven million albums worldwide.

On June 12, 2019, TWICE released both ""Happy Happy"" and ""Breakthrough"" singles digitally. On July 17, 2019, JYP Entertainment announced the addition of a Japanese leg after reaching tens of thousands of fans on Southeast Asia and North America legs of the World Tour ""TWICELights"". They would stage 12 concerts in seven Japanese cities from October to February 2020. On the same date, ""Happy Happy"" was released physically and ""Breakthrough"" would also be released the following week. Both singles were received the Platinum certificates by the RIAJ.

On September 23, 2019, TWICE released their eighth EP, Feel Special, along with the music video for the lead single of the same name produced by Park Jin-young. The lead single scored group's second number 1 on the Billboard's World Digital Song Sales which previously hit the top spot in 2017 with ""Likey"". ""Feel Special"" also stretching group's dominance across North America as the single debuted on the Canadian Hot 100 chart at number 82—the group's first entered on the chart, making TWICE the third K-pop girl group and ninth K-pop act to appear on the chart. On September 30, 2019, TWICE broke their own first week album sales record with Feel Special, previously holding the record with Fancy You.

TWICE released their second Japanese studio album &Twice on November 20, 2019. Its lead single ""Fake & True"" was pre-released as a digital single on October 18, 2019

The group released their first official English-language single, ""The Feels"", on October 1. At the end of the single's music video, which was also released on October 1, their third Korean studio album (sixth overall) and fourth world tour were teased. On October 11, ""The Feels"" debuted at number 83 on the Billboard Hot 100, marking the group's first appearance on the chart. The song also made its way to the UK Singles Chart, where it peaked at number 80. The group's third Korean studio album, Formula of Love: O+T=<3, was released on November 12 with its title track, ""Scientist"". The album peaked at number 3 on the Billboard 200, breaking Taste of Love's record.

On November 15, the group announced five initial North American tour dates of their fourth world tour, ""III"". They embarked on the tour with a two-day concert in Seoul on December 25–26. On December 3, Twice pre-released their ninth Japanese single, ""Doughnut"", with an accompanying music video. It was physically released on December 15 in Japan. With the successful completion of their seven-date U.S. leg of the “III” World Tour which concluded on February 27, 2022, Twice became the first female K-pop act to hold two separate arena tours in the world’s biggest music market, bringing out an audience of approximately 100,000 people. Originally, only one date for LA and NY were announced, but second shows were quickly added to both cities added due to high demand after the sellout. Following the success of their US tour, Twice announced an encore concert at the Banc of California Stadium in Los Angeles, making them the first female K-pop group to headline a stadium concert in the United States. Initially announcing only one date for May 14, the group decided to hold an additional performance on May 15 following high demand. In addition, the group is scheduled to hold their Tokyo Dome concert in Japan for two days on April 23 and 24, but as the tickets were sold out at the same time as the opening sale, they added a performance on the 25th. With three sold out dates at the Tokyo Dome, Twice became the first Kpop girl group and the second girl group overall (following AKB48) to hold a three-day concert at the said venue.

 Twice's positions:
Nayeon = Lead vocalist, Lead dancer, Center, FOTG
Jeongyeon = Lead vocalist
Momo = Main dancer, Rapper, Vocalist
Sana = Vocalist
Jihyo = Main vocalist, Leader
Mina = Main dancer, Vocalist
Dahyun = Lead rapper, Vocalist
Chaeyoung = Main rapper, Vocalist
Tzuyu = Lead dancer, Vocalist, Visual, Maknae

2. TWICE was a Russian DJ who passed away in 2012. He made hits like NATALIE and KARATE (last one for his debut album back in 2005) and had a tour with the russian band Russkaja. He moved from St. Petersburg to Moscow after his success. He signed with S Sacramental Records and released an EP named TWICE IN. After that, he continued to compose music alongside famous songwriters like Amy Wadge. In 2009 he released Twicemania. He ended his tour due to health issues. He returned to St. Petersburg and played as DJ in small clubs, but was killed in a fight in 2012.

Other artists named Twice:

3. DJ, alias of Patrick Gibin
4. Dutch acoustic folk/gospel duo Doldersum/Koster
5. 80s rock
6. folk/country
7. dancehall
8. nu metal
9. German synthpop
10. ex-Trance Dance
11. techno
12. hip-hop, on Bromance Records
13. German pop
14. reggae/pop
15. indie rock
16. French-Danish rock band: Margot Poirier & Andreas Eriksen
17. italo-disco
18. new jack swing
19. German pop/schlager
20. Swedish heavy metal
21. progressive house
22. performs on ""Whut Do You Mean"" by Nate Dogg
23. Patrick Rubitschun and Stefan Schelker
24. Texan hip-hop producer <a href=""https://www.last.fm/music/TWICE"">Read more on Last.fm</a>. User-contributed text is available under the Creative Commons By-SA License; additional terms may apply."
107,gregory alan isakov,953949,28664650,"Gregory Alan Isakov (born in 1979 in Johannesburg, South Africa) is a South Africa-born American singer-songwriter. He released his first album, Rust Colored Stones, in 2003.

Isakov has been described by Boulder Weekly, ""Strong, subtle, a lyrical genius"" and has been compared to his influences; Bruce Springsteen, Kelly Joe Phelps, Iron & Wine and Gillian Welch. Isakov's humble presence and his overwhelming voice and guitar style has been treasured by an ever-growing and captivated fan base. 

Born in Johannesburg, South Africa, Isakov immigrated to the States with his family and grew up in the Philadelphia area. He started touring at the age of 16 with his first band. In 1999 he sought out his solo acoustic roots and moved to Colorado where he now resides. 

Isakov has been taking on the folk music scene with his 2003 release ""Rust Colored Stones"" LP and his 2005 release ""Songs For October"". Isakov's song-craft lends to the deepest lyrical masterpieces, and his live performance has been known to quiet and shake the biggest rooms. 

Isakov has shared the stage with numerous touring artists such as Rodrigo y Gabriela, Alexi Murdoch, and Fiona Apple. He has performed throughout the United States, playing numerous music festivals such as Falcon Ridge Folk Fest, Rocky Mountain Folks Fest and Southpark Music Festival. Isakov has toured solo and with his band ""The Freight"".

In 2007, Gregory was named ""Best Male Singer-Songwriter"" by Westword Magazine.

Subsequent albums have included That Sea, The Gambler (2007), This Empty Northern Hemisphere (2009), The Weatherman (2013), Evening Machines (2018).
 <a href=""https://www.last.fm/music/Gregory+Alan+Isakov"">Read more on Last.fm</a>. User-contributed text is available under the Creative Commons By-SA License; additional terms may apply."
