,artist,listeners,playcount,bio_content
43,jubël,256706,2265045,"Jubël is an electronic pop duo hailing from Halmstad, Sweden, consisting of Sebastian Atas and Victor Sjöström. They are currently signed to Warner Music. They began their musical careers separately before coming together as a duo. Starting in 2013, they collaborated under the name Galavant, writing, producing, and releasing music. In 2017, they unveiled their new sound and performed as Jubël, derived from the Swedish word ""jubel,"" meaning ""cheering.""

One of their earliest singles ""Illusion"" gained attention when it became part of a global campaign the retailer and fashion line H&M. But their breakthrough came in 2018 with their cover of ""Dancing in the Moonlight,"". The song was originally recorded in 1970 by Boffalongo, led by Kelly Sherman, and popularized by King Harvest. Jubël's version, featuring vocals by Neimy, initially charted in Sweden, Norway, and Belgium. However, a re-release in 2020 propelled the song to greater international success, charting on the UK Singles Chart and peaking at number 11. The track gained further exposure when it was featured in the sixth series of the reality show Love Island in 2020.

While experimenting in the studio with the melody of Toploader's 2000 version, itself a cover of the 1972 original by King Harvest, Jubël sensed its potential and enlisted the help of their friend Neimy for vocals. Despite spending several years shelved, the song garnered attention when an English guy, having heard one of Jubël's other songs, contacted them and expressed interest in listening to their music.

Following their breakthrough, Jubël released additional tracks such as ""Teenage Minds"" and ""On the Beach,"" featuring their characteristic sound with decadent guitars and floating melodies. In 2019, they released their debut album, ""Strawtown,"" followed by the ""Strawtown EP"" in 2020. Their music continued to find success, with ""Weekend Vibes"" becoming another radio hit and gaining popularity on TikTok with over 150 million video views. The duo also performed at Stockholm's Lollapalooza music festival, showcasing their talents to a wider audience.

Jubël's success extended beyond their initial breakthrough, collaborating with Israeli artist Noa Kirel and Danish international superstar Christopher in 2022. They later released ""Tripel A,"" a collaboration with American rap star NLE Choppa. <a href=""https://www.last.fm/music/Jub%C3%ABl"">Read more on Last.fm</a>. User-contributed text is available under the Creative Commons By-SA License; additional terms may apply."
44,bts,1890587,2231387939,"BTS (Korean: 방탄소년단; RR: Bangtan Sonyeondan), also known as the Bangtan Boys, is a seven-member South Korean boy band formed in Seoul in 2013. The septet co-writes and produces much of their output. Originally a hip hop group, their musical style has evolved to include a wide range of genres. Their lyrics, often focused on personal and social commentary, touch on the themes of mental health, troubles of school-age youth, loss, the journey towards loving oneself, and individualism. Their work features references to literature and psychological concepts and includes an alternative universe storyline. Popular for their live performances, the group have staged several world tours.

The group initially formed as teenagers under Big Hit Entertainment and released their debut single album, 2 Cool 4 Skool (2013). Subsequent work such as their first U.S. Billboard 200 entries The Most Beautiful Moment in Life, Part 2 (2015), The Most Beautiful Moment in Life: Young Forever (2016), and Wings (2016) helped establish BTS' reputation as a socially conscious group. Wings became BTS' first album to sell one million copies in South Korea. By 2017, BTS crossed into the international music market, leading the Korean Wave into the United States and breaking numerous sales records, becoming the first Korean group to receive a certification by the Recording Industry Association of America (RIAA) with their single ""Mic Drop"". The band is the first Korean act to top the U.S. Billboard 200 with their studio album Love Yourself: Tear (2018) and have since hit the top of the U.S. charts with their albums Love Yourself: Answer (2018) and Map of the Soul: Persona (2019), making BTS the first group since The Beatles to earn three number one albums in less than a year, and the fastest to earn three number one albums since The Monkees in 1967. Love Yourself: Answer also broke South Korea's Gaon Album Chart's all-time monthly record previously set by Love Yourself: Tear and became the first Korean album certified Gold in the United States.

According to Gaon Music Chart, BTS has sold fifteen million albums domestically and is the best-selling artist to debut in the 2010s. They hold the best-selling album in Korean history with Map of the Soul: Persona. BTS were the second best-selling artists of 2018 worldwide according to the IFPI's Global Artist Chart, as well as the only non-English speaking artist to enter the chart. The group has won Top Social Artist three years in a row and Top Duo/Group at the 26th Billboard Music Awards. Featured on Time's international cover as ""Next Generation Leaders"", BTS has appeared in the magazine's 25 most influential people on the internet (2017–2019) and Time's 100 most influential people in the world (2019), with the outlet giving them the nickname 'Princes of Pop'. Forbes Korea named BTS the most influential celebrities of Korea in 2018, and BTS ranked 43rd in the Forbes Celebrity 100 (2019) as one of the world's top-earning celebrities. During their 2019 Love Yourself World Tour, BTS became the first Asian artist ever to headline and sell out Wembley Stadium and broke the record for the single highest-grossing engagement in Rose Bowl Stadium history. BTS are worth more than $4.65 billion to South Korea's economy each year, attracting one in every 13 foreign tourists that visit the country, and are cited as one of the key acts boosting global music sales to $19 billion in 2018, a figure not seen since 2006 after digital purchases gained momentum.

Following the establishment of their Love Myself anti-violence campaign in partnership with UNICEF, BTS addressed the United Nations 73rd General Assembly and became the youngest ever recipients of the Order of Cultural Merit from the President of South Korea due to their contributions in spreading Korean culture and language. <a href=""https://www.last.fm/music/BTS"">Read more on Last.fm</a>. User-contributed text is available under the Creative Commons By-SA License; additional terms may apply."
45,george ezra,1287561,27683154,"George Ezra (full name George Ezra Barnett) is a British singer-songwriter from Hertford, England. Born on June 7, 1993, and the son of an art teacher, Ezra grew up in Hertford, attending Bengeo primary school and then Simon Balle Secondary School, before moving to Bristol, England, in 2011 to pursue a music degree at the influential music school “BIMM.” His younger brother Ethan Barnett is also a musician and goes by the name Ten Tonnes.

Ezra's music is described as deep, bluesy and mournful - particularly in tracks such as ""Budapest"" - and is peppered with influences from the likes of Bob Dylan and Woody Guthrie. Richard Pitt from BBC Bristol aptly described Ezra as ""a young man with the voice of a 50 year old”. 

Ezra appeared on the “Introducing...” stage at Glastonbury in 2013 and came fifth in the BBC’s Sound of 2014 poll. 

EP releases - 2013 & 2014
Ezra released his debut EP ""Did You Hear the Rain?"" in October 2013, with his second EP ""Cassy O'"" being released in March 2014.

First Studio Album - ""Wanted on Voyage"" (2014)
Ezra’s first studio album “Wanted on Voyage” was released on June 30, 2014. It became the third best selling album in 2014 in the UK.

Second Studio Album - ""Staying at Tamara’s"" (2018)
Ezra’s second studio album “Staying at Tamara’s ” was released on March 23, 2018. The 11-track album’s title comes from the time he spent in Barcelona writing the album, where he stayed in an apartment owned by a woman called “Tamara.”

Podcast Host
On February 12th, 2018, Ezra launched the first episode of his first podcast, “George Ezra & Friends”. On the podcast, he has interviewed several musicians including Ed Sheeran, Rag’n’Bone Man, Craig David, Hannah Reid of London Grammar and Ben Thatcher of Royal Blood.

On December 17, 2019, he launched his second podcast called “Phone A Friend” with his old friend and schoolmate Ollie MN. On this podcast, he and Ollie chat about life and their issues with mental health, in the hopes of encouraging others to do the same. 

Other
Ezra has a 1-inch scar on his forehead after running into a wall while he was a student at BIMM music college in Bristol. 


www.georgeezra.com <a href=""https://www.last.fm/music/George+Ezra"">Read more on Last.fm</a>. User-contributed text is available under the Creative Commons By-SA License; additional terms may apply."
46,james arthur,1510249,37176796,"James Andrew Arthur (born 1988) is a British singer and musician who won the ninth series of The X Factor in 2012. His debut single, Impossible, was released after the final and debuted at #1 on the UK Singles Chart on 16 December 2012 in its first week of release.
Since 2005, and prior to his participation in The X Factor, he was a vocalist and guitarist in a number of bands, and later, as a solo artist as well as forming his own The James Arthur Band and James Arthur Project.
Arthur was born in Middlesbrough, England to English mother Shirley Ashworth and Scottish father Neil Arthur. James’ father was a delivery driver, but also used to be a DJ and a drummer for many years. Arthur’s parents split when he was just two-years-old and each settled with a new partner. Neil and Shirley were not on talking terms with each other for more than twenty years. But they agreed to attend the show together in a family reunion to attend their son’s performance.
Arthur first went to Ings Farm Primary School in Redcar, North Yorkshire. When he was nine, he moved with his mother Shirley and his step father Ronald Rafferty to Bahrain where he studied at the local British School of Bahrain for four years. When they split, Arthur, then 14, had to move back with his mother and his two half-sisters Jasmine and Neve to the UK to live in a modest house in Saltburn-by-the-Sea.Upon his return, he continued his studies at Redcar’s Rye Hills School.
Arthur has five siblings, an older brother called Neil Arthur, an older sister called Sian Arthur, and three younger sisters, Charlotte Arthur and Jasmin and Neve Rafferty.
Arthur has been writing and recording songs since he was 15 as an unsigned artist both solo and in many bands including:
Moonlight Drive - a Cleveland-based progressive, experimental, rock five-piece band with Arthur in lead vocals. The band was active between 2005 and 2008. They had recordings such as «Said You’d Be There», «Hole in My Heart» and «Tear Me Apart».
Cue the Drama - an alternative rock band based in Marske-by-the-Sea and active between 2005 and 2008. Recordings included «On the Radio 98KUPD», «It’s Killing Me», «I Reach You» and «It Hurts».
Save Arcade - a Middlesbrough alternative rock band made up of Arthur (vocals, guitar), Josh Brown (keyboards, vocals), Matthew Green (guitar), Alex Beer (bass, vocals), Travis Shaw (guitar, percussions, vocals) and Karl Dowson (drums). In 2009, the band released a three-track EP called Truth, carrying the title track «The Truth», as well as «Echoes» and «I Un-Proudly Present». In June 2010, the band released a five-track EP, Tonight We Dine in Hades, which in addition to the title track «Tonight We Dine in Hades» included «Superhero», «You Always Want a Fight», «Juliet Is Not Dead» and «She Aims to Please». Both releases were on the independent 57 Records UK.
Emerald Skye - a four-piece indie pop/rock band formed in March 2011 based in Redcar / Saltburn-by-the-Sea and made up of Arthur (guitar, vocals), Dean Harrison (piano, violin), Paul Gill (bass) and Save Arcade bandmate Green (drums).
Arthur also uploaded many of his own songs to Soundcloud and YouTube including an album entitled Sins by the Sea. In 2011, he auditioned for The Voice UK and made it into the final 200 contestants but no further.
In early 2012, he recorded songs and released two EPs as The James Arthur Band. The band consisted of Arthur (vocals and guitar), Jez Taylor (guitar), Chris Smalls (keyboards), Jordan Swain (drums) and Rich Doney (bass). In 2012, the band released The EP Collection CD with nine tracks with R&B, soul and hip hop influences, a compilation of tracks on both EPs. Arthur also released an EP named Hold On under the name The James Arthur Project in August 2012 in collaboration with John McGough. The tracks were written and arranged by McGough, and mixed by Matt Wanstall with all vocals by Arthur.
Arthur auditioned for The X Factor with an acoustic rendition of judge Tulisa Contostavlos’s «Young», before explaining his past, including spells in care and time spent on the streets after break-ups within his family. He also revealed his father and mother had not spoken to each other for over 20 years, and this was a reunion of sorts for them to attend his audition. After his judges’ houses performance of «I Can’t Make You Love Me», he was picked by his mentor Nicole Scherzinger as one of the 12 contestants for the live shows, and one of just three in the «Boys» category. After the second live show, Arthur suffered from an anxiety attack backstage. Whilst being treated at the studio, paramedics determined he did not need to go to hospital, and he was ordered back to his hotel to rest. He later returned for the results show the following. Arthur was in the bottom two in week 7 after performing «Can’t Take My Eyes Off You». He sang «Fallin’» for survival against Ella Henderson, with the judges going to deadlock after their vote was evenly split 2-2 (mentor Scherzinger and Gary Barlow voting to keep him, while Contostavlos and Louis Walsh voted in favour of Henderson). Arthur was then saved by the public vote. On 8 December, he made it through to the second night of the live finals.
Arthur won The X Factor on 9 December 2012, with 53.7% of the vote, against Jahméne Douglas who received 38.9% of the vote. <a href=""https://www.last.fm/music/James+Arthur"">Read more on Last.fm</a>. User-contributed text is available under the Creative Commons By-SA License; additional terms may apply."
47,shakira,4153252,136822735,"Shakira Isabel Mebarak Ripoll is a Colombian singer. Born and raised in Barranquilla, She made her recording debut with Sony Music Colombia at the age of 13. Following the commercial failure of her first two albums, Magia (1991) and Peligro (1993), she rose to prominence in Hispanic countries with her next albums, Pies Descalzos (1995) and Dónde Están los Ladrones? (1998). She entered the English-language market with her fifth album, Laundry Service (2001), which sold over 13 million copies worldwide. Buoyed by the international success of her singles ""Whenever, Wherever"" and ""Underneath Your Clothes"", the album propelled her reputation as a leading crossover artist. Broadcast Music, Inc., described Shakira as a ""pioneer"" who extended the global reach of Latino singers.

Her success was further solidified with the Spanish albums Fijación Oral, Vol. 1 (2005), Sale el Sol (2010) and El Dorado (2017), all of which topped the Billboard Top Latin Albums chart and were certified diamond (Latin) by the Recording Industry Association of America. Meanwhile, her English albums Oral Fixation, Vol. 2 (2005), She Wolf (2009) and Shakira (2014) were all certified gold, platinum or multi-platinum in various countries worldwide. She served as a coach on two seasons of the American singing competition television series The Voice (2013–2014).

With a catalog of 145 songs, Shakira has sold over 80 million records, making her one of the best-selling music artists of all time. Forbes Colombia reported that as of 2018, she is the top-selling female Latin artist of all time. She is credited with opening the doors of the international market for other Latin artists. She has received numerous awards, including Four Grammy Awards, twelve Latin Grammy Awards, four MTV Video Music Awards, seven Billboard Music Awards, thirty-nine Billboard Latin Music Awards, twenty-one Guinness World Records and a star on the Hollywood Walk of Fame. She was named the Top Female Latin Artist of the Decade by Billboard twice (2000s and 2010s). For her philanthropic work with her Barefoot Foundation and her contributions to music she received the Latin Recording Academy Person of the Year and Harvard Foundation Artist of the Year awards in 2011. She was appointed to the President's Advisory Commission on Educational Excellence for Hispanics in the US in 2011, and Chevalier of the Order of Arts and Letters by the French government in 2012. <a href=""https://www.last.fm/music/Shakira"">Read more on Last.fm</a>. User-contributed text is available under the Creative Commons By-SA License; additional terms may apply."
48,fonseca,181209,2204648,"Juan Fernando Fonseca is a Colombian singer. His most famous song is ""Te mando flores"". He started making music at the age of 5 and by the age of 12 he had already sold 500 copies of his first song. In the year 2002 he released his album named ""Fonseca"" and the most important songs from that CD were: ""Noches de carnaval"", ""Sueño"", ""Confiésame"" and ""Magangué"". This lead him to perform with Shakira, Juanes and Carlos Vives, all Colombian singers like him. In 2005 he released his second CD named ""Corazón"" with Colombian sounds and his biggest success ""Te mando flores"" which was number 1 in Colombia for 15 weeks, and gave him a Latin Grammy in 2006 in the 'Best Tropical Song' category.

In 2008 he released his third album ""Gratitud"" which includes songs like ""Enrédame"" and ""Arroyito"" already hits in latinamerican radio stations. <a href=""https://www.last.fm/music/Fonseca"">Read more on Last.fm</a>. User-contributed text is available under the Creative Commons By-SA License; additional terms may apply."
49,maroon 5,5667780,212359604,"Maroon 5 are an American pop rock band that originated in Los Angeles, California, United States. The group was formed in 1994 as Kara's Flowers while its members were still in high school and originally consisted of Adam Levine (lead vocals, guitar), Jesse Carmichael (guitar, backing vocals) Mickey Madden (bass guitar) and Ryan Dusick (drums). Kara's Flowers signed to Reprise Records and released an album, ""The Fourth World"", in 1997. After a tepid response to the album, the band parted ways with the record label and the members attended college. Dusick and Madden stayed local at UCLA, while Levine and Carmichael relocated to the east coast to attend Five Towns College. While Levine and Carmichael were in New York, they began to take notice of the urban music surrounding them and later let the style influence the songs they wrote.

In 2001, the band regrouped, with guitarist James Valentine added to the line-up, and pursued a new direction under the name: Maroon 5. At this point, Jesse Carmichael switched to playing the keyboards and this has become his main instrument in the band (although he also plays rhythm guitar to this day). After these changes, Maroon 5 signed with Octone Records and released their debut album, ""Songs About Jane"", in June 2002. The album's lead single ""Harder to Breathe"", received heavy airplay, which helped the album to debut at number six on the Billboard 200 chart. The band won the Grammy Award for Best New Artist in 2005. For the next few years, the band toured extensively worldwide in support of Songs About Jane and produced two live recordings: 2004's ""1.22.03.Acoustic"" and 2005's ""Live Friday the 13th"". In 2006, Ryan Dusick officially left the band after suffering from serious wrist and shoulder injuries and was replaced by Matt Flynn. The band recorded their second album, ""It Won't Be Soon Before Long"" and released it in May 2007. The album reached number one on the US Billboard 200 chart and the lead single, ""Makes Me Wonder"", became the band's first number-one song on the Billboard Hot 100.

On September 21, 2010, the band released their third studio album entitled ""Hands All Over"". It was re-released in 2011 to include the single ""Moves like Jagger"" (featuring Christina Aguilera). While the original version of the album received mixed reviews, ""Moves like Jagger"" reached the number one position on the Billboard Hot 100 chart. The band released their next album, ""Overexposed"", on June 26, 2012. All four singles of the album were really successful on the charts - for example, the second single from Overexposed, ""One More Night"" (released on June 19, 2012), reached number one on the Billboard Hot 100. In 2014, the band signed with Interscope Records and released their fifth studio album, ""V"", with the very-first line-up of six official band members, as keyboardist and backing vocalist PJ Morton became an official member in 2012. The album debuted at top of the weekly Billboard 200 chart. Since its debut in 2002, the band has sold more than 15 million albums in the United States and over 100 million singles and 27 million albums worldwide. <a href=""https://www.last.fm/music/Maroon+5"">Read more on Last.fm</a>. User-contributed text is available under the Creative Commons By-SA License; additional terms may apply."
50,clean bandit,2069384,41359773,"Clean Bandit are a British electronic group formed in 2009. The band consists of Jack Patterson (bass guitar, keyboard), Luke Patterson (drums) & Grace Chatto (cello). Their sound can be described as a ""fusion"" between classical and electronial music. They produce their own music whilst inviting guest singers on their tracks.

To date they have found their biggest hits include Mozart's House and the massive UK number one single, ""Rather Be"" with singer Jess Glynne which won the 2015 Grammy for Best Dance Recording <a href=""https://www.last.fm/music/Clean+Bandit"">Read more on Last.fm</a>. User-contributed text is available under the Creative Commons By-SA License; additional terms may apply."
51,lewis capaldi,1277017,41345696,"Lewis Marc Capaldi (born 7 October 1996) is a Scottish singer-songwriter from Whitburn, a town in West Lothian.

He first rose to mainstream prominence on 8 November, 2018, with the release of his second EP Breach, including the massive hit single ""Someone You Loved"".

2019 saw ""Someone You Loved"" charting in over 29 counties and becoming a global hit.

On 17 May, 2019, Capaldi released his debut album titled Divinely Uninspired to a Hellish Extent, including his top 10 singles ""Grace"", ""Someone You Loved"", ""Hold Me While You Wait"", amongst several other songs featured in Capaldi's previous EP's.

The debut album peaked at number one in the UK and Ireland, whilst becoming the fastest-selling album of the year, and becoming certified gold in the UK just a week after its release.

In March 2021 Capaldi announced that he postponed all his upcoming shows to work on his upcoming sophomore album. He returned in the summer of 2022 to play his postponed shows, including his headlining slots at the TRNSMT Festival, the Latitude Festival, and the Isle of Wight Festival.

The lead single ""Forget Me"" from his second album, Broken by Desire to Be Heavenly Sent, was released in September 2022 and it became his first song to debut at the top of the UK Singles Chart. His frozen pizza range Big Sexy Pizza was also released later that month in the UK supermarkets Iceland and Tesco. He achieved his fourth number-one single when ""Pointless"" climbed to the top of the UK charts in January 2023. In April 2023, his documentary How I'm Feeling Now was released on Netflix.

In April 2023, Capaldi achieved his fifth number-one song on the UK Singles Chart with ""Wish You the Best"".

On 19 May 2023, Capaldi released his sophomore studio album, Broken by Desire to Be Heavenly Sent. <a href=""https://www.last.fm/music/Lewis+Capaldi"">Read more on Last.fm</a>. User-contributed text is available under the Creative Commons By-SA License; additional terms may apply."
