,artist,listeners,playcount,bio_content
0,morat,248266,16016323,"Morat is a Colombian band formed in the country's capital city, Bogotá. The band is formed by Juan Pablo Isaza (guitars and vocals), Juan Pablo Villamil (banjo and vocals) and the brothers Simón Vargas (bass and choruses) and Martín Vargas (percussion and choirs). Previously, until the end of 2016, drummer Alejandro Posada had been in the band, but the percussionist had to leave the project, being subsequently replaced by Martín Vargas.

They began to stand out internationally in 2015, when their single ""Mi Nuevo Vicio"" came out including a collaboration with Paulina Rubio, Morat received a digital platinum record, and a number 1 in digital sales in Spain, as well as a number 1 in air play in Mexico. At the same time, a topic titled ""How Much It hurts me"" with the production of Mauricio Randy (Dandee) was launched, and included in the EP ""Wood Engraving"". At the end of 2015 presents a new simple called ""How dare You"", which reaches the number 1 in itunes and led to fame in Spain.

2019-present: ¿A Dónde Vamos?
On December 13, 2019, Morat released a new song ""Enamórate de alguien más"".

On March 6, 2020, Morat released ""No Termino"", the third preview of their third album and the first of 2020. On April 2, ""Nunca te olvide"", the fourth single from the third album, was released, the video clip of the song premiered on May 1, which features some of the band’s followers. On May 22, ""Bajo la mesa"", along with Sebastián Yatra, was released, the fifth single from the third album and the first one that includes collaboration. On June 11, their collaboration with Reik came out with their song ""La Bella y la Bestia."" On July 30 they released ""Más de lo que aposté"", their second collaboration with Aitana, and on August 6, ""Labios Rotos"", which is a tribute to the Mexican band Zoé (band).

On November 7, and after more than 5 months without playing on stage, they offered a virtual concert through the Rappi Live Events platform called ""Echando un cuento."" According to the app, it was the best-selling virtual concert on the continent in 2020.

On November 13, ""Al aire"" was released, the sixth single from their third album, with its respective video clip, which was recorded in the municipality of Guasca, Cundinamarca.

On March 11, 2021, they released the single ""No hay más que hablar"". A week later, they released the single ""De cero"".

On April 15, they collaborate with Beret on the song, ""Porfa no te vayas"".

On June 3, 2021, they released a collaboration with Danna Paola. On July 15, 2021, Morat released their third studio album, ""¿A Dónde Vamos?"". That same day they released the single ""Simplemente Pasan"", along with Cami. <a href=""https://www.last.fm/music/Morat"">Read more on Last.fm</a>. User-contributed text is available under the Creative Commons By-SA License; additional terms may apply."
1,manuel carrasco,73796,1022418,"Manuel Carrasco (born January 15, 1981) is a Spanish singer who was born in Isla Cristina, Province of Huelva (Andalucía), Spain. He was one of the three finalists of the second edition of TV program Operación Triunfo and his debut album called ""Quiéreme"" sold more than 200,000 records. <a href=""https://www.last.fm/music/Manuel+Carrasco"">Read more on Last.fm</a>. User-contributed text is available under the Creative Commons By-SA License; additional terms may apply."
2,lady gaga,6569826,666265248,"Stefani Joanne Angelina Germanotta, known professionally as Lady Gaga, (born March 28, 1986 in New York, NY) is an American singer, songwriter and actress. She is known for her image reinventions and musical versatility. Gaga began performing as a teenager, singing at open mic nights and acting in school plays. She studied at Collaborative Arts Project 21, through the New York University Tisch School of the Arts, before dropping out to pursue a career in music. After Def Jam Recordings canceled her contract, she worked as a songwriter for Sony/ATV Music Publishing, where she signed a joint deal with Interscope Records and KonLive Distribution, in 2007. Gaga had her breakthrough the following year with her debut studio album, The Fame, and its chart-topping singles ""Just Dance"" and ""Poker Face"". The album was later reissued to include the EP The Fame Monster (2009), which yielded the successful singles ""Bad Romance"", ""Telephone"" and ""Alejandro"".

Gaga's five succeeding studio albums all debuted atop the US Billboard 200. Her second full-length album, Born This Way (2011), explored electronic rock and techno-pop and sold more than one million copies in its first week. The title track became the fastest-selling song on the iTunes Store, with over one million downloads in less than a week. Following her EDM-influenced third album, Artpop (2013), and its lead single ""Applause"", Gaga released the jazz album Cheek to Cheek (2014) with Tony Bennett, and the soft rock album Joanne (2016). She ventured into acting, winning awards for her leading roles in the miniseries American Horror Story: Hotel (2015–2016) and the musical film A Star Is Born (2018). Her contributions to the latter's soundtrack, which spawned the chart-topping single ""Shallow"", made her the first woman to win an Academy Award, BAFTA Award, Golden Globe Award and Grammy Award in one year. Gaga returned to dance-pop with her sixth studio album, Chromatica (2020), which yielded the number-one single ""Rain on Me"". She followed this with her second collaborative album with Bennett, Love for Sale, and a starring role in the biopic House of Gucci, both in 2021.

Having sold an estimated 170 million records, Gaga is one of the world's best-selling music artists and the only female artist to achieve four singles that each sold at least 10 million copies globally. Her accolades include 13 Grammy Awards, two Golden Globe Awards, 18 MTV Video Music Awards, awards from the Songwriters Hall of Fame and the Council of Fashion Designers of America, and recognition as Billboard's Artist of the Year (2010) and Woman of the Year (2015). She has also been included in several Forbes' power rankings and ranked fourth on VH1's Greatest Women in Music (2012). Time magazine named her one of the 100 most influential people in the world in 2010 and 2019 and placed her on their All-Time 100 Fashion Icons list. Her philanthropy and activism focus on mental health awareness and LGBTQ+ rights; she has her own non-profit organization, the Born This Way Foundation, which supports the wellness of young people. Gaga's business ventures include Haus Labs, a vegan cosmetics brand launched in 2019. <a href=""https://www.last.fm/music/Lady+Gaga"">Read more on Last.fm</a>. User-contributed text is available under the Creative Commons By-SA License; additional terms may apply."
3,melendi,270144,6025726,"His full name is Ramón Melendi Espina. Spanish pop singer with rock, flamenco, and rumba influences. Was born on January 21, 1979 in Oviedo, Asturias. 

He realized very quickly that he wasn't made for studying, but he was good at soccer. He played in the lower ranks of Astur CF, at the time a reserve team for Real Oviedo. Afterwards, he worked as a waiter in several bars and spent all night out, living experiences that would later go on to make up the lyrics of his songs. In 2001, he joined a group called ""El bosque de Sherwood"", and soon after recorded a demo with only three songs, ""Sin noticias de Holanda"", ""El informe del forense"", and ""Vuelvo a traficar"".

In February 2003, Melendi released his first solo disc, called ""Sin noticias de Holanda"" with twelve songs. In December 2003, this disc was rereleased with two new songs, ""Asturias"" and ""Moratalá"". However, he reached true fame with the 2004 Vuelta a España  chose his song ""Con la luna llena"" as its official theme. In May 2004, he started a small tour around Spain, selling 50,000 copies of his CD, making it a Gold Album.

In 2005, he released his second solo CD, ""Que el cielo espere sentao"", which has sold more than 200,000 copies. Later that same year, he rereleased the album with three new songs, ""El Nano"", ""La dama, and ""El vagabundo y Carlota"", and a Live concert DVD recorded in Oviedo. He also became a father that year, and received the Onda award for Best Song of the Year for ""Caminando por la vida"".

In November 2005, he received seven Platinum Discs for his two albums. ""Sin noticias..."" received four and ""Que el cielo..."" three.

In 2006, it was announced that he would be one of the main stars in the PSP game ""Gangs of London"". Melendi played Mr. Big, an evil gangster. He also wrote the song ""Gangs of London"" for the occasion, going on to film a video amidst police lights and sirens. The videogame was launched on August 1 of that year in the UK and on September 6 in Spain; EMI stepped in to distribute his CDs worldwide.
Melendi in Valladolid.

He also wrote the song ""Volveremos"" (We Shall Return) for Real Oviedo. The singer is also involved in the production of the film ""Vuelvo a traficar: The Film"" (I'm Dealing Again).

""Mientras no cueste trabajo"" was released on November 13, 2006 in two formats: a normal CD with 12 songs, and a special edition, with 16 songs and a DVD with extras. The disc was rereleased on September 29, 2007 with four new songs, ""Firmes"", ""El rey de la baraja"", ""La aceituna"", and ""Me gusta el fútbol"".

In 2007, he received the ""Best Tour"" award from the ""Premios de la Música"" ceremony held in Cordoba. He also did an advertising campaign for Canal+ Spain entitled ""Me gusta el fútbol"" (I Like Football), for which he wrote a song of the same name.

In 2007, he stood trial for provoking an incident while under the influence of alcohol on a flight from Madrid to Mexico City that required the pilot to return to Madrid two hours after takeoff[1][2]. He was released after testifying. Soon after, he was given the ""Left Foot"" award from Spanish radio station Cadena 100 for this incident.

Currently, Melendi directs his Blue Donkey Music company, helping young singers start their careers. He's offered contracts to four groups, Algunos Hombres Buenos, Rasel, La Dama y Belo, and Los Susodichos. This last group was nominated for a Latin Grammy for Best Rock Vocals. Algunos Hombres Buenos left the label in 2008.

On August 9, 2008 he presented his new single, ""Un violinista en tu tejado"" from his album Curiosa la cara de tu padre on Spanish radio station Los 40 Principales. The album was released on September 16, 2008. On December 12, Los 40 Principales awarded him their award for this album.

On March 17, 2009 he released a new double CD, Aún más curiosa la cara de tu padre, including the original disc and another with nine new songs and links to exclusive content on his website.
 <a href=""https://www.last.fm/music/Melendi"">Read more on Last.fm</a>. User-contributed text is available under the Creative Commons By-SA License; additional terms may apply."
4,billie eilish,3475426,606509747,"Billie Eilish Pirate Baird O'Connell (born December 18, 2001), known professionally as Billie Eilish, is a Grammy and Academy Award-winning American singer and songwriter signed to Darkroom/Interscope Records.

Born and raised in Los Angeles, Eilish grew up in a household of actors and musicians and was homeschooled along with her brother Finneas O'Connell. At the age of eight, she joined the Los Angeles Children's Choir, developing the soulful vocals that would later appear on her early singles.

After the release of ""Six Feet Under"" and ""Fingers Crossed,"" Eilish made her breakthrough with ""Ocean Eyes,"" produced and co-written with FINNEAS and released by Interscope. It surpassed 14 million online streams and spawned a number of remixes with Astronomyy, blackbear, and Goldhouse.

Eilish followed up in February 2017 with ""bellyache,"" then landed another track, ""Bored,"" on the Netflix series 13 Reasons Why. An EP, ""dont smile at me,"" featuring the singles ""COPYCAT"" and ""watch,"" followed later that summer. Her debut full-length album ""WHEN WE ALL FALL ASLEEP, WHERE DO WE GO?,"" was released on March 29th, 2019 via Interscope Records.

On January 26, 2020, she won five Grammys, including the ""big four"" awards: Album of The Year, Record of the Year, Song of the Year, and Best New Artist. On February 18th, 2020, she won a Brit Award for International Female Solo Artist and for the first time performed her James Bond's theme song ""No Time to Die,"" joined by composer Hans Zimmer, guitar legend Johnny Marr and Finneas. The theme won Eilish and Finneas an Oscar for Best Original Song. Additionally, Eilish is the youngest musician to have ever performed the theme song for a Bond's film.

On July 31, 2021, Billie Eilish has released her Sophomore Album ""Happier Than Ever,"" which broke the internet two days after its release. Eilish performed the album at the Life Is Beautiful festival, her first performance since the pandemic.

In 2024, Eilish returned with her third studio album, ""HIT ME HARD AND SOFT,"" released on May 17, 2024. The album featured hit songs like ""LUNCH,"" ""CHIHIRO,"" and ""BIRDS OF A FEATHER."" Prior to this, her introspective ballad ""What Was I Made For?,"" a track written for the Barbie movie soundtrack, won two Grammys Awards for Best Song Written for Visual Media and Song of the Year and her second Oscar for Best Original Song. This achievement solidified her place as one of the most influential artists of her generation.

Eilish's ability to merge deeply personal lyrics with innovative production continues to push boundaries, making her one of the most compelling voices in contemporary music. <a href=""https://www.last.fm/music/Billie+Eilish"">Read more on Last.fm</a>. User-contributed text is available under the Creative Commons By-SA License; additional terms may apply."
5,carolina durante,48087,3021186,"Carolina Durante es una banda madrileña formada en 2017, cuya música puede catalogarse dentro de géneros como el punk, el pop o el indie. La agrupación musical está compuesta por Diego Ibáñez, Martín Vallhonrat, Juan Pedrayes y Mario del Valle.​ <a href=""https://www.last.fm/music/Carolina+Durante"">Read more on Last.fm</a>. User-contributed text is available under the Creative Commons By-SA License; additional terms may apply."
6,sebastian yatra,531346,11586069,"Sebastián Obando Giraldo (born 15 October 1994), known professionally as Sebastián Yatra, is a Colombian singer and songwriter. He began as a Latin pop artist and has recorded many ballads, but has released several successful reggaeton singles. Yatra is noted for his romantic lyrics, melding traditional lyricism with modern reggaeton influences. He rose to prominence in Latin America in 2016 when he released the hit ""Traicionera"". He has released three studio albums and recorded with artists from a diverse range of musical genres throughout his career.

Born in Medellín and raised primarily in Miami, Yatra began singing at a young age and returned to Colombia to begin his musical career. He achieved breakout success with ""Traicionera"" followed by ""Robarte un Beso"" featuring Carlos Vives. ""Traicionera"" served as the lead single for his 2018 debut album, Mantra, which also featured the single ""Sutra"", featuring Puerto Rican rapper Dalmata. He then released the album Fantasia including the lead single ""Un Año"" featuring Mexican band Reik. He received continued success collaborating with Daddy Yankee, Natti Natasha, and the Jonas Brothers on the bilingual single ""Runaway"".

Yatra's music has been classified as Latin pop, reggaeton, and ballads. According to The Fader, Yatras music lands ""somewhere in between the olden times’ sappy romantics and the new wave’s sensuous vibras.""He is influenced by Latin pop and reggaeton artists Ricky Martin, J Balvin, Juanes, and Reik. In an interview with Billboard, he expressed a desire to collaborate with Italian opera singer Andrea Bocelli. Yatra believes that contemporary musicians commit an ""error in associating ballads with boring and slow and old"", and hopes to rejuvenate intererest in ballads for a younger audience.However, his music contains elements of other genres; Desire Thompson of Vibe described his song ""Traicionera"" as a ""trap-EDM blend"".

Despite growing up in Florida and being fluent in English, Yatra sings almost exclusively in Spanish. Yatra explains, “My goal was always to be a singer in Spanish. And I really wanted to understand where I come from and live it. A lot of times I went to Colombia and, even though I spoke Spanish and was always speaking Spanish with my parents, I still felt like an outsider. I wasn’t 100 percent part of it. I wanted to give my roots the importance they deserve. ”His June 2019 song ""Runaway"" was his first foray into bilingual songwriting. In December 2019, he collaborated with South Korean boy group Monsta X for the song ""Magnetic"", which features verses from Yatra in Spanish and a bridge from Monsta X in Spanglish. Sara Delgado of Teen Vogue called the song a ""truly international pop hit"". <a href=""https://www.last.fm/music/Sebastian+Yatra"">Read more on Last.fm</a>. User-contributed text is available under the Creative Commons By-SA License; additional terms may apply."
7,nacho,125066,1087751,"José Ignacio Torres nace en Santiago el 17 de junio de 1986. Su afición a la música viene desde niño, su padre lo hacia escuchar mucha, llegando a cantar algunos boleros junto a el en su infancia. A los 15 o 16 años su afición se volvio un poco más firme, aprendió a tocar guitarra, lo cual facilitó la inmersión en la musica. Más o menos hace 3 años, ""Nacho"" como le dicen todos sus amigos, transformo su aficion al canto en algo más serio, tras participar en el disco "" dejando huellas"" de mc Beiser, en el cual participaron tambien quienes trabajan en la produccion de sus temas. Actualmente Nacho estudia Pedagogía en música, en la Universidad Mayor de Santiago, paralelamente trabaja en la grabacion de su Primer disco "" Cosas Sencillas"" el que esta compuesto en su totalidad por él y producido por el músico Cristobal Vargas [tiei e Imaabs] en conjunto a Juan Patricio Faundez [dj two faces] quien es el ingeniero a cargo y Alvaro Severino[yuyo de negro quinteto], quien  estará a cargo de las guitarras. El disco se espera para el mes de mayo y será editado por Neurotyka.

http://myspace.com/soulnash
http://myspace.com/tiei
http://myspace.com/imabs
http://myspace.com/djtwofaces
http://myspace.com/alvaroseverino

http://www.neurotyka.org <a href=""https://www.last.fm/music/Nacho"">Read more on Last.fm</a>. User-contributed text is available under the Creative Commons By-SA License; additional terms may apply."
8,ozuna,738304,20793921,"Juan Carlos Ozuna Rosado (born March 13, 1992), known simply by his surname Ozuna , is a Puerto Rican Latin trap and reggaeton singer who is regarded as the "" New King of Reggaeton"". He has released two successful albums Odisea (2017) and Aura (2018), and since the beginning of his career, he has sold around 15 million records, making him one of the best-selling Latin music artists of all time. He made his acting debut in the film Que León. <a href=""https://www.last.fm/music/Ozuna"">Read more on Last.fm</a>. User-contributed text is available under the Creative Commons By-SA License; additional terms may apply."
